Paragraph,Page number
"36372.1Sounds and PhonemesIn this section I discuss different techniques that were employed in establishing
whether a particular sound is a phoneme in this language. I also present the
methodological principles adopted.
The sound inventory of Jarawa contains 41 sounds, of which 28 are consonants
and 13 are vowels. However, it is difficult to claim that all the sounds are
phonemes in this language, for it is difficult to provide minimal pairs for every
pair of sounds in order to establish the phonemic status of a particular sound.
Even so, I have made an attempt to provide minimal pairs wherever the corpus
contains such data. The main problem in researching the sound system of Jarawa
is that we are not able to claim with authority that a particular sound is a
phoneme in this language, because the language demonstrates considerable
variation. Since there is a lot of variation at the level of sounds, it is pertinent to
discuss this aspect first. There are instances where two pairs of sounds, for
example /p/ and /b/ can be used interchangeably in the words like bəᵼʈʰe ‘go’. The
word bəᵼʈʰe can be pronounced as pəᵼʈʰe. Since we have minimal pairs which
demonstrate that these two sounds are phonemes in this language, we may
deduce that in such words they are in free variation. But in the case of palatal
plosives /č/ and /ǰ/ it becomes hard to decide whether they are phonemes or they
are allophones of the phone /č/ since we lack minimal pairs.
We can deduce from the preceding observation that whether a sound is a
phoneme or allophone is not always distinct. This difficulty arose during
research mainly due to lack of minimal pairs for each pair of sounds. Further,
those pairs of sounds which have minimal pairs also demonstrate some variation
3738in the words. In order to assert a conclusive result in such circumstances we
needed to enquire the phonological knowledge of speakers. Phonological
knowledge of speakers contains the phonological contrast which amounts to
minimal pairs. However, when a community is monolingual, it becomes difficult
to decipher every aspect of phonological contrast for each phoneme. In this
context it is important to state the methodological principles adopted to identify
phonemes. Four methodological principles were employed to state the phonemic
status of a sound in this language.
1. Phonological contrast: This highlights whether the particular sound is
contrastive in nature by looking at minimal pairs. There are some pairs of
sounds which have minimal pairs.
2. Variability among sounds: If there is no minimal pair for a pair of sounds,
an attempt was made to find out if there is any variability between the
sounds; and, if it exists, what the contexts of occurrences are for those
sounds in the language. If there is any variability and if it is difficult to
claim the phonemic status of the sounds, I have adopted pattern congruity
as the method to support the claim; for example in the case of the sounds
/č/ and /ǰ/.
3. Distribution of sounds: I have also made an attempt to investigate the
distribution of sounds at syllable level and word level. Examining the
occurrences of sounds at different levels assists in determining whether
the variability of the sounds is due to some kind of conditioning
(phonological or lexical) or it is an idiolectal variation.
4. Statistical criterion: Since some pairs of sounds show alternation among
themselves, it becomes difficult to infer which sound has the actual
representation in the words. To determine the actual representation of
3839sounds in words, I have adopted a statistical criterion where the
frequencies of occurrences of two sounds are evaluated.That is, if one
sound is used more frequently in a word than the other, the former is
considered to be the phoneme, and latter an idiolectal variation. This
criterion is employed if there is no viability of having definite sets of rules
which apply to a set of data to claim the allophonic status of certain
sounds.
2.2Phonemic ContrastsIn this section, I will attempt to provide minimal pairs to establish the phonemic
status of vocalic and consonantal sounds wherever it is possible.
Vowels in this language can be classed in three groups: two front vowels, two
back vowels and three central vowels. The front vowels are [i] and [e], back
vowels [u] and [o], while the central vowels are [ᵼ], [ə] and [a]. There are also two
mid-low vowels, [ɛ], and [ɔ], but their phonemic status is not clear. Their
occurrences in the data of our corpus are limited, and I could not obtain any
minimal pairs. Length is also phonemic in this language; hence we have short
and long vowels. However, no length distinction was found in the case of the
high-mid central unrounded vowel. Thus we have 13 vowels. Some nasalized
vowels were also found, but their phonemic status can not be established in the
present work.
Among the 28 consonants, there are voiced and voiceless plosives along with
voiceless aspirated plosives. Sounds like nasals, trill and retroflex flap, lateral
and retroflex lateral also occur in this language. There are two approximants,
labial and palatal. There are also a few fricatives like pharyngeal fricative, and
3940bilabial fricative. Two labialised consonants exist, pharyngeal fricative, and
voiceless aspirated velar plosive.
2.2.1VowelsJarawa exhibits the basic seven vowel system which is illustrated in table 2.1.
Table 2.1: Jarawa vowel phonemes
Front
HighiHigh-mid
Mid
LowCentralBack
uᵼ
eəoaThis basic seven vowel system can further be categorized into two groups: one
which has qualitative contrasts in itself and another which contains quantitative
differences. In qualitative difference, Jarawa employs three way distinctions in
the height: high, mid, and low; three way distinction of tongue position: front,
central, and back; and two way distinction in the position of lips: rounded and
unrounded. There is one vowel which may be categorized as a high-mid central
unrounded vowel [ᵼ]4. The minimal pairs and sub-minimal pairs are given in the
next section to demonstrate their phonemic contrasts.","[54, 55, 56, 57, 58]"
"1571584.3.3Transitive clausesTransitive clauses are headed by transitive verbal predicates and have two core
arguments, A and O. In such clauses, A precedes the O, and O precedes the verb.
The structures of transitive clauses vary according to the object NP: it will have a
different structure if the object NP is headed by a noun, or headed by a
pronominal. The verbal predicates can bear different prefixes based on the object
NP. If the object NP is headed by a definite noun or indefinite but specific it will
take referential marker ɖi. If it refers to an indefinite noun, it will take prefix {h-}.
If a pronoun heads an object NP, there will be neither referential marker ɖi nor
prefix {h-} on the verb; rather, the pronoun may be prefixed to the verb. The
structure of a transitive clause is below (4.38) and illustrated by (4.39).
(4.38) [Subject]NP [Object]NP {[REF]}VerbTR]]VP
(4.39)mihʷəwət11-ita-b1boarREF-eat-NVEVDI/we ate the wild boar.
If the object of a transitive clause is a pronominal and the transitive verb starts
with a vowel, the object pronominal is generally prefixed to the transitive verb
(for prefix forms see § 3.3.1.1). The example (4.40) demonstrates the prefixation of
pronominals with the transitive predicates.","[175, 176]"
"Inthecaseofdefiniteness/referentiality this morpheme was usually employed with S or O. The
use of the morpheme with A was rare if S or O were found to be230231definite/referential. Thus, this morpheme conveyed grammatical relations in the
context of definiteness/referentiality. With an indefinite object this morpheme
was not employed with S, O, or A.
Typologically, this language was found to be SOV. Postpositions were found.
Descriptive adjectives and manner of adverbs follow the head while numerals
and demonstratives precede the head. In the comparative degree, the marker of
comparison follows the standard of comparison. The copula precedes non-verbal
predicates in copula constructions. Negative particles or suffixes appear at the
end of the clause.","[248, 249]"
"7980This raises the question as to whether the hypothesis that “mi” forms are subjects
and “ma” forms are objects is valid. It is also difficult to say whether it is an
idiolectal variation. In the present study there is no answer to this issue.
However, the usage of “mi” forms in object position is limited to a few instances
in the present corpus. Also, as far as “ma” forms are concerned, they can never
occur as subject of the clause. Thus, we assume in the present study that the
distinction between these forms is as hypothesised.","[97, 98]"
"9394Table 3.9: Names of cultural artefacts
English glossJarawa word1.bowa:w2.arrowpa:ʈʰo3.wooden basket for honey collectionu:hu4.knifeto:wa:ɖ5.rope/padobow string/
knitting fibre
6.fishing netpatʰo7.net basketpotʰo8.basket made out of caneta:ɽka9.cooking vesselbu:čʰu3.3.2.1 Gender
Jarawa lacks grammatical gender; thus there is no inflection for gender, nor is
there any gender agreement within the Noun Phrase. However, the language has
different lexical items to indicate the (natural) sex of an object. The examples in
(3.24) demonstrate the occurrence of nouns in different genders. In (3.24), the
words əŋka:w ‘old man’ and əŋka:ja:b ‘old woman’ as well as ta:hwə ‘bachelor’ and
ta:hwəja:b ‘spinster’ indicate that the form {-ja:b} represents feminine gender.
9495However, the use of ja:b was found in only these two pairs of words, preventing
any definitive statements on the matter of gender in Jarawa.
(3.24)man/əŋa:gi/old manwoman/əŋa:b/old woman /əŋka:ja:b/boy/tawə/bachelor/ta:hwə/girl/do:jə/spinster/ta:hwəja:b//əŋka:w/3.3.2.2 Number
Countable nouns in Jarawa are classified as singular and plural where singular
denotes a single entity and plural indicates more than two entities. To express
singular number, Jarawa makes use of zero marking while to denote plural, the
language employs the suffix {-le}. The examples in (3.25) and (3.26) illustrate
number marking in Jarawa.","[111, 112, 113]"
"Three properties are observed in cases when the indirect IO follows the DO: (a) ɖi
moves with the DO; in other words, ɖi comes just after the DO; (b) the verb may
take co-referencing prefix {h-} which refers to the DO (for detailed discussion, see
§ 3.4.1.1.4); and (c) if a pronominal is the IO and happens to be adjacent to verb
beginning with a vowel, this pronominal never gets prefixed to the verb.
Prefixing the IO to the ditransitive verb results in ungrammaticality of the
sentence as shown in (4.47).
(4.47) * minapoɖiŋ-ija1fishREF2ACC-giveI/we gave you the fish.
If the indirect object is a lexical noun phrase, this noun phrase also takes ɖi, as
shown in (4.48).(4.48) minapoɖitopo ɖih-ija1fishREFTopo REF3-giveI/we gave Topo the fish.",[179]
"These examples show “mi” forms in the subject position and “ma” forms in the
object position of the clause. However, examples like (3.10) show that mi forms
may also be used in the object position of a clause.
(3.10) minapoŋih-ija1fish23-giveI gave you a fish.",[97]
"142143CHAPTER 4: SYNTAX4.0 Introduction
The preceding chapter was a detailed study of Jarawa morphology. The present
chapter attempts to describe the syntactic structure of Jarawa: syntactic strategies
(how the language conveys commands, requests; the formation of questions, the
use of Reported Speech, and so on) and clause structure. The chapter will
elaborate these structures and their variances.
The chapter is organized in the following manner. In section 4.1, I present a brief
introduction to Jarawa clause structure. Section 4.2 discusses the verbless clause
in which a nominal or an adjective may play the role of a predicate. In section 4.3
is a detailed discussion of the verbal clause with core argument. Section 4.4
discusses verbal clauses with peripheral arguments. Section 4.5 focuses on the
negative construction, and section 4.6 describes imperative structures (includes
commands, requests, and prohibition). Section 4.7 concentrates on how
interrogative constructions are formed: it further focuses on yes/no and whquestion types. In section 4.8, complex sentences are discussed, and a close
examination of direct speech is presented. Section 4.9 attempts to depict the
function of definiteness/referential morpheme {ɖi} which seems to be used in the
ergative-absolutive system. Section 4.10 presents the conclusion of the chapter.
4.1 Clause Structure
Jarawa employs two types of clausal structures: verbless clauses where nominals
or adjectives function as head of the predicate; and verbal clauses where verbs
143144are the head of the predicate, with core arguments and/or peripheral arguments.
Both types of clauses have different morphological and syntactic structures.
Verbless clauses generally lack modality categories which are part of verbal
clauses.
Verbless clauses (nominal predicates and adjectival predicates) contain nouns or
adjectives as the head. Morphologically, adjectival predicates differ from
nominal predicates at least in terms of affixation, but cannot be classified as
verbal predicates for they combine with a marker {–g} which differentiates
adjectival predicates from nominal predicates. I have made an attempt to
investigate whether the morpheme {–g} is equivalent to the suffix {–g} which is
attached to verbal predicate. It has been observed that no other suffixes, which
can be attached to verbal predicates, can be attached to adjectival predicates. In
the case of nominal predicates there is no prefixation of S argument pronominals,
but in adjectival predicates such prefixation is possible in cases where adjectival
predicates begin with a vowel. Otherwise, adjectival predicates follow the
syntactic structure of nominal predicates.
The copula can be the head of a predicate; it takes modality suffix. Data in the
corpus, at this point, is limited to only one sentence. Thus it is difficult to
ascertain whether the copula should be considered as a predicate. Moreover, it
has another function in the syntactic structure of the language: it is sometimes
used with verbs used to indicate adverbial function (detailed discussion in § 3.8).
In this dissertation copula constructions are described under verbless clauses.
Clause structures are also defined in terms of the arguments. In verbal clauses,
the core arguments S (subject), A (agent), O (object) are defined in terms of the144145Subject of intransitive verb, Agent of transitive verb and Object of transitive verb
respectively.
4.2 Verbless clauses
The two types of verbless clauses — nominal predicates and adjectival predicates
— differ morphologically and syntactically. Nominal predicates do not bear any
morphological marking, whereas adjectival predicates can have morphological
marking.
4.2.1Nouns as head of verbless clauseWhile verbal predicates take modality and evidential categories as suffixes, and
adjectival predicates may also take a suffix (for detailed discussion see § 3.5 and
§ 4.2.2.3), nominal predicates never take such suffixes. Also, unlike verbal and
adjectival predicates, pronominals are not prefixed to S argument of nominal
predicates.
Nominal predicates have two different kinds of structures depending on whether
the S argument is a noun or a pronominal. If a pronominal is the S argument of
the nominal predicates, the clause is formed by juxtaposition, i.e. the pronominal
followed by the nominal predicate. If a noun is the S argument, the copula ʈʰi is
employed in the clause.
4.2.1.1 Pronominal as S argument of nominal predicate
Nominal predicates can have a pronominal as the S argument of the clause.
When a pronominal is the S argument of the clause, the pronominals preceding
the nominal predicates are juxtaposed. The structure of a verbless clause in the145146case of a pronominal being the S argument of a nominal predicate is given in
(4.1).
(4.1) [S]PRO[VL P]NPIt must be noted that the copula ʈʰi can never be used in such clauses.
Furthermore, the pronominal is never prefixed to the nominal predicate in such
constructions. For instance, in example (4.2), mi is the first person pronoun which
is the S argument of the nominal predicate əŋ, thus we have “mi əŋ” without
prefixing the pronoun to the predicate nominal. It seems that such distinction is
necessary to maintain since there is prefixation of the pronoun to the nouns in
possessive constructions (for detailed discussion see § 3.3.2.4).
(4.2)miəŋ1JarawaI am/we are Jarawa.","[160, 161, 162, 163, 164]"
"Interestingly, the copula verb never occurs with pronominals. The examples in
(5.27) and (5.28) demonstrate that when the subject of such constructions is a
pronoun, the constructions are formed by the juxtaposing the subject and the
nominal predicate. Thus, the copula construction is possible only when the
copula subject is a nominal headed noun phrase; see examples (5.29) and (5.30).
(5.27)miəŋ1JarawaI am/we are Jarawa.(5.28) mi
1čew
goodI am fine.(5.29) uʈʰa
UʈʰaʈʰihuʈʰuCOPfatUʈʰa is fat.
212213(5.30) tenmej
TenmeyʈʰiəŋCOPJarawaTenmey is Jarawa.","[230, 231]"
"3.4.6.3 Co-referencing element {hi-}
The third person pronominal is employed to co-refer with a third person object
nominal of the clause. This pronominal is prefixed to the verb. It has different
allomorphs, {hi-}, {ih-}, {ihi-}, {əhi-}, and {h-}. It can also be used to refer to
indefinite objects. In the sentence (3.79), {ih-} is used as 3rd person pronoun which
refers to an object. In (3.80), {h-} is employed to co-refer with the noun iŋ ‘water’.
iŋ is here indefinite because it is not within sight. In (3.81), {h-} co-refers with the
nominal conel ‘banana’ which has moved to second position. In (3.82), there is no
{h-}, because {ɖi-} has been prefixed to the verb.",[136]
