Paragraph,Page number
"12date is just >2000 years old and there are no artefacts to suggest contact or trade
with the world outside the archipelago (Cooper 1993). Native islanders’
relationship with Palaeolithic colonizers and their isolation from outside world
for longer times have been the subject of interest and inquisition of scientists,
anthropologists, archaeologists, human evolutionists and linguists for centuries.
Though, the focus of the present study is the Jarawa language and people using
this language, it will be difficult to understand this community in isolation; the
reason being that the different communities of the islands have witnessed
conflict and contact with the outside world at different stages of history which
had affected all of them individually and collectively in varying ways. Thus, in
order to understand Jarawa, their habitat, and their plight in the course of
history, it is necessary to explore the geography of the islands and examine the
historical stages of the region with special reference to all the indigenous
communities of Andaman and Nicobar Islands.
The present chapter concentrates on a brief discussion of the islands, its history,
and native population. Section 1.1 presents a geographical description of the
islands. Section 1.2 discusses the demography of the Islands with reference to
Non-Autochthons (non-indigenous) population of the islands. The history of the
islands is discussed in Section 1.3. Section 1.4 presents a brief introduction of the
natives of the islands. Section 1.5 focuses on Jarawa, their physical characteristics,
social structure and customs, as well as tools and artefacts used by Jarawas.
Review of literature is provided in Section 1.6. Section 1.7 depicts the
methodology adopted for fieldwork in the Andaman Islands. The organization of
this dissertation is discussed in Section 1.8.","[19, 20]"
"In example (4.109) below, itʰəgə ‘cut’ is a transitive verb, so it takes an object NP;
this object NP takes definiteness marker ɖi. This entire verb phrase can be
considered as a clause, although the example in (4.109) differs from (4.107). In
(4.107) both the verbs take the evidentiality suffix whereas in (4.109) only the
main verb takes the evidential suffix. However, the absence of the suffix in
(4.109) does not pose any problem to the analysis of the clause, instead the verb
178179in (4.109) bəᵼʈʰe which is intransitive. In intransitive constructions, the subject NP
takes ɖi if headed by a noun; if headed by a pronoun, it does not take ɖi. ɖi
always follows the NP it refers to. Thus, the ɖi in (4.109) does not refer to the
subject NP; for the subject NP is headed by a pronoun, and it is too far away
from the subject NP (see § 4.9 for conditions for the use of ɖi). Here it means
refers to the dependent clause, or what we can call the clause internal
complement clause.(4.109) taŋɖ-itʰəgəɖ-əᵼʈʰe-jə (ɖi-bəᵼʈʰe-jə)treeREF-cutREF-go-VEVDI will go for cutting wood.","[196, 197]"
"3.3.3.2 Alienable
Nouns other than body parts and kinship terms are alienable nouns in Jarawa.
Possession of an alienable noun is expressed by prefixing a possessive pronoun,
as shown in (3.35–3.37).(3.35) mičaɖɖa1POSS hut
My hut.(3.36) ŋičaɖɖa2POSS hut
Your hut.
99100(3.37) wa
3POSSčaɖɖa
hutHis/her hut.
If there are two nouns where one is possessor and the other is possessed, then the
structure is possessor + 3POSS + possessed as given in (3.38).
(3.38) innen
Non-Jarawawačaɖɖa3POSShutNon-Jarawa’s hut3.3.4Noun PhraseThis section presents a detailed examination of the constituents of the Noun
Phrase which may include demonstratives, numerals, adjectives, and other kinds
of nominal modifiers.
3.3.4.1 Basic Noun Phrase
The noun phrase in Jarawa consists of a noun and optional modifiers like
genitives, numerals, descriptive adjectives, and adverbs. Numerals and genitives
precede the noun while descriptive adjectives follow the nouns. Adverbs follow
the adjectives. The schema of a noun phrase is presented in (3.39) and illustrated
in (3.40).
(3.39) [Demonstrative] [Possessor] (Numeral) {(POSS)-(Noun)} (Adj (Adv)]100101(3.40)minajapaʈʰo-leuʈʰuʈʰuhumə1POSStwoarrow-PLbigveryMy two very big arrows.
In this construction, mi functions as possessor which is also used as a possessive
marker, so {mi} serves for both possessor and possessive prefix. But if the
possessor and the possessed are both nominals, the possessive prefix will get
attached to the possessed noun and the order of noun phrase will be as
illustrated in (3.41).
(3.41)innennajawa-paʈʰo-lehuʈʰuNon-Jarawatwo3POSS-arrow-PL bigʈʰuhumə
veryNon-Jarawa’s two big arrows.","[117, 118, 119]"
"The sentence (3.99) can also mean only the phrase ‘these arrows’. It is difficult to
syntactically assess whether (3.99) is a clause or a phrase. If this phrase is
employed as a subject or an object of a clause, then it can be interpreted as a
demonstrative adjective. For instance, in example (3.100), luwə paʈʰo-le ‘those
125126arrows’ is an example of a demonstrative adjective as this entire noun phrase is
used as an object of the clause.
(3.100)luwəpaʈʰo-leDEM-Aarrow-PLɖ-eŋge
REF-bringBring those arrows.
3.5.3Degree of adjectivesJarawa differentiates between degrees of comparison. The language displays
positive, comparative, and superlative degrees. The degree of comparison is not
expressed morphologically. Rather, syntactic strategies are employed to express
degree of comparison. Positive degree is formed by using noun and adjective,
illustrated by (3.101).","[143, 144]"
"3233The structured method was adopted only in restricted cases. There are two
things to be noted in this regard: the structured method was adopted while
pictorial method was employed, i.e. collecting data with the help of pictures; and
there was an attempt to verify the data.
1.7.2.3.2. Systematic observation
Participant observation
In order to collect linguistic data in a monolingual community, participant
observation is one of the significant methods. This method not only allowed me
to observe the way they speak, but also provided me an opportunity to know
how they perform other activities. It also helped me note down the conversation,
and its context. Moreover, it helped consultants get rid of their hesitation in the
presence of an outsider, since Ibecame a part of their daily lives. This provided
me the opportunities to learn many things about their social and cultural norms
without disturbing them. Throughout my fieldwork in the Andamans, I adopted
participant observation method along with other methods which are described in
§ 1.7.4.
1.7.2.4 Field Procedures
I followed different techniques to collect data in the field. These techniques
included pictorial method, showing objects to them to know the name of those
objects; listening to their conversations, and recording those conversations. In the
initial phase, carefully listening to their conversations, recording pieces of
conversations, and listening to those conversations back home where I used to
stay were the major steps I took. This helped me accustom my ear to the sound
system of the language. Meanwhile, I started collecting data with help of pictures
3334related to body-parts, birds, animals, fish etc. It was followed by noting words by
pointing to objects that were lying around. I also attempted to list words related
to daily activities such as run, walk, sleep, eat, drink etc. by pointing to these
activities if somebody was enacting them. Moreover, I kept noting down simple
sentences which I could understand (after collecting some data). I also noted the
contexts of sentences/conversations. As time passed I picked up the language
and tried to speak small phrases. This gave me an opportunity to learn, converse,
and collect further data on the language.
1.7.3 Limitations of the study
Despite all the efforts made by me to elicit maximum amount of, there were
limitations to this study. Firstly, there was a very limited amount of time
available to be in contact with the community. As mentioned earlier, the
condition that AAJVS staff must be present at all times caused a severe
restriction of contact between the researcher and the consultants. Secondly,
whenever the group of Jarawas stayed far away from the road side along the sea
shore, contact with Jarawas depended on the short visits made available with
AAJVS staff. It is true that I was totally dependent on the mercy of the AAJVS
staff. Thirdly, it had, always, been a problem and challenge to obtain data from a
monolingual community to write a descriptive grammar. I am aware that there is
a lot of grammatical information which may have escaped my attention. Readers
will also agree with me that it is not possible to unearth each and every
grammatical information of the language in a limited time period. Hence, this
work is a modest attempt to present a descriptive grammar of the Jarawa
language from a typological point of view based on the data I could elicit from
my consultants during the period of my stay at Great Andaman.","[50, 51, 52]"
"3.4.6Function of prefixesThere are three types of prefixes generally attached to verbs. One is the
pronominal, which, when attached to a verb as prefix, has two different
functions: (a) subject of intransitive verb or object of transitive verb, or (b) coreferencing element. Only third person pronouns can be used as co-referencing
elements. These two different functions of pronominals are described here as two
different prefixes.",[134]
"116117Another element which can be prefixed to a verb is referential/definiteness
marker. Usually part of a noun phrase (S or O argument of a clause), it can attach
to a verb as a prefix when there is no intervening element between the
referentiality marker and the verb.
3.4.6.1 Pronominals
Pronominals in Jarawa are more likely to be prefixed to verbs that start with a
vowel. Subject pronominals attach to an intransitive verb while object
pronominals attach to a transitive verb. If the verb is ditransitive, neither subject
nor indirect object pronominals attach to the verb. The nature and distribution of
these pronominals have been discussed in detail in § 3.3.1.1. Therefore, in this
section we will concentrate only on the use of the definiteness/referential marker
and co-referencing marker.
3.4.6.2 Referential/definiteness marker {ɖi-}
It seems that there are different functions of {ɖi-}. Sometimes it denotes
referentiality and sometimes definiteness. Though referentiality and definiteness
are similar concepts, I discuss separately, to distinguish between references made
to the visual (within sight of speaker-hearer), and non-visual (indefinite object;
its reference is derived from the preceding context). The former uses the
referential marker and the latter the definiteness marker. For instance, in (3.78),
iŋ ‘water’ refers to water within sight of the speaker-hearer.","[134, 135]"
"228229To express negation, this language makes use of an independent word naɖem
after a predicate (verbal or verbless), or a suffix -ma on a verb. There was no
semantic difference observed between the two. We saw that the independent
word naɖem could be used across the board while the suffix -ma had restricted
use.
Imperatives are formed by using the verb with its core argument. As we saw,
there is no morphological marking to differentiate imperatives from other kinds
of sentences.
In interrogatives, we looked at yes/no questions and wh-questions, which differ
syntactically. Yes/no questions are formed by placing the interrogative marker ka
at the beginning of a clause, while in wh-questions the wh-word occupied its situ
position. The use of the interrogative marker with some wh-questions was also
found.
In the category of complex sentences, I explored coordination and complement
clauses. A conjunction ən ‘and’ was found to be used to express coordination. In
coordinated clauses, it was found that conjunction ən ‘and’ can be employed at
phrase level and clausal level to form coordinated clauses.
Two different kinds of complement clauses were also discussed. These two types
of clauses were clause internal and clause external complement clauses. In a
clause internal complement clause, the complement clause occurs within the
main clause in the object position of the verb phrase. Clause external
complement clauses were described as instances of direct speech in this
language. Since the language was found to be SOV, meaning the object occupies229230the slot before verb, these kinds of constructions were considered as clause
external complement clauses.
Direct speech and cleft constructions were established as types of complex
constructions found in Jarawa. It was suggested that there is only direct speech
in this language (based on pronominal correlation). Cleft constructions were
found to have two sub-types: ɖi-constructions and ʈʰi-constructions. The former
suggests referential/definiteness of the entity referred to, and the latter
indefiniteness of the entity referred to.
The morpheme ɖi was shown to have two different usages in this language. One
usage is to indicate definiteness/referentiality, and the second is to express
grammatical relation. Referentiality was treated in this dissertation as applicable
when the entity referred to is within sight of the speaker-hearer. Definiteness,
then, is applicable when the entity referred to is not within sight but the speakerhearer has shared knowledge. . However, some restrictions were found on the
use of this morpheme. It never occurs with pronominals and postposed Os. It can
occur only with lexically headed S or O arguments of a clause. This morpheme
was also seen employed with interrogative pronoun onne ‘who’ and clause
internal complement clauses. In the case of the interrogative pronoun onne ‘who’,
the cleft construction is formed.
The way this morpheme is employed in this language also indicated that this
morpheme expressed grammatical relations, i.e. ergative-absolutive system. The
languageemployssplitergative-absolutivesystem.","[246, 247, 248]"
"4Though this symbol represents high central unrounded vowel in IPA, I have used this symbolfor high-mid central unrounded vowel in order to avoid confusion with schwa.",[58]
"224225Two kinds of causative constructions, morphological and syntactic, were found.
Morphological causatives are formed by prefixing causative prefix {wa-} to verbs.
Limited data suggested that morphological causative is employed to a handful of
verbs, and the syntactic causative across the board. In syntactic causatives, the
independent word is used to express causation along with the lexical verb.
In the adjective category, this language was observed to demonstrate descriptive
adjectives, numerals, and demonstratives. Descriptive adjectives consist of words
related to colour terms or which define, describe, and qualify nouns. Also found
was marking of the degree of adjectives. In degrees of comparison positive,
comparative, and superlative degrees are attested. The positive degree is formed
by the noun phrase and adjective. The comparative degree was seen to be
expressed syntactically. In the comparative degree, the standard of comparison
was observed to precede the marker of comparison, and the adjective to follow
the marker of comparison. Superlative degree was seen as formed by employing
the intensifier or a completely new word which was not found to have any
resemblance with the adjective of positive degree.
Adverb was also found as a separate word class. These are lexical items used as
intensifiers, temporal adverbs, and spatial adverbs. No morphological
derivational process was confirmed to form adverbs from adjectives.
No syntactic case marking was observed in this language. However, two
morphemes were attested as postpositions to express semantic case. These
morphemes were {ɖə} and {ɲačʰe}. The morpheme {ɖə} has multiple functions in
this language. This morpheme was found to express place of location, source of
location, and goal of location. It was also frequently found with temporal and225226spatial adverbs, but not always. The morpheme {ɲačʰe} expresses the
commitative.
The morpheme {ʈʰi} was identified as copula. This copula is used to identify an
entity or qualify a noun. It was also seen employed with negative particles and
with temporal and spatial adverbs in short responses. Sometimes this morpheme
was also seen with verbs which were performing the function of adverbs. The
corpus suggested that this copula does not take inflection, but one example was
found where it was inflected for mood.
Four word formation processes were confirmed. These word formation processes
were compounding, denominalisation, reduplication, and the use of empty
morpheme. In compounding, three combinations were substantiated: nounnoun, noun-adjective, and noun-noun-adjective. In the denominalisation process,
we saw that nouns are denominalised to verbs with the help of a suffix. In
reduplication,Jarawademonstratessyllablereduplicationandwordreduplication. As for word reduplication, the corpus suggested that verbs were
reduplicated to serve the function of adverbial modifiers.
A notable phenomenon was also observed under word formation processes: a
morpheme used mostly with personal nouns (but also other nouns) was
discussed, but the meaning of this morpheme was not clear. Hence this
morpheme was referred to as an empty morpheme.
In syntax, the different syntactic structures of Jarawa, and their variances were
discussed. These syntactic structures included simple clause structures,
interrogative constructions, imperative sentences, negative constructions, and226227cleft constructions. It was also observed that this language follows the ergativeabsolutive system.
In declarative sentences, verbless and verbal clauses were discussed. Verbless
clauses consisted of non-verbal predicates like nouns and adjectives as the heads
of clauses. Copula constructions were also included in verbless clauses. Verbal
clauses contained verbs as heads of main clauses.
In verbless clauses we encountered two different types of clauses: one type had a
nominal as the head of the predicate, and another had an adjective as the head of
the clause. Verbless clauses also included copula constructions, since the use of
copula constructions were mostly observed in this type. In verbless clauses with
a nominal as head, two constructions were discussed: one where the S argument
was a pronominal headed NP and another where it was a lexically headed NP.
Lexical NPs were found to take copula constructions while pronominal headed
NPs never take copula constructions.
In verbless clauses with adjectival predicates, three kinds of constructions were
discussed. One was with prefixation of a pronominal S argument in adjectival
predicates beginning with a vowel, and which never takes a copula. The second
was copula constructions with a lexically headed NP as S argument which take a
copula. The third was adjectival predicates suffixed for state/evidentiality, which
also do not take the copula.
In verbal clauses there were four kinds of constructions discussed. These were
intransitive, transitive, ditransitive, and constructions with denominalised verbs.
All these constructions were found to have different structures.","[242, 243, 244, 245]"
"227228We saw that in intransitive clauses with pronominal headed NP as the S
argument, the NP can be prefixed to the verb (if the verb starts with a vowel).
This is not allowed with a lexically headed NP. However, the lexically headed
NP, if specific, takes the referential/definiteness marker in intransitive clauses.
Apart from these intransitive constructions, we encountered denominalised
constructions. These were posited to include (purely intransitive) weather type
constructions, and another type of construction, which semantically appeared to
be transitive but, behaved as if they were intransitive clauses.
Transitive clauses were considered as a separate group, with a transitive verb as
the head of the predicate. In such constructions two core arguments were
confirmed. These core arguments are A(gent) and O(bject). In these constructions
A precedes O and O precedes the verb. If the O argument is a pronominal
headed NP, it generally attaches to the verb if the verb begins with a vowel. In
the case of a lexically headed NP, we had observed the insertion of the
referential/definiteness marker after it. This referential/definiteness marker was
seen to alway move with the D(irect) O(bject).
In ditrasitive clauses, the position of A and the verb was found to be fixed in
declarative sentences, i.e. A always occurs at the beginning of the clause, and the
verb at the end of clause. The order of I(ndirect) O(bject) and DO might change.
The referential/definiteness marker is used to specify the DO, hence this marker
moves along with it. However, IO may also take referential/definiteness marker.
Apart from the core arguments, peripheral arguments of the clause were shown
to have different positions in the clause. Temporal adverbs generally occur at the
beginning while spatial adverbs/nouns just before the verb.","[245, 246]"
"4.8.2ComplementationIn this section we will discuss two kinds of complement clauses: clause internal
complement clauses and clause external complement clauses. The first type
occurs within a clause, in the object position within the VP. Jarawa is an SOV
language and therefore any clause that fills the object position should precede
the verb. However, it is possible to have a complement clause which follows the
verb as well. This type of clause is clause external complement clauses. Direct or
indirect speech is included in the clause external complement clause.
4.8.2.1 Complement internal clauses
It is difficult to ascertain if Jarawa has clause internal complement clauses
because it is not evident whether these types of clauses are NPs or complement
177178clauses. I will make an attempt to uncover whether these types of constructions
are complement clauses or complement nominalisations. Examples like (4.107)
suggest both these possibilities.
(4.107) miujijəɖ-ipale-jəɖibəᵼʈʰe-jə1fishREF-fish[V]-VEVDREFgo-VEVDI will go for fishing.(4.108) [mii] [øi]A [ujijə]NP [ɖ-ipale-jə]]]VP]NP [ɖi] [bəᵼʈʰe-jə]]]]VPTwo verb phrases are employed here, a main verb phrase and a dependent verb
phrase. Semantically both the verbs carry their lexical meaning, and they follow
the syntactic rules of a simple clause.
Here there are two clauses: (1) [mi]NP [ujijə]NP [ɖ-ipale-jə]]VP ‘we will do fishing’
and (2) [mi]NP [ɖi [bəᵼʈʰe-jə]VP ‘ we will go’. In (1), the verb is ipale ‘fish[V]’ and in (2)
the verb is bəᵼʈʰe ‘go[V]’. ipale is a transitive verb; thus it takes NP ujiyə ‘a kind of
fish’ as an object NP. This results in the use of the referential marker ɖi with the
object ujiyə. mi ‘first person pronoun’ serves as a subject for both the clauses.","[195, 196]"
"5.4.2 Peripheral arguments
Like other SOV languages, Jarawa places peripheral arguments and/or
adpositional phrases before the verb. The peripheral arguments and/or
adpositional phrases are not syntactic arguments of a verb, but demonstrate the
same pattern as object and verb. The precise positions these arguments occupy in
205206syntactic structures could vary. In intransitive clauses these arguments will just
precede the verb while in transitive clauses they may occur before the object. The
example in (5.8) illustrates the use of a peripheral argument of an intransitive
verb, where the peripheral argument olleg ‘place name’ precedes the verb as
object. Example (5.9) shows the position of the peripheral argument olleg ‘place
name’ which precedes the object, and therefore precedes the verb.
(5.8)tenmejollegɖəbəᵼʈʰeTenmeyOllegLOCgoTenmey will go to Olleg/Lakralunda.","[223, 224]"
"174175(4.99)luwə-kʰə-ɖəŋinojčʰeomohə?there-PM-LOC2how manysleepHow many days will you sleep there? (cf. How long will
you stay there?
There are some cases where the interrogative marker ka is employed in this type
of wh-question, as shown in (4.100). It was not ascertained why ka appears in
such cases. The ordering of the interrogative marker and other constituents of the
clause is as we have in other interrogative constructions, where we have
interrogative marker in the beginning of the clause followed by other
constituents.
(4.100) ka-ŋa
INTM-2POSSpaʈʰo-lenojčʰe?arrow-PLhow manyHow many arrows do you have?(4.101) ka-ŋi
INTM-2kahiunenonəhəɖih-ija-g?morningwhatREF3-give-PSTWhat did you give in the morning?
Some constructions involve the structure SUB + INTM + question word. These
constructions mostly contain the subject NP and the question word for ‘where’.
For example, in the sentence (4.102) there is a subject NP čajwaj and question
word ʈʰučəʈəgə, consequently we have ‘cajwaj ka ʈʰučəʈəgə’175176(4.102) čajwaj
CaywaykaʈʰučəʈəgəINTMwhereWhere is Cayway?
This sentence can also be formed without ka:
ʈʰučəʈəgə(4.103) čajwajCayway where
Where is Cayway?
Putting the interrogative marker ka at the beginning of the sentence causes
ungrammaticality. For example:
(4.104) * ka
INTMčajwajʈʰučəʈəgəPNwhereWhere is Cayway?
4.8 Complex sentences
The present corpus shows evidence of coordination, and of direct and indirect
speech. There is no substantial evidence for complex sentences involving
subordination. Distinguishing between direct and indirect speech is difficult
since no complementiser or any particle is used in such constructions.","[192, 193, 194]"
