Paragraph,Page number
"3.5.1 .1 .2
299Path N PThe path NP is characterised by the path role which it encodes , v. example
in section 3 . 4 .
Path NP
Path role3.5.1 . 1 .3Referent N PThe referent case marker is a multifactor case marker encoding five roles
as well as functioning as a comitative conjunction . As such this case marker
is very generalised with little semantic content. It does little more than
identify a referent which is relevant to the predication in some way .
Referent NP : Adessi ve role with non-motion verbs and a locative
head noun
Al l a ti ve role with motion verbs
Ela ti ve role
Effici en t cause role1 0 1 with an inanimate head noun
Point-of-reference role relating a locative noun and
another NP
Interpreta tion rulesOnly a partial explanation of an interpretation strategy for the referent
case marker can be attempted here . In general terms , the semantic content of
the participants and/or predicate of a given clause will constrain the possible
interpretations of the referent NP .
The adessive role is assigned to a locative nominal co-occurring with
non- motion verbs (v. example 300 in section 3 . 4 ) .
The point-of-reference role relates a locative positional with another NP
(v. example 309 in section 3 . 4 ) .",[217]
"3.7.3.3.2Overt coreference a n d swi tch referenceIn the last section we have discussed dependent clauses with reduced
verbs ( i . e . verbs with no actor or undergoer markers ) . In thi s section we
examine some of the relationships between clauses with fully inflected
predicates . The switch-reference system which will be discussed in the f inal
section includes both cases ; in one case the dependent verb is fully inflected
and in the other i t is not .
Overt CoreferenceThe verbal pronominal suffixes coreference participants which are
identifiable e ither in the l ingu istic discourse or in the si tuational context .
In general there are no syntactic constraints on when verbal pronominal
suffixes may be employed as the only means of referencing the most prominent
participants in a given clause . For this reason most two-place clauses do
not manifest both subj ect and inner object NP ' s in the clause . Often ne i ther
is expressed . There are restrictions , however , with the less naturally salient
participants , i . e . those manifesting orientation roles in the clause . Predi­
cates of case frames 1 and 2 (Table 101) potentially coreference orientation
roles with the undergoer suffix as nuclear roles . The verbal pronominal suffix
may be the sole reference to these participants in a clause only if the noun
phrase which i s coreferenced i s extant in the same clause or an associated clause
of the same sentence . Thus , the sentence unit is the limit of the scope of
pronominal suffixes which are coreferencing participants with orientation roles .",[299]
"Tab l e 33 :Genera l noun phrase construct i onFunctions+ Nucleus+ Terminator� EmphaticexponentsNP BasePerson-numbergender markers
( v . Table 3 4 )-n' emphatic '+ E levational-Elevational
encl i tics
( v . Table 3 5 )96
The configuration of terminator plus peripheral encl itics indicated in
Table 3 3 is diagnostic of the general noun phrase versus relator-related ( i . e .
relator-ax i s ) noun phrase types . The addition of a relator ( case marking) in
varying configurations with the terminator forms a structural bas i s for
pos tulating three types of relator-related phrases . The relator-related phrases
will be discussed separately ( as distinct from the noun phrase ) s ince they
contrast in form and function with the non-ease-marked noun phrase . They are
discussed in the ir peripheral functions at the clause level in section 3 . 4 .","[101, 102]"
"The resemblance phrase ( RES p ) is structurally s imi lar to case-marked
relator phrases ( c f . 3 . 4 . 2 ) . The structure is most l ike a re ferent NP ( c f .
Table 89) . The resemblance phrase man i fests the outer obj ect function in an
equative clause , however . Therefore the RES P is paradigmatically related to
non-case-marked NP ' s in the outer obj ect s lot rather than being related to
case-marked relator phrases in the periphery of the c lause . A further example
of an equative c lause mani fe sting a resemblance phrase is given in 2 7 3 .
273 .",[189]
"Examples 3 1 1 and 3 1 2 ( sect ion 3 . 4 ) i llustrate surface and adessive interpreta­
tions with case-marked nouns which are compatible with those interpretations
but are not compatible with interpretations higher up the hierarchy .",[220]
"Example 3 39 i llustrates a general restriction on the inner obj ec t . An
inner ob ject must be ' crucial to the predication ' ( cf . the definition of
undergoer p . 2 1 9 ) . Locative and temporal references are not normally so
importan t , unless they are a point of discuss ion in a discourse and thus
marked as definite . A noun phrase manifesting an orientation role may be
marked as crucial to the predication if it indicates a specific referent
or is marked by verbal aspects so as to emphasise its importance . The
common verb roh sitting ( case frame 1 ) , if unmarked for adverbial aspect
will not coreference a non-specific locative inner obj ec t . Thus , *kun- t
korh-we- r-t ( house-3SF sitting- IMPF-3SM-3SF) , He is in a house, i s
unacceptable , whereas kun - t kor-has i -w- r-t ( house- 3 SF sit ting CONT . at­
IMPF-3SM-3SF ) , He is remaining in a house, is much more acceptable . If
the locative or temporal referent noun phrase is definite or specific , it
readily as sume s an undergoer function , e . g . nanho kun - t dbehnay- r - t (my
house- 3 SF siak- 3SM- 3SF ) , He was sick in my house . other semantic roles
are more natural ly crucial to particular predications and are not so
constrained , e . g . a patient inner obj ect may be non-spec ific . Case frame
4 verbs host a locative role obligatorily ; the inherent importance of a
location to that class of verbs means that a locative inner obj ect need
not indicate a spec ific referent . The coreferencing of orientation roles
is considered further in section 3 . 7 . 4 . 2 where constraints on coreference
between clauses are discussed .",[316]
"3.5.2.2.3Other fea tures of tran s i t i v i tyIn case-frames one and two , there is only one obli gatory NP . When there
are two ( one man i festing an agent or patient , and another mani festing a locative
or temporal role coreferenced as undergoer) , the undergoer is usually marked as
definite . Thus , the predi cates of case-frame one and two may structurally
parallel other transitive predicates , i . e . increase in transitivity , i f the
inner obj ect is highly individuated . The effect of causativisation on c ase­
frame-two predicates will be di scus sed in comparison with case - frame five .
Case-frame- three predicates ( e . g . ' heavy ' ) are at the low end of the
transi t ivity s cale . When a predicate of c ase- frame three exhibits only one
participant , it manifests no features of trans itivi ty ; there is only one
participant and it has none of the features of an actor , i . e . is ne i ther
performer , c auser , controller , nor wil l ingly active . This form may be causativ­
ised ( a feature of low trans i tivity ) , whereby the actor is now the causer o f
the state which has a n e ffect upon the undergoer .",[240]
"PART THREE
G RA MMA R3.1
3. 1 .0Non -verba l word c l asses
I n troducti onIn this section we will first of all outline the word classes of Alarnblak .
Secondly , the non -verbal classes will be described in their basic unexpanded
form. Morpho-syntactic criteria will be used to distinguish twelve major word
classes not including verbs . The internal morphological structure used to
identify the word classes will be discussed more fully in section 3 . 2 where
questions of grammatical levels ( i . e . stem, word , phrase) and their definitions
will be considered . The discussion there on grammatical levels will refine the
discussion in this section so that the basic grammatical categories elaborated
here will be referred to as roots rather than words .
3.1 .1Word cl assesFormal word classes in Alamblak are identified by morpho-syntactic criteria .
That is , basic root forms are classed together according to their potential to
host certain bound morphemes . The word classes and subclasses are summarised in
Table 20 .
Inflectable roots ( i . e . , words) are distinguished from non-inflectable
roots ( i . e . , particles) . Adverbs contrast with all other word classes by their
restriction from hosting the copula and elevational markers . Next , the verb
classes can be distinguished from non-verbals . The internal structure which is
unique to verbs ( e . g . tense , aspect , mood , etc . ) will be discussed i n section
3 . 3 . Non-verbals may be inflected with possessive and emphatic affixes , the
modifier enclitic - s k deteriorated , and the specific setting case marker , and
they may be conjoined by the coordinate conjunction (cf . line three in Table 20) .
Other subclassifications are possible . Adjectives and some verbs are
similar in that they host the process derivational - t ay (Table 20 line four) .
The deictic-like pronouns , adjectives , personal names , and kin terms of address
contrast with nominals and verbs by not hosting the possessed suffix -et which
may occur with nominals and verbs (line six) . Adverbs are similar to the non­
inflectable particle class in that they may occur as free forms in the clause .
As it will become clear in section 3 . 2 , however , words in all other classes
must be inflected when occurring as a minimal exponent of a clause-level slot .","[78, 79]"
"Examples 294 need not be interpreted reflexively if another subject or object
is understood in the linguistic or extralinguistic context . See section
3 . 5 . 2 . 2 . 2 for a detailed discussion of reflexivity .
3.4.2Peri pheral noun phrases ( case mar k i ng )The noun phrases discussed here may be considered to be those bearing
non-nuclear grammatical relations to the verb in the clause . 9 9 It is easier
to associate these NP ' s with specific semantic roles than it is with nuclear
NP ' s (cf. section 3 . 5 . 1 , role structure) .
An overview of relations encoded by the peripheral ' relator - related '
phrases is given in Table 87 .
Several of the ' case ' enclitics may encode more than one meaning. Specific
rules for encoding or interpreting the appropriate meaning are discussed with
each phrase . For exan�le , the adessive NP plus a motion verb encodes ' to ' as
its meaning; with a non-motion verb , the adessive NP encodes ' at ' as its meaning.
The peripheral NP ' s structurally group into three types depending on the
presence or absence of terminator slots and/or their ordering relative to other
function slots . Table 88-90 present an overview of basic structural contrasts
between peripheral NP ' s . Exponents of the terminator function are person-number­
gender markers ( cf. Table 34 , p . 96) . The emphatic and elevational markers are
explicated in sections 3 . 2 . 3 . 1 . 2 and 3 . 2 . 3 . 1 . 3 .",[201]
"It i r yoht -thand who le-3SF(b) .rM . BaseIt i r hos-fhand two-3D(c) .fiveM . BasetenIyima yoht -rperson who le- 3SMtwenty104
The remainder of the numeral system is described in Appendix B. With the
additional constructions described there , the numeral system theoretically has
the potential of for ing any numeral . In practice , however , only a limited
number of digits are formed in this system. The level of acceptable efficiency
of the system seems to include numerals 1-10 and then by tens to forty . The
greates t operating e fficiency is in the 1-5 zone . Higher numerals are frequently
expre ssed in the New Guinea Pidgin system . I t is certainly the case that
numerals other than those mentioned would not be formed in the vernacular
system as quantifiers in a noun phrase . Higher numerals in the vernacular
system would only be used for counting or tallying . Other counting systems ,
vi z . the money-counting system and the traditional tally system will be
discussed in Appendix B with these higher , counter numerals .","[109, 110]"
"------------__
__
__
--------r----------------------------286Tab l e 1 2 7 :Embedded cl ausesNon-f initeNo pronominal
suffixesNoun
incorporation5 1 M . Time CL-X--5EQ . Time CLXX--Ge neral �L
cl ause-XX-(Non) -P055D .
modifierXXX-Pu rpose �L
cl auseXXXXPurpose clauseXXXXNominal CLXXXXGenitivised
nounsEmbedded clauses 1) typically exhibit a non-finite verb form, without
actor and undergoer pronominal markers ( c f . 3 . 3 . 1 . 2 . 1 ) , 2) potentially
incorporate nouns into the verb (cf . 3 . 3 . 1 . 3 ) , and 3) potentially employ
genitive forms of noun phrases corresponding to nuclear NP ' s of independent
clau se s . These features contrast with independent clauses which do not have
genitivised nuclear NP ' s , and they tend to neither exhibit non-finite verbs
nor incorporate nouns into the verb , but they do employ person markers . By
these features , then , the embedded clauses near the top of Table 127 are the
most sentential . The relative clauses ( including the (non) -possessed modifier )
and nominal clauses are described i n section 3 . 2 . The others , i . e . the
adverbial clauses , are described in the next section .
The phenomenon of noun incorporation is discussed in section 3 . 3 . 1 . 3 , for
both independent and embedded clauses . The pattern of genitivisation is
basically that the nuclear noun phrase which is least accessible to verbal
cross -referencing in independent clauses is most accessible to genitivisation
in embedded clauses . Formally , an ergative pattern is followed with subjects
of intrans itives and obj ects of transitives being optionally marked with the
genitive ( i . e . pos sessive ) marker . with three-place predicates , the outer
obj ect ( i . e . ' patient ' noun) is marked wi th the geni tive . I f both the inner
obj ect ( i . e . ' benefactive ' or ' recipient ' noun) and outer obj ec t are mani fested ,
the inner obj ect will be genitivised only if the outer object is incorporated
into the verb , which is the typical case if there are two or three arguments
extant in the clause . The nominal clause varies slightly from this pattern as
discu ssed in section 3 . 2 . 3 . 2 . 6 . 2 . Noun phrases with peripheral semantic roles
( i . e . locationals , etc . ) may occur as an outer object in the genitive form if
one of the two object positions is available . Thus , syntactic doubling of
genitivised objects i s disallowed .","[291, 292]"
"The high probability of these verbs being in a reflexive form i s one reason
that a second participant ( locative or temporal re ference) may manifest the
undergoer function without much chance of ambiguity ( interpreting the undergoer
as either an orientation or a participant rol e ) .
Predicates of case-frame nine ( e . g . ' rub ' ) are simi lar to refl exive verbs
of case-frame eight in that they host an affective role and thus c annot take
a benefactive form.
Case-frame nine di ffers from c ase- frame eight in certain ways as wel l .
For example , the trans itivi ty factor is higher since it potential ly hos ts a2 38third nuclear participant . Furthermore , the undergoer marker cannot corefe rence
an NP with an orientation role in reflexive forms due to the role hierarchy for
unde rgoer selection , which restricts orientation ro les from the undergoer
function when a patient role potentially may occur in the undergoer slo t .
Predi cates o f case-frame ten (e . g . ' put ' ) are highly transitive with a
potential for three nuc lear participants . When the third participant ( locative )
is mani fes ted as a nuclear participan t , i t may occur as inner obj ect ( undergoer
function) thus superseding a patient role , which is higher on the ro le hierarchy
for selecting the undergoer function ; the patient then occurs as the outer
ob j ect . This is permi ssible only because the locative role coalesces with the
affective role , which supersedes a patient for the selection of undergoer . The
affe ctive role with an inanimate location indicates a total ( in contrast to a
partial ) affect of the re feren t . This feature o f total a ffect of the undergoer
is one of the features of high transitivity suggested by Hopper and Thompson
( 1980) .
The semantic contrast between sentences having the locative role
amal gamated with a ffective as an inner obj ect and those with the locative role
as a peripheral c ase-marked NP is i l lustrated in example 349 . An animate
location in the affective role indicates affectedness ; in a locational role
unaf fec tedne ss is impl ied , as i l lustrated in example 364 .
, - - - ------ - - - - - - ---------- --------- - ------,364 ( a) .","[243, 244]"
"The linking morphemes function to conjoin two or more phrases which are
equivalent in their grammatical and semantic roles . By grammatical role we
mean roles such as subj ect , and by semantic roles we mean case roles s uch as
agent , patient , etc . Coordinate structures function as a unit with no one
member s ingled out as being more in perspective or more referentially prominent
than the other members of the construc tion .
The coordinating conj unction contrasts in function with the conj unction of
a comitative construction ( c f . below) .",[135]
"239
3.5.2.2.4Syn tact i c i n a l i enab l e posses s i onThe discussion of transitivity thus far has focussed on selectional
features of verbs and how certain derived constructions modify basic case
frames of verbs . The selection of clause constituents themselves may also
modify the basic case frame of predicates . In particular , the selection of
an inalienably -possessed item will affect the case frame of a verb since its
presence automatically implies the presence of another entity ( the possessor)
which is inextricably involved with the possessed item. Given the necessity
of a second entity , a role may be assigned to it in the clause , either as
affective or referent.
An inalienable possession in Alamblak is an item which is thought to be
an integral part or possession of an animate being. Specifically , these items
include body par ts , names , and odours .
Predicates of case - frames one (e . g . ' die ' ) and three ( e . g . ' heavy ' ) may
select inalienable possessions as actors ( force role) . Case - frames five (e . g .
' be startled ' ) , six ( e . g . ' see ' ) , and seven ( e . g . ' pierce ' ) may select
inalienable possessions as undergoers or objects ( i . e . inner objects or outer
objects) in a referent role . Case frame nine (e . g . ' rub ' ) may select
inalien­
able possessions as undergoers or objects ( in a patient role) . 1 1 2
The case frames of basic classes one and three thus modified by the
presence of an inalienable possession have the form :
[ ---- �
For �
Pat J .
There are several possible configurations of a clause involving an inalienably­
possessed item. Clauses with items of inalienable possession, with the
possessor as patient role (case - frames one and three) , occur in the following
patterns :[
1
I
RPTab l e 1 02 :Act (Force)NP (patient)
""P(::) II n a l i enab l e posse s s i on cl ause patterntNP
P , (poss.ph + n . root
-]Predicate
-v. stem + A (Force) ± u (pat)
v. stem + A (Force) ± u (pat)
n. root + v. root + A (Pat)
[ + poss ' d J--The cases of inalienable possessions incorporated into the verb stem (row four
of Table 102) have been discussed in 3 . 3 . 1 . 3 . 2 . The other patterns in Table
102 are illustrated in example 365 .
,-- - - - - - - - - - - - --1
365 (a) .
A
,Act (Force),
r1
tha - tgenng tay-t-3SFskin- 3SF coZd
(Someone / s ) skin was co Zd .","[244, 245]"
"1063.2.3.2.4.1Genera l rel ati ve c l auseThe first outer modifier to be discussed i s the general relative clause
which is described in Table 40 . As noted there , the peripheral functions are
the same as they are for independent c lauses . The distinctions between the
three nuclear functions in independent clauses , subject , inner obj ect , and
outer obj e c t , are never completely maintained in the general relative clause ,
however . The reason for this loss of grammatical contrast is that the reduced
form of the verb lacks the pronominal af fixes which identify the functions of
each nuclear NP in independent clauses .
There are two relativisation s trategies within the framework of the general
re lative Clause . Sub j ects , obj ec ts , and obliques are relativised on wi th a
non-case-encoding strategy . 6 3 This s trategy employs the general relative clause
without manifesting the optional terminator plus relator complex ( c f . Table 40) .
The head noun being relativised on 6 4 is not explic itly referred to within the
relative clause , nor is there any indication of its semantic role within the
relative clause . Of the oblique NP ' s , a comi tative is not relativisable ( c f .
the dis cussion of the c omitat�ve in section 3 . 4 . 2 . 3 which concludes that the
comitative is a conjoined rather than a case-marked NP ) . Neither is the obj ect
of a comparative relativisable .
The s trategy which employs the relative clause with the terminator plus
relator is used to relativise on the genitive ( i . e . possessor ) of a possessive
phrase . In that strategy the genitive case of the head noun is indicated by
the relator ,
' genitive ' within the relative clause . These two relativisation
strategies are i l lust:rated in examples 1 7 5 and 176 . Before those examples are
given , we will d iscuss the function slots of the general relative clause and
their exponents in more detai l .-hoNuclear NP functions of the GEN REL clauseThe nuclear NP ' s of the general relative c lause are never completely
distinguishable gramnlatically . The subj ect NP is distinguished from the i nner
and outer obj ects 6 5 in that it may never be manifested by an NP base ( i . e . a
noun whi ch is incorporated in the verb stem) in multiplace predicates . Inner
and o uter o bj ects may be expressed by NP ' s or NP bases . Ultimately the latter
two can only be distinguished by appeal ing to d i fferent semantic roles which
they encode in independent clauses . Thus an NP which expresses an affective
role is interpreted to be an i nner object because only i nner objects encode the
a ffective role in independent clauses .
Examples in 1 7 1 i l lustrate nuclear NP ' s of the relative clause manifested
both as NP ' s and as NP bases .
171 (a)•G . HEL CLImet -t maroha-m haym� yima -rwoman- 3SF money - 3PL gave person- 3SM
a man (who) gave money to a woman/a man (to whom) a woman gave money(b) .","[111, 112]"
