Paragraph,Page number
"The use of free pronouns is associated with the introduction or reintroduction of a
participant into the discourse, or with the switching of emphasis to new referents in
discourse. That the pragmatic roles are changing is indicated by the presence of the free
pronouns, but the precise grammatical role played by the participants to which the
pronouns refer is indicated by the article used with the pronoun (te ‘non-nominative core’
or na ‘nominative’) in combination with the verbal morphology (see chapter 3) (In Bresnanand Mchombo’s (1987b: 23) terminology these are referred to as nonargument functions,
“such as TOP,FOC,and ADJUNCT”and argument functions “such as SUB,OBJ,OBL(ique)” ). Since an article can only govern an NP, and not a pronominal affix, the free
forms must be used, as the head of an NP, in order for this system of changing article use
to be productive.
Morphological possibilities with a free form pronoun are extremely limited. The onlyaffixing that has been observed is the addition of the emphatic suffix -mo:
(33)a.",[148]
"This is the case in most languages with a split-intranistive system. Other languages,
such as Lamma (Timor—Alor—Pantar family, own fieldnotes) group unergative subject
({Sa]) with [O], and unaccusative subject ({So]) with [A]. Kolana, of the same
family, has a split-intransitive system, but one in which none of the three ways of
expressing the intransitive subject are the same as that used to indicate the [A] (own
fieldnotes, thanks to Johanna Nichols). Choctaw (Davies 1986) also shows a three—
way split in the verbal indexing of intransitive subjects, and several Dagestanian
languages show three different patterns of case-marking on the subjects of
intransitive verbs. The most common form of split intransitive system, however, is
that exemplified by Eastern Pomo (McLendon 1978).",[582]
"At the other end of the NP to the Demonstrative position is the N’, which is also fixed
in the position beginning the NP, and consists of a fixed group consisting of the nominalhead, any adjectives, and any possessive suffixes. All of the other modifiers in the Noun304Chapter 12Phrase occur after the N'; there are no pre-head modifiers in an NP, and nothing in the KPappears before the article. The choices available for the Demonstrative position depend on
the case of the KP as a whole, and there are two different internal structures for an NP,again depending on whether the argument represented by the KP is nominative or nonnominative. The basic non-nominative NP has an ADJ position before the -POSS; this isthe major distinguishing feature of this NP type over the nominative NP type, whose ADJ
position follows a -POSS, and one of the clear points of distinction between verbs and
adjectives. The following basic structures are attested:
KPaaARTNPART-=
—>
—na
te
di/i
nu(nominative)
(non-nominative, core)
(non-nominative, oblique)
(non-nominative, genitive)NPnon-NOM—N'NPNOM=>N' GenKP {(RC)N'nonNOM—(N)(ADJ)! (-POSS)N'NoM—(N)(-POSS) (ADJ)!","[329, 330]"
"BEN-2SG.OBJ‘I remembered to get a mango for you.’
(60)Ku-roda
1SG-forget{i
OBLala-'a
fetch-NL‘I forgot to take money.’no
GENdoe|comp.
moneyUnlike the similar case with verbs of desire, the nominal complement of a mentalperception verb may be in nominative case:
(61)Ku-molinga-'e1SG-forget-30BJ[na _NOMhelo’a-(a)cook-NL‘I forgot to cook the ndawu-ndawu.’uGENndawu-ndawu]comp.k.o.soupComplementation401This is consistent with the fact that these verbs, when used with a normal nominal object,
and not a complement, require nominative case on the object. Although this is not a
requirement for complementation, it is consistent with their behaviour in non-complement
clauses that they should allow nominative case marking on nominal complements.
Compare (62) with (63), illustrating the ungrammaticality of a non-nominative object:
(62)Ku-molinga-'e[nangaa-'u)xp.","[426, 427]"
"Chapter 19Speech acts
19.1Speech acts: introductionA discussion of sentence types must include reference to both the number of distinctions
that a language makes in terms of morphosyntactic peculiarities that a particular sentence
type possesses, and the different types of speech acts that may be carried out by the use of
one and the same grammatical category. Most researchers into the topic (e.g. Searle 1979)
make a distinction between SITUATIONAL CATEGORIES, which are concerned with the
intent of the speech act regardless of the sentence type used, and GRAMMATICAL
CATEGORIES, which are sentence forms used to realise the different situational categories.
Important to this thesis is that these different categories do not share a one-to-one
relationship; whilst a statement is usually realised as a sentence with the grammatical
category of declarative, for instance, this is not always the case. Sinclair and Coulthard
(1975:29) state that
Of the nine possible combinations—declarative statement, declarative question,declarative command,
imperative statement.and so on—there is only one we cannot instance:They give the following example of an indirect correspondence between categories:
The interrogative, ‘What are you laughing at?’, is interpretable either as a
question, or as a Command to stop laughing.
The different situational and grammatical categories that they found necessary to
distinguish their recorded data in English are as shown in figure 12:
Situational categoryGrammatical categoryStatementDeclarativeQuestionInterrogativeCommandImperativeFigure 12. Situational and grammatical categories
The same facts are found in general terms in Tukang Besi; whilst a grammatically
imperative clause is the most common way of expressing a command, it is not the only
way, with both interrogative and declarative clauses used for the same function (though448Chapter 19often with different nuances in terms of politeness and abruptness). Note that each
situational category has a grammatical category that corresponds to it, but is not restricted
to using that grammatical category alone.","[471, 472, 473, 474]"
"Some of these clear cases are listed below:90Chapter 4
CLASSIFIER‘ulubala‘classifier for animals’‘classifier for soap’PREPOSITIONmina
‘ablative preposition’kua
‘allative preposition’CONJUNCTIONmakatoka‘and then...’‘but’Many of the forms that may appear in a syntactic position that calls for a member of a
closed class can also, however, function as a member of an open class. Examples include:
CLASSIFIER-NOUN:ba'e‘counter for small round things’
‘fruit; heart’CONJUNCTION-NOUN:kene‘and, whilst’
‘friend’CONSUNCTION- VERB:jari‘and so, thus...’
‘become’A discussion of word classes in Tukang Besi must bear in mind that the distinction
between classes is, generally, a syntactically determined one, and not lexically specified.
With this in mind, the open word classes, consisting of nouns and verb (including
adjectives) will be discussed, followed by commentary on the closed word classes.","[115, 116]"
"3.5.2Oblique predicatesClauses with oblique predicates are similar to equative clauses in their structure, except that
the predicate nominal is in an oblique case phrase or a prepositional phrase, and the subjectnominal is found initially in most cases. When being questioned the predicate may be
fronted, and the subject nominal nominatively marked, but this is rare (in the matrix below
‘ObIP’ is an abbreviation for an oblique phrase, whether a preposition phrase or a case
phrase).",[83]
"3R-get-30BJ)NOMbookCOREchild‘The child got the book.’
As has been described in chapter 3, the type of verbal indexing (presence versus absence
of object suffixes) correlates with predictable variation in the case marking on nominals,
and variation in their syntactic behaviour (see chapter 20), showing that the variation in
case is not merely morphological.
This is exactly the same correlation exhibited by the better-known verbal affixes and
KP marking in various Philippine languages, as demonstrated by the following pair of
sentences from Tagalog (I am not going to enter the debate about the theoretical
significance of what has here been blithely termed ‘focus’, or the nominal versus verbal
nature of the affixed words in Philippine languages, in this book. For a discussion of these
question, see (amongst (many) others) Schachter 1976 and 1977, and Kroeger 1993. The
glosses in Tagalog sentences follow Kroeger’s conventions):
(45)
a.b.",[186]
"NOMfishCORE2SGCORE1SG‘You will give me some fish.’(Good for: “You will give me to the fish.’)
In most cases involving the verb hu'u there is no possible confusion between the
recipient and the theme arguments, which are case marked the same way in (10), orbetween the recipient and theme objects, identically case marked in (9), and so the wordorder is not fixed. There are possible sentences in which both the recipient and the theme
are animate, as seen in (12):
(12)Noj-hu'u
3R-givete
CORErajaj
ruler‘She gave a slave to the king.’te
COREtudu'ay.
slaveIn this case, the word order is fixed: te tudu‘a cannot precede te raja without causing a
change in the meaning:
(13)Noj-hu'u3R-giveteCOREtudu‘a,—slaveteCOREraja).ruler‘She gave the king to a slave.’
* ‘She gave a slave to the king.’
We can see that there is a preference, when potential ambiguities present themselves, to
have the recipient precede the theme (though compare (13) with (9), where there is no
potential for ambiguity, and no restriction on the relative ordering of the two objects).
With ditransitive verbs that have an optional instrument as well as an agent and a
patient (see chapter 4.5.1 for details on this), the order is fixed: the patient must precede
the instrument, as seen in (14) and (15):(14)Noj-tompa-'e;
3R-give-30BJ]na
NOM‘obuj
dogte
COREwalt.
stone(15) * Noj-tompa-'e;
3R-give-30BJte
COREwatu, na
stone NOM‘obuj.
dog‘She threw a stone at the dog.’A sentence with a non-nominative object is just as ungrammatical as (15) when the56Chapter3instrument precedes the patient: * Noj-tompa te watu, te ‘obu;. With the instrument
following the theme, and both marked with te, there is no problem with grammaticality:
Notompa te ‘obu te watu.","[81, 82]"
"°Co-occurrence of -{um]- and object suffixes. In elicited sentences speakersare reluctant to accept verb forms that display both the -/um/]- infix and an
object suffix, yet in real (unguarded) speech this is common (chapter 7).
°Derivation of verbs without the verbalising prefix he-. Whilst many cases of
verbs derived from an associated noun through prefixing with he- are
common, there are many cases in normal speech of ‘nouns’ being used as
verbs simply by the addition of subject prefixes (chapters 4 and 11).",[34]
"20.14SummaryThere is no one unified concept of the pivot in Tukang Besi, in the sense that one set of
grammatical relations is the pivot for all constructions in the language. Even discountingthe fairly universal pivot that seems to apply for imperatives and some Equi constructions,
there is more than one pivot in Tukang Besi which a grammatical process can refer to, and
often an argument is the pivot for some processes, but at the same time not for others. The
labels “ergative’ and ‘accusative’ cannot be applied to the whole of Tukang Besi in any
meaningful sense, only to individual grammatical constructions.
Perhaps more importantly, the notion of pivot in Tukang Besi is one not just based on
one set of criteria. Languages such as English or Yup'ik Eskimo (Payne 1982), and many
more, may all be characterised as having pivots based on syntactic categories (hence the
use of the labels [A], [S] and [O], referring to syntactic roles). Typically, the language has
either an [S,A] pivot, or an [S,O] pivot, though some languages refer to both of these for
different processes (such as several Mayan languages; see Craig 1977, Day 1973, England
1983, Bear 1992). Other languages, such as Archi (Kibrik 1979) or Aceh (Durie 1985,
1987, Foley 1991b) appear to refer to the semantic roles directly, without the need to
mediate these by means of syntactic roles (or grammatical functions, such as ‘subject’ and490Chapter 20‘object’). Yet others, notably those of the Philippine group, have a stronger orientation
towards the direct encoding of pragmatic prominence, and do not operate directly in terms
of either syntactic roles or semantic roles (Thai appears to be a language with a pragmatic
pivot, but with no morphological coding of the pivot choice.).
The pivots in Tukang Besi, however, are divided amongst those that are based on
syntactic roles, those based on pragmatic factors (i.e., set by discourse constraints, with afair degree of freedom), and those that are dependent on semantic roles directly, regardless
of their syntactic status. Additionally, the existential construction presents a mix of
properties from several of these types, none of them as complete as a ‘normal’ verbal
clause presents.
In short, whilst the labels [A], [S] and [O] are useful shorthand in a description of a
language such as Tukang Besi, they are not sufficient, and moreover, as has been seen in
sections 20.14.1 - 20.14.3, these syntactic roles are actually predictable for a given clause
if we know the subcategorisation frame of its verb. That is, given the argument structure
representation of semantic roles in the predicate, the syntactic roles [A], {S] and [OJ are
derivable concepts. The assignment of nominative case does not follow from any automatic
process similar to the assignment of the [A], (S] and [O] syntactic roles, but is similarly
based on the information present in the thematic hierarchy and thus the subcategorisation
frame of the verb. Some processes, notably the ability to head an Instrumental relative
clause, are sensitive only to semantic role information, and not to syntactic role
information. We must, therefore, look past the labels [A], [S] and [O], the grammatical
relations ‘subject’ and ‘object’, and the Philippine-style notions of nominative and nonnominative arguments, if we are to economically describe the full range of grammatical
processes that are operating in Tukang Besi. Realising that all the processes are easily
explainable in terms of the relative ordering provided by the thematic hierarchy, we can
propose one underlying system that accounts for the large range of different groupings of
arguments that are accessible to different grammatical processes in the language.","[515, 516]"
"ANA‘She’s already gone home! Wa Yani, that is.’3.8Articles and case markingWe have seen that the structure and choice of nominative or non-nominative case of the
arguments in a clause in Tukang Besi is monitored to a large extent by the pronominal
affixing on the verb, and the choice of articles on nominals. This section summarises the
used of the two core articles, na and fe, in both verbal and non-verbal clauses. There are
constructions that use KPs (NPs with case-marking articles), and yet more that use bare
NPs, without articles; these are now dealt with separately.
3.8.1Nominative naThe nominative article na is restricted in its functions, being a marker of a unique position
in the clause. It can only be used to mark a core argument that has been selected as being
the nominative pivot in that clause. The syntactic ramifications of an argument being the
nominative pivot are dealt with in more detail in chapter 20, though some examples will be
seen in 3.8.3. Givenness, definiteness and referentiality are all pragmatic notions that are
bound up in the specification that is part of a nominative argument’s pragmatic
representation.
3.8.2Non-nominative teIn contrast to the nominative article na, the other article used to mark core arguments, fe,
has a wider range of functions. It is used to markChapter 3AkWH=64non-nominative core arguments;fronted core arguments with nominative case;
predicates of a non-verbal clause;
topicalised core arguments;
the argument in [Cause] role (for certain bodily sensations);The first use, the marking of non-nominative core arguments, is unproblematic, involvingonly the specification that after the nominative KP has been determined, all other core
arguments are assigned the article te. In 3.7.1 we saw that a clause may have a variant in
which the nominative KP is fronted, but remains within the clause, and is marked with te.
In 3.5.1 we saw that both the nominal predicate and the subject of a non-verbal clause are
marked by the non-nominative article fe; this means that both of the NPs are marked in the
same way unless the clause presents a fronted predicate, with only constituent order todistinguish the two arguments (since the clause is equative anyway, this is not really a
problem). With topicalised constructions a core argument is also marked by fe; in order not
to describe a clause-external argument with the gloss CORE, the gloss TOP is used in this
context. Two experiencer verbs, mo‘aro ‘hungry’ and motindo'u ‘thirsty’ allow an
optional ‘object’, the cause of the sensation, to be present in the clause, and marked by te.","[89, 90]"
"Syntactic units and the clause
3.10.271Noun PhrasesThe fact that Tukang Besi needs to distinguish between the Noun Phrase (NP) and the
Case Phrase (KP) has already been foreshadowed. The argument for this is that theparadigmatic roles that the constituent traditionally called the ‘NP’ plays in clauses can be
summed up as follows:
°
°
°serve as a direct (core) argument of a verb;
be the unit replaced by a clause in a complement construction;
be the sister of a preposition in a preposition phraseIt is true that the first two of these functions are played by the one constituent in Tukang
Besi; compare the following two sentences:
(75)Dinggawiku-'ita-'e[naWa Darwin — r{um]ato)-:np°.yesterday 1SG-see-30BJ NOM WaDarwin
_arrive.sI
‘I saw Wa Darwin arrive yesterday.’
(lit., ‘Yesterday I saw Wa Darwin who was arriving.’)
(76)Dinggawi ku-'ita-'e
yesterday 1SG-see-30BJ{no-rato
3R-arrive‘I saw Wa Darwin arrive yesterday.’na
NOMWa Darwin]comp.
Wa DarwinHowever, when we examine the structure of a prepositional phrase, we find that anoblique case article + NP constituent is not always the constituent that is the sister of the
preposition. In (77) mina takes a case article + NP sister, but in (78) the preposition kuaoccurs with no article, and indeed cannot occur with an article when specifying motion
towards a person, as seen by the ungrammaticality of (78)':
(77)No-rato[mina[iWa Darwin)xp ]pp.","[96, 97]"
"COREcatNOM2SG‘The cat bit you.’
b. * No-kiki't
3R-bite‘The cat bit you.’
In both (6a) and (7a) the agent beka is indexed on the verb by the third person realis
subject prefix no-, and additionally in (6) the second person singular object is indexed by
means of the second person singular object agreement marker -ko. When this agreement
marker is not used, as in (7), the agent beka must be marked by the nominative article na,and iko’o by the non-nominative article te. This variation in the presence or absence of
object agreement is the only way that the case assigned to nominals may be changed; note
the ungrammatical (6b) and (7b). Clearly, the presence or absence of object agreement on
verbs functions as a form of voice system. The analysis adopted here is that it is a
Philippine-style voice system, with a restricted range of categories, two (a stronger case
for this position is put in Chapter 7.6.1, and an alternative is considered in 7.6.2). In
Tukang Besi the diachronic drift towards head-marking pronominal indexing has
proceeded to quite an extent, but at the same time the overt Philippine-style case system has
been preserved, and its verbal cues reinterpreted as being those involving the presence
versus absence of the object agreement.
Although the transitive verbs we have seen can appear either with or without objectagreement, there is evidence that the suffixed (ie., morphologically more complex)
versions are in some sense the ‘basic’ ones: they appear more frequently in texts
(approximately 70% of transitive verbs in texts use object agreement); they are the citation54Chapter 3forms of most transitive verbs; and, although all transitive clauses may appear with object
agreement, there are some transitive clauses that cannot appear without object agreement,
such as the verb molinga ‘remember’. Furthermore, there are many verbs (see chapter
4.3.3) that, if used transitively, require object agreement, and the limited data available to
me on child language acquisition suggests that children learning Tukang Besi acquire a
command of the object agreement earlier than they do of the subject prefixes. Children
often substitute the near-frozen ‘adjectival’ prefix mo- in the place of subject prefixes until
they are about 5 or 6 years old, but seem to be able to manipulate the object suffixes ontheir verbs much earlier, indicating that object indexing is learnt earlier than is subject
indexing.
3.4.3Passive clausesCompare these patterns with those found with a to- passive form (see chapter 11), in
which no by-phrase may be mentioned, and the single argument of the verb may be
indexed on the verb by means of subject prefixes, seen in (8):
(8)'U-to-kiki'inaiko'o.","[79, 80]"
"Other ambitransitive verbs with this subcategorisation frame include the following:
bongko
buke
buti
hesowui
liketie, be tied
open, be open
fall, drop
wash
wake uplulestrip, be nakedmota’acook, be cookedponofill, fullpusi
saba'econfuse, be dizzy
divide, be separateFinally, one verb, waliako ‘return’, appears to have the following subcategorisation
frame:
waliako({Ag),({Thm/Pt]))‘return’This is different from the ambitransitive verbs that all require a nominative patient/theme,and allow for an optional agent; waliako has an agentive argument, and allows that
argument to act on itself, intransitively, or on another object, transitively. This contrasts
with the closely related verb mbule ‘return’, which is a simple agentive intransitive verb,
and does not allow for a transitive interpretation:mbule ({Ag]) ‘return’Word classes4.6105Closed word classesThe closed word classes show less internal division, less derivational morphology, and
much smaller membership than the open classes of noun, verb (and adjective). Some of
these, the independent forms of the pronouns, and the referential and actual
demonstratives, for instance, are better thought of as belonging to a greater nominal class,
but they are described here separately, due to their smaller membership and restricted
derivational possibilities.
4.6.1Personal pronounsPersonal pronouns are available for first, second and third persons, and further
differentiate number three ways for first person (singular, paucal and plural), and two
ways for second person (singular and plural). The paucal category is being eroded to
become a plural exclusive one, through contact with other languages, foremost Malay, that
use this distinction. The pronoun class can be thought of as having one set of free forms,two prefixed sets, and three suffixed sets (one of which is becoming obsolete). There are,
however, very few features distinguishing the free forms of the pronouns from any other
noun, and might be better thought of as being specialised nouns, leaving only the bound
forms as true pronouns. Further details on the forms of the various pronominal sets are
given in Chapter 5.
4.6.2Epistememes (interrogatives)Whilst there is clearly a group of words that may be called interrogatives, in that they are
invariably used when asking content questions and for specifying the semantic range of agroup of entities, the actual words themselves fall into different classes, and some are
indeed precategorial. Only a small few of the words can be classed as being epistememes
(see Durie and Mushin 1992, Mushin 1995 for a discussion about the use and justification
of this term), and do not belong in any other word class. The epistememes found in
Tukang Besi are:
paira
Sapaira
-mpaira
popia
piaie'ei, emai, ie'‘emai
‘umpa
ha‘awhat
how much (price)
what kind of
how many (n.)
how many
who
how, where
how, do whatnoun
epistememe
precategorial
numeral + classifier
numeral
noun
epistememe
verbkehia
(d)ehiawhen (future)
when (past)epistememe
epistememeanuthingy, whatsitprecategorialThese words, and their use, are discussed in more detail in chapter 19.","[130, 131]"
"-1SG.POSS‘The thing which belongs to me’c. *(TeCORE[On[iOBLiso)REL PHRASE IKP..--yon‘The thing which is over there’
In the case of the inalienable marker, the anaphoric marker, the previous reference
marker, and most genitive constructions, attribution of a head in the same phrase is the
only option. For non-animate genitive constructions (ie., possession of an inanimate) there
is the option of using the ‘dummy’ head-filler anu ‘thingy, whatsit’, and with oblique case
phrases an appositional phrase may be used to express the oblique relation of a non-headed
noun phrase, provided there is an overt nominative article emphasising the oblique phrase
reference. Appositional phrases are dealt with in more detail in section 12.4, but examples
illustrating their appearance with relative phrases are given below:
(41)a.",[337]
