Paragraph,Page number
"5.6.2.2.3 Enhancement
Here the relationship between the subordinate clause and the constituent it
modifies is a circumstantial one of place. That is, the thing referred to by the
modified constituent (either a nominal phrase, or an adverbial) fulfils a
circumstantial role of location in the enhancing clause; by contrast, in extension
(5.6.2.2.1) the thing fulfils a participant role in the extending clause, or is a part
of a participating entity. The clausal constituent modified may be either a
nominal phrase (NP or PP), or a spatial adverbial, referring to (or implying) a443CLAUSE COMPLEXESplace. The enhancing clause (like the extending clause discussed above) always
occurs in final position in the clause complex, typically next to the constituent
of the primary clause that it modifies. That is, the qualified referent is normally
new, and the unmarked focus of the primary clause - and as such it always
finds overt realisation in that clause. (It is of course normally ellipsed in the
following enhancing clause.) Furthermore, the enhancing clause is inv~bly in
the factive mood. This clause always occurs in final position in the clause
complex, usually next to the modified constituent in the primary clause. An
example is
(5-427) yoowooloo bijngarni -ngiddangi maningga booddoongoo
man
he:emerged on:us
night
from:the:northgimangarna yoowooloo liUd -gila-wooddoobush:man man
go
FACT PRES+(3pl)N+I
'A man came up to us that night from the north, where Aborigines
still live in the bush.'gambinyi jilji
-ya ngilmangi
(5-428) doornmi
he:covered:it egg
sandhill LOC to:the:south
warang -gila -ari
sit
FACT PRES/(3sg)N+I
'He buried the egg in the sandhill that stands to the south.'
Note that, as (5-429) demonstrates, the role borne by the modified
constituent in the main clause need not be a circumstantial one.
(5-429) milayawa
gindiwa nzya}t nyibaddi
you:will:see:it upstream this
[name]
warang -gila
-ari
sit
FACT PRES/(3sg)N+I
'You'll see upstream (the place) where Nyibaddi lives.'
5.6.2.2.4 Concluding remarks
We have seen that as a rule the elaborating clause and the subclausal constituent
it modifies (in case it is not ellipsed) are as a rule immediately next to one
another. They might be regarded as juxtaposed; however, the two do not together
form a unit complex, as is the case in other juxtapositions. The clause either
precedes the constituent it modifies, or follows it. These possibilities appear to
be another reflection of Bolinger's (1967) distinction between referent and
reference modification (discussed above, section 4.1.2.2). As was the case within444THE CLAUSEthe NP, material preceding the referring expression (in the primary clause) serves
to modify its reference, whilst material following it serves to modify the
referent5.6.2.3 Linguistic significance of the types
The full range of logico-semantic and tactic relations that exist between the
clauses of a complex are schematised in the following table.
Table 5-2: Inter-clausal relationships in Gooniyandi
parataxis
clausal:
extension
constituent:
clausal:
elaboration
constituent:clausal:enhancementhypotaxis
addition
replacement
descriptives
exposition
completion
clarification
identification
characterisation
temporal:
successive
inclusion
manner
apprehension
purposeconstituent:identification
clarification
(-wila clauses)clausal:conditional:
counterfactual
future
generic
reason
(-ya clauses)
temporal:
past
future
(-ya & -wila
clauses)constituent:
location
(-wila clauses)
To conclude this discussion of clause complexes I will briefly enquire into
the linguistic status of the above relationships, addressing the question as toClAUSE COMPLEXES445whether the types merely interpretations engendered by the context, and have. no
linguistic significance (cf. Hale 1976:86, and McKay 1988). I will look atthe
tactic relationships frrst, then at the logico-semantic ones.
In all clause types identified in the table, one clause, the PRIMARY clause;
carries the main burden of the message. The other clause(s) carry less important
information, and will be referred to as SECONDARY clauses. Parataxis and
hypotaxis may be distinguished in terms of the order relationships that may
obtain between the primary and secondary clauses.
In clause complexes of the types listed in the frrst column of Table 5-2,
the primary clause is the one which comes frrsl In enhancement, the enhancing
clause, which always comes second, expresses a situation secondary to the
situation enhanced upon. (Where the situations are temporally successive, the
most important one is the one occurring frrst: in general, the occurrence of the
second is dependent on the occurrence of the frrst. Furthermore, I would argue
that the fact that the clauses are conjoined indicates that the speaker does evaluate
the event frrst to occur as the most important; otherwise, s/he could have chosen
to use two isolated clause-sentences.) In the case of addition, as in English, the
first clause expresses the situation that the speaker evaluates as the most
important: in (5-366) the most important part of the message concerns getting
the hearer to do something. Similar remarks apply to the other relations of in
the parataxis column. At frrst sight it may appear that in identification the
opposite order occurs, i.e. that the secondary precedes the primary clause: here
the identifying clause, which corresponds to relative clauses in languages such as
English, always occurs first. But closer examination of the facts shows that this
type does not in fact contradict the ordering principle. This type typically occurs
in the context in which the identifying clause carries the new infonnation, and
the following clause carries given information. Consider for example (5-223)
above, in which the final clause of B's response is information given in A's
question.
It is clear that in clause complexes of the types listed in the second column
of Table 5-2, the primary clause is always the one in unmarked (or indicative)
mood; the secondary clause is always the one in a marked non-indicative mood.
Here clause order has nothing to do with the primary/secondary opposition;
where reversal of the order of the clauses is possible, it does not change the
status of the clauses as primary or secondary. This suggests the inherent
secondary status of clauses in non-indicative moods in these types of clause
complex. The clauses are of unequal status. On the other hand, the fact that
reversal of clauses in complexes from the first column of the table induces a446THE ClAUSEchange in the relative status of the clauses indicates their equal footing. This
justifies the distinction between parataxis and hypotaxis.
Turning now to the logical relationships, we fmd that in hypotactic clause
complexes the enhancing relationship of location may be distinguished from the
others by virtue of the fact that the order of clauses is fixed in the former, but
not in the latter relationships. In location, the subordinate clause always follows
the main clause; in the other hypotactic types, the subordinate clause more often
than not precedes the main clause. Condition is morphologically distinct from
identification and time, except in the future tense, where both condition and time
are realised by a subjunctive clause (I will return to this shortly). Identification
and time can be distinguished as follows: if there is, initial in the main clause,
an endophoric word referring to (and/or summarising) the subordinate clause, it
must be a determiner in identification, and the adverbial miga 'thus, in thus
manner' in time. In other words, identification and time are sometimes formally
distinct, and are in principle distinguishable. Similarly, it should be possible to
distinguish future temporals from future conditionals by the endophoric element
that may occur initially in the main clause. And it seems that only temporals
allow the adverbial miga 'thus, in thus manner'. The discussion of this paragraph
shows that the logical types in hypotaxis identified in the previous section have
linguistic validity as covert categories: they are distinguishable by agnation, and
not by form alone.
Things are not so clear for the various types of paratactic complexes, and it
is beyond the scope of this book to determine whether each of the logical types
identified above are linguistically significant. I will merely remark on the
statuses of constituent descriptives, constituent identification, and clausal
temporal inclusion. Identification stands out from the other paratactic
relationships by virtue of the fact that one of the endophoric determiners may
come initially in the secondary clause, and refer to the thing identified by the
primary clause. It would seem that constituent descriptives and clauses related by
temporal inclusion overlap, but do not coincide: clause complexes admitting the
latter interpretation admit the former only if the clauses share a nominal
constituent. Furthermore, neither of these two types appears to display a
linguistic property distinguishing them from clausal addition.
But constituent identification in parataxis stands out from the remaining
paratactic relations in other ways. Identification is the only logical relationship
common to both parataxis and hypotaxis. Indeed, paratactic identification may be
grouped together with hypotactic identification, conditionals, and temporals, in
terms of textual structure. In each of these the expanding clause typically comesCLAUSE COMPLEXES447first, and would appear to function as a type of thematic clause in the complex,
establishing a thing involved in, a place at which, a time when, or a condition
under which the situation referred to by the primary clause did or may occur. The
thing established may be referred to by an initial endophoric element in the
following, main clause. This makes the construction reminiscent of the thematic
option of reprise (cf. above page 375, and Grimes 1975). As we have seen, such
initial subordinate clauses always occur on their own, typically fall-rise;
intonation contour. This may be compared with the rising tone on reprised nonclausal themes (page 374 above).
For each of the types identified in the preceding paragraph, final position
for the expanding clause is far less frequent, and this clause may reasonably be
regarded as a type of afterthought, added to clarify an omitted (or ellipsed) theme;
the tone typically falls throughout, and is usually lower than the tone of the
primary clause. Thus, as suggested above, the two types of constituent
elaboration, characterisation and clarification, are merely thematic variants of
identification. The subordinate types are typically added when the theme is
something which has gone before, or is a presupposition, but which the speaker
ascertains the hearer may have difficulty in identifying; the paratactic type adds
new information of a peripheral nature. The four types, paratactic constituent
elaboration, hypotactic constituent elaboration, hypotactic conditionals, and
hypotactic temporals, may be grouped together and distinguished from the
remaining types by virtue of their possession of a theme-rheme structure. They
are thus in a sense more tightly structured, and more clause-like than the other
types.
It is now clear that a number of the types distinguished in the above
discussion do in fact have linguistic significance. This was shown by (1) formal
differences in the choice of moods and resuming determiners; (2) differences in
the significance of clause order; and (3) the fact that the class of complex
sentences allowing a particular interpretation differs from the class allowing
another interpretation. It remains true that many particular clause complex
tokens are multiply ambiguous. Presumably the interpretations are influenced by
the context of the text and the speech situation in which the particular complex
occurs. To take one example, (5-430) occurred in a context in which my
collaborator and I were discussing the previous work on the Gooniyandi
language. No previous mention had been made of this particular white person.
(5-430) ngamoo gardiya
-ngga thangarndi yoodjingi
before white:person ERG word
he:put:it448THE CLAUSEmirlimirli -ya
nangbani
IJiper
LOC he:died
'Before a whiteman put some (Gooniyandi) words on paper, but he
died.'
The whiteman who put (Gooniyandi) words on paper before died.'
'Nthe whiteman put (Gooniyandi) words on paper and died.'
In this context, the first two interpretations are the most likely. Since the white
person had not yet been mentioned, the speaker might have intended that the frrst
clause establish such an individual, and mention as a further observation that
this man had died (in fact, the speaker was wrong here). Alternatively, he may
not have intended that the person be established in this way, but his identity left
indefinite, the point of the utterance being that although someone had previously
worked on the language, this was quite a while ago. If, however, the discourse
had been concerned with the exploits of a particular white person, the third
reading would be the most likely one. Naturally there are formal correlates of the
discourse and speech situation factors, showing up in the order of words in the
constituent clauses, whether or not they are ellipsed, etc. (cf. Merlan
1981:188ff). We cannot here attempt to identify factors influencing the
interpretations of particular examples.","[426, 427, 428, 429, 430, 431, 432]"
"..
PRONOMINALS1673.6 Pronominals
The category of person is realised in a number of different places and ways in the
grammar of Gooniyandi. Within the VP it is realised by bound morphemes,
which occur either as prefixes to the classifier complex, or as enclitics to the
entire verb phrase (see section 3.9.3.6). Elsewhere, it is realised by free words,
and in a set of two possessive suffixes to kin-tenus (see section 3.12.2.1). With
two minor exceptions (see pages 225 and 234 below) the system is constant
throughout, distinguishing three persons (first, second and third), two numbers
(singular and non-singular) and what I will refer to as a restricted/unrestricted
opposition in the first person non-singular.
The restricted category in the first person non-singular encompasses the
traditional categories of first person dual inclusive, dual exclusive, and plural
exclusive, whilst the unrestricted category corresponds to the first person plural
inclusive. In other words, the inclusive/exclusive distinction is maintained only
in the plural; it disappears in the dual. The unrestricted category always includes
the speaker, the hearer, and at least one other person; the restricted category
excludes one of the non-speakers. Using the symbolism S =speaker, H = hearer,
and 0 = other(s), and assuming that S and H can refer to a single individual
only, while 0 may refer to any number of others, the restricted and unrestricted
categories may be distinguished as follows:
Restricted
UnrestrictedsH0+
+a-a++where a can be either+ or-, -a having the reverse polarity. Equivalently, we
could describe the restricted category as S & (H v 0), where 'v' signifies
disjunctive or; and the unrestricted category as S & H & 0.
To the best of my knowledge, pronominal systems resembling the Gooniyandi
one have not been reported in any other language, from Australia or elsewhere.
Among the neighbouring languages, those from the Pama-Nyungan family which includes Walmajarri (Hudson 1978:85), Jaru (Tsunoda 1981:64ff), and
Wangkajunga (my own fieldnotes)- and the Worrorran family- e.g. Ungarinyin
(Rumsey 1982b:31) - make the usual inclusive/exclusive distinction in the first
person non-singular. In the Jarrakan languages Kija (my fieldnotes) and
Miriwoong (Kofod 1978:47), this distinction is at least optional. However, all of
the languages of the Nyulnyulan family (traditionally located to the west of
Gooniyandi and Bunuba) show a quite different system, which distinguishes four
persons 1, 1/2, 2, and 3, and, depending on the language, two or three numbers,
minimal, augmented and, where three numbers are distinguished, unit augmented
(Stokes 1982:151ff).","[151, 152]"
"34INTRODUCTIONan intcractant in the situation might make. In this way the possible senses of
!he English prompt are relatively restricted and there is a better .ch~ce that the
linguist and the native speaker were referring to the same sttuattons, from
similar viewpoints.
Formally elicited utterances can never be completely deco~textu.alised, ~d all
sorts of speakers' behaviour indicated that they did no~ pe:cetve elt~er th~~ o_wn
or my utterances as isolated. For instance, frequent swttchmg of toptc, ehcttatwn
of paradigms, and requests for implausible utterances (such as 'you died') were
frequently met with by resistance such as boredom, and, less frequently. re~sal to
produce the requested form. More interestingly, the entities I established m my
English prompts were treated as belonging to the participant-register of the
discourse, and where possible, treated as ""given"" (Halliday 1970: 162). Speakers
did not like being forced to translate the English NPs verbatim (see also below
page 251 and section 5.3.1). It is clear that speakers regarded the elicitation
process as text-producing, and their responses were characteristic of genres
appropriate to the referential content. Much of the formally elicited data is, then,
in a sense controlled, or constructed text, rather than isolated, decontextualised
sentences. The primary thrust of elicitation was to develop and construct such
contexts as might not frequently arise in conditions where recording was possible.
Because elicitation is text-producing, and because many morphemes and
morpheme combinations are unlikely to arise in free texts, I do not even aspire to
Heath's (1984:4) ideal of a ""corpus-based grammar"" (where 'corpus' includes free
!t•xts only). Although I am mindful of the many dangers inherent in using elicited
materials. I cannot concur with Heath's assessment that he had "" ... no confidence
whatever in such data, since my own early ""data"" of this type often turned out to
be: seriously wrong"" (Heath 1984:5). As I will discuss later, I feel that this
mtsrepresents the nature of linguistic data, by taking it to be an observable
Clbject, independent of the observer.
By far the most problematic aspects of elicitation seem to me to relate to
the practices of seeking speakers' judgements of utterance acceptability (see
~low), and their intuitions and explanations of meaning differences. In the
mcumstances of ~y field:vork these did not prove to be very satisfactory field
~etho~s. and I av?t~ed !herr usc as much as possible. As a rule, in those instances
~~ W~tch two dtshnct forms might conceivably refer to the same referent
Sltuauon, speakers were unable to pin-point the subtle distinctions in meaning
conv~yed ?Y the variant modes of expression. I was invariably informed that no
meamng dtfference existed.ln the ~ourse of producing material for the Gooniyandi language
~rogram~ne m the Yiyili Community School (see section 1.8), I had
c pponu~1ty to ca:efully check my transcriptions of a number of words, and my
P~~l~t'm 1.~ ~nalys1s. Careful.auention was paid to 'problem areas', especially: (I)
dtsttngmshmg between ap1co-alveolar, apico-postalveolar and lamino-dental
consonant.~. which I experienced great difficulty in telling apart (since then I
have. fm:nd that the phonetic contrasts in Gooniyandi are not as perceptible to
the English car as are tlle phonetic contrasts between the corresponding segmentsDATA USED IN THIS INVESTIGATION35in some other Australian languages); and (2) the question of whether the cont.rnst
between apico-alveolars and apico-postalveolars is neutralised word initia1ly (as
it is in many Australian languages). Many words were checked with more than
one speaker, and over more than one repetition (successively and on different
occasions), using both auditory and visual evidence. From this work, I produced
a dictionary of about I 000 items, the phonemic representation of which I am
relatively confident. This dictionary, which includes all items of Hale's 100 word
list, the relevant items of Douglas (1959/1977), as well as all words from the
texts chosen for the school book, and a number of 'suspicious' and crucial words,
is the primary data base for the statistical analysis of phoneme distributions
(section 2.2.5).
The investigation into tlw textual organisation of the clause (section 5.3),
as well as a significant part of the study of the clause complex (section 5.6), is
based primarily on textual material. (Initial hypotheses were, however,
formulated on the basis of the elicited corpus.) From a large corpus of twenty or
more hours of recorded texts, fifteen texts were selected for close scrutiny; three
of these appear in Appendix I. These fifteen texts, which were chosen more or
less at random- and not for any reac;ons of their merit as coherent texts- are
monologues encompassing all genres represented in the corpus. There is no
reason to b~lieve that they are not typical representatives of their genres. They
were narrated by three different individuals, including the youngest and the oldest
speakers. The chosen texts vary in length from about a minute and a half to over
ten minutes, in all totaling about forty-five minutes. Altogether there are alXlllt
800 clauses. The texts had been transcribed word for word in the field with the
assistance of the speaker; most had also been worked over on at least one
occasion with another native speaker. I studied them again away from the field,
attempting to identify and mark in significant suprascgmental features, which I
was convinced played an important role in the organisation of the text as a
message bearing unit (sec section 5.3).
The reader will notice that no sentences are starred as unacceptable or
ungrammatical in this grammar. The present description is based entirely on
occurring, and ipso facto acceptable, sentences. Problems in eliciting acceptance
or rejection of conslructed examples arc well known, and I will not go into them
here- but see for example Bolinger (1968), Christie (1980), Haas (1973), and
Quirk and Svartvik (1966). Suffice it to make Lhe following three observations,
specific to the context of my research. Firstly, speakers were as a rule unwilling
to label utterances I produced a<> unacceptable - rather than respond to the actual
form of my utterance, they almost invariably presumed that I intended to express36INTRODUCTIONsome meaning, and attempted to determine and respond appropriately to that.
And secondly, on the other hand, in more than one instance in which a speaker
had firmly rejected an invented example, he later used the same construction
himself. The reasons for the initial rejection always remained unclear to me.
Finally, my theoretical purpose is not, and was not, to delimit the class of
grammatical sentences (if indeed such a class is well defined - cf. Hocketl
1967), but rather to describe and account for the meaning potential of
Gooniyandi utterances.","[46, 47, 48, 49]"
"612BmUOORAPHYInternational Phonetic Association. 1949. The principles of the International
Phonetic Association. London: University College.
Jakobson, R. 1936. Bietrag zur allgemeinen Kasuslehre, Gesamtbedutungen der
russischen Kasus. Travaux du cercle linguistique de Prague VI. 240-288.
Jakobson, R. 1957. Shifters, verbal categories and the Russian verb. Cambridge:
Harvard University Press.
Jespersen, 0. 1924. The philosophy of grammar. London: Allen and Unwin.
Kaberry, P. 1939. Aboriginal woman: sacred and profane. London: Routledge
and Kegan Paul.
Kendon, A. 1978. Yuendumu sign language project. Memorandum I. Canberra:
Research School of Pacific Studies, Australian National University.
manuscript.
Kilham, C.A. 1977. Thematic organisation of Wik-Munkan discourse.
Canberra: Pacific Linguistics, B-52.
King, L.D. 1983. The semantics of tense, orientation and aspect in English.
Lingua 59. 101-154.
Kofod, P.M. 1978. The Miriwung language (East Kimberley).· a phonological
and morphological study. MA thesis, University of New England.
Kolig, E. 1973. Tradition and emancipation: an Australian Aboriginal version of
'nativism'. Supplement to Newsletter, Aboriginal Affairs Planning
Authority, Western Australia 1(6). 1-42.
Kolig, E. 1981. The silent revolution. Philadelphia: Institute for the Study of
Human Issues Publications.
Kress, G. (ed.). 1976. Halliday, system and function in language. London:
Oxford University Press.
Kress, G. and Hodge, R. 1979. Language as ideology. London: Routledge and
Kegan Paul.
Kuno, S. 1976. Subject, theme, and the speaker's empathy - a reexamination
of relativisation phenomena. In Li, C.N. (ed.), Subject and topic. New
York: Academic Press. 417-444.
Kuno, S. and Wongkhomthong, P. 1981. Characterizational and identificationat
clauses in Thai. Studies in Language 5. 65-109.
Ladefoged, P. 1971. Preliminaries to linguistic phonetics. Chicago: University
of Chicago Press.
Laughren, M. 1982. Warlpiri kinship structure. In Heath, J., Merlan, F. and
Rumsey, A. (eds.). 72-85.
Lawrence, R.M. 1979. Police review 1829-1979: since the days of Stirling.
Perth: Government Printer.","[590, 591]"
