Paragraph,Page number
"3. 7.2 Functions of the postpositions
The major meanings and functions of each postposition are set out in the
remainder of this section. No attempt is made to separate those uses which
correspond to significant functions within the language (such as Agent, Means,
Manner, etc.) from those which are identified merely on intuitive grounds, and
correspond to no systematic distinction made in the language (such as the
possessor relationship). Although it is my belief that ultimately the
meanings/functions of each postposition will be accountable for as
contextualisations of a single core or formal meaning (see section 6.1), the task
of specifying these formal meanings is beyond the scope of the present analysis,
and I do not attempt it here. In order to reduce repetition, the information is
given in abbreviated form, making reference to discussion and examples from
later sections.3.7.2.1 -ngga ERGative
This postposition marks clausal constituents in the following roles:
(a) the Agent, regardless of its person or number, in a clause of 'directed
action' - i.e. a transitive, middle or reflexive/reciprocal clause (see section
5.2.1.3 and examples therein).
(b) the Instrument in all clause types (section 5.2.2.3), regardless of
whether it is a body part or non-body part Instrument. (However, it should be
noted that body part Instruments are far more frequent than non-body part
Instruments - non-body parts are more often Means than Instruments; see page
343 below.)
I reject the view proposed in many grammars of Australian languages that the
instrumental as a distinct CASE from the ergative (see for instance, Tsunoda178'IHEWORD1981:5 5, Dixon 1980:306-307, and cf. Dixon 1980:299). In my view, the
evidence they cite demonstrates that there are two distinct clausal roles, Agent and
Instrument, NOT that there are distinct cases. Thus I do not distinguish, as do
many Australianist linguists, between syntactic and semantic, or core and
peripheral CASES (or case marking postpositions); I see these contrasts as relevant
only to clause level roles (see chapter 5 below, where I make similar, though not
identical, distinctions).(c) nominal expressions (NPs and PPs) realising circumstantial roles of
Means (section 5.2.3.3), Manner (section 5.2.3.4), Cause (section 5.2.3.6) and a
subset of the Accompaniment roles (see section 5.2.3.5) in clauses of directed
action.
(d) nominal expressions functioning as Attributes of Agents (section
5.2.4).
(e) non-finite VPs in the circumstantial role of Manner in clauses of
directed action, as in example (5-332); and in non-finite VPs functioning as
Attributes of the Actor (not necessarily an Agent) in any clause type- see
examples (5-278) and (5-279).
When it marks the Agent, the ergative postposition is optional except
when the Agent is inanimate, in which case it is obligatory (see page 319 below
for further discussion). In the other circumstances of its occurrence, its presence
is usually obligatory - there are just a handful of instances in which, on
repetition of the utterance, the ergative postposition was dropped from a
circumstantial expression involving -binyi PER- see section 3.7.2.8 below.
Not only does the ergative postposition sometimes not occur where
expected- that is, it fails to mark an Agent- but occasionally also it occurs
where it is not expected, in an intransitive clause. The second use of -ngga ERG
mentioned under (e) is one instance of this type. There are also examples in
which the Actor of an intransitive clause is marked with -ngga ERG. One such
example is
(3-83) yoowarni -ngga I yoowarni -ngga gardiya I Cherrabun Bore I
one
ERG one
ERG white:man
warangji I gamba I bambimnga -widdangi booloomani -yoo I
he:sat
water
he:pumped:it for:them cattle
DAT
'There was a white man at Cherrabun Bore, who was pumping
water for cattle.'
Exactly how such examples as this should be accounted for is not yet clear.
What seems to be a recurrent feature is that the following clause is transitive.
This suggests that the ERG postposition occurs in anticipation of the followingrosrrosmoNs179transitive clause, or alternatively, perhaps that the intransitive clause is an
interpolation. (Some other Australian languages display this phenomenon in
similar circumstances -see Haviland 1979:155 on Guugu Yimidhirr and
McGregor 1979:119 on Ngaanyatjara.) Useful as this explanation may be, it
does not account for the occurrence of the ergative on non-finite VPs in
intransitive clauses (as in example (5-278)).
Finally, let us remark on the shapes of the two locational terms
ngirndangaddingga 'this side (usually of a body of water)' and
ngooddoongaddingga 'that side (usually of a body of water)'. These are evidently
constructed from the determiners ngirnda 'this' and ngooddoo 'that', with the
addition of -ngaddingga, which might plausibly be analysed as the sequence
-ngaddi-ngga COMIT+ERG. If this is the case, at least as an historical
derivation of the above forms, this may (partly) account for the formal identity
of the Gooniyandi ergative postposition with one of the allomorphs of the
locative found in many Pama-Nyungan languages, and suggest an origin for the
former in a locative marker. (That the locative and ergative morphemes coincide
in some Australian languages (for instance, Mparntwe Arrernte - Wilkins in
preparation) attests to the plausibility of a historical derivation such as this.)
3.7 .2.2 -yoo --woo DATiveThe dative postposition -yoo- -woo marks units in both clause rank roles ((c),
(d) and (f) below), and phrase rank roles ((a), (b) and (e) below).
(a) Possessors, both alienable and inalienable- see example (4-11) below
- are marked by the dative, provided that the possessor is realised by a nominal
expression. Where the possessor is referred to by a pronominal, a distinct
oblique case form of that pronoun is used instead- see examples (3-72) to
(3-74) above.
(b) Attached to an oblique pronominal, -yoo DAT indicates that the referent
of the pronoun is someone or something who is not necessarily in possession of
an item, but has some access to it, to use it in certain ways, when that item is
for the benefit of the person or thing. Example:
(3-84) ngirndaji riwi mangaddi ngaddagi -yoo -miya
this
camp not
my
DAT ONboojoo -yoo -nyali
all
DAT REP
'This place is not only for me, it is for all of us.'yaddangi
our180Tim WORDThis is also a possible sense of the dative when attached to a nominal
expression, but the difference is formally apparent only when the dative is
attached to a pronominal.
It should be noted that the sense I am alluding to here is independent of
ownership: it could be that in some sense the speaker and his group do own the
place referred to in (3-84). But this possession is irrelevant. The contrast here is
not one of temporary vs. permanent ownership, or of present vs. future or
imminent ownership.(c) A nominal expression realising the Goal participant in a middle clause
(see section 5.2.1.3 and example (5-66)), or the Affected participant in a clause
of another transitivity type (see 5.2.2.1) is marked by -yoo DAT.
(d) Nominal expressions and non-finite clauses fulfilling the circumstantial
roles of Purpose (sections 5.2.3.7 and 5.5.2.4) and Matter (sections 5.2.3.8 and
5.5.2.4) are marked by the dative postposition.
(e) Within an NP also, the dative postposition may mark a qualifying
expression {either a nominal expression or a non-finite clause) which indicates
the purpose of the referent thing, or a respect in which some attribute holds of it
-see example (5-299).
(f) -Yoo OAT frequently, although not always, marks nominal and
adverbial expressions referring to future time (see below section 5.2.3.2).
As was the case with the ergative postposition, the dative postposition is
occasionally absent where its presence is expected. This occurs in circumstance
(b), where it marks the Goal or Affected participant. An example is (3-85)- see
also example (5-70).
(3-85) maningga wardnginhi::
ri ? maJa I George Rundin
night
I:went:up:to:him
boss
[name]
migaliminhi I
I:told:him
'That night I went to the boss, and told him, George Rundin.'
What is common across the circumstances pertaining to the omission of both
the ERG and the OAT is that the postposition is omissible if and only if the
phrase is also cross-referenced in the verb. This certainly suggests that the
presence of the postposition may have something to do with disambiguation;
however, it will be shown below (pages 319-320) that there are insurmountable
problems with this hypothesis, and that it must be rejected.","[162, 163, 164, 165]"
"2INTRODUCTIONthe low vowel only. There are no sibilants or fricatives, v01cmg is not
distinctive, and stress has a purely delimitative function (Trubetzkoy 1969:27).
Words almost always begin with a consonant, very rarely with a consonant
cluster; the apical distinction is neutralised word initially. Word medially a fairly
large number of two member consonant clusters occur. Non-verbal roots are
nearly all disyllabic or longer and typically end in vowels. Verbal roots are
phonotactically unusual (cf. Dixon 1980: 159): a large number are monosyllabic,
and many end in consonants, occasionally consonant clusters.
Lexical words may be divided into three main classes or parts-of-speech,
each with a number of subclasses: nominals, verbals, and adverbials. These are
open classes, each with a large number of members. Pronominals constitute a
distinct closed class and distinguish three persons and two numbers. Instead of
the inclusive/exclusive distinction normally found in the first person nonsingular in Australian languages, Gooniyandi makes a restricted/unrestricted
distinction. In this system, the unrestricted pronominal refers to the speaker, the
hearer, and at least one other individual; the restricted pronominal refers either to
the speaker and the hearer, or to the speaker and one or more persons other than
the hearer. In terms of the traditional categories, the unrestricted pronominal
corresponds to first person plural (more than two) inclusive, while the restricted
pronominal corresponds to the first person dual (either inclusive or exclusive) or
the first person plural exclusive.
Noun classes are not distinguished in Gooniyandi, and nominals do not
inflect for number or case. Instead, number and case information is conveyed by
means of phrase-level enclitics, which are referred to in this book as
postpositions. There are number-marking postpositions distinguishing dual and
plural numbers, and case-marking postpositions conveying ergative, dative,
ablative, allative, locative, and other local meanings. Gooniyandi nominal
phrase marking is not split ergative (Silverstein 1976b, Dixon 1979): any NP
regardless of its person or number may be ergatively marked. The ergative
postposition is, however, optional for all phrase types in the 'transitive subject'
function. Word order in the NP is free in the sense that determiners and
adjectives may precede or follow the nominal they modify. However, the NP
may be described in terms of a fixed sequence of functions or roles that the
constituent words realise.
The verbal complex has properties characteristic of both phrases and words.
It is phrase-like in its position on the rank scale (Halliday 1961/1976): it is a
clausal constituent whose ""granddaughters"" are items of morpheme rank; it is
word-like in that it is a single distributional unit, the constituents of whichlANGUAGE TYPE3occur in a fixed order. There are two obligatory constituents in the verbal
complex: a verbal stem, which always occurs initially, and a 'classifier
complex'. This classifier complex consists of, in the following order: a tense
marking prefix, bound pronominal prefixes which cross-reference certain actants
in the clause, and a 'classifier'. The tense system distinguishes four tenses (past,
present, irrealis and future); the pronominal prefixes on the whole inflect on a
nominative-accusative pattern, and generally show the same person and number
distinctions as do the free pronominals; and the classifiers distinguish twelve
classes of processes (based on aspectual type and valence, to put it loosely). In
addition the verbal complex may have one or more of a number of optional
constituents which provide aspectual and modal qualification, and a further
system of bound pronominals referring to other ('oblique') actants. Although
these constituents occur in a fixed order, their phonemic shapes, and the
boundaries between them, are frequently obscured by morphophonemic
processes.
Spatial adverbs, indicating location and direction, are frequent in motion
(and other) clauses: compass directions are used in preference to left-right
orientation, and temporal sequence is expressed by spatial metaphor. There are
also temporal and manner adverbials.
Modality and other forms of speaker evaluation of a proposition are
encoded in free particles (marking negation, mistaken belief, retribution,
repetition, certainty, uncertainty, and so on} and enclitics (carrying meanings
like 'only', 'again', 'else', 'like', 'etcetera', and so on).
Two main types of clause, verbal and verbless, are distinguishable,
depending on whether or not there is an inherent (see page 293 below) verbal
complex. Verbal clauses show four (not two- cf. Dixon 1980:278ft) distinct
'transitivity' types: intransitive, transitive, middle and reflexive/reciprocal. These
are defined by the ""case frames"" of the inherent nominal phrase constituents.
Intransitive clauses take a single unmarked NP; transitive clauses have a phrase
which may be ergatively marked and an unmarked phrase; middle clauses have a
phrase which may be ergatively marked together with a dative phrase; and
reflexive/reciprocal clauses have a single phrase, which is optionally ergatively
marked. Verbless clauses are either attributive, identifying, or existential. As in
the majority of Australian languages, constituent order is 'free' (Dixon
1980:441), in the sense that changing it does not affect the referential or
experiential meaning (Halliday 1974:47) of a clause. Constituent order is,
however, significant in respect of the textual organisation of the clause (Halliday
1974:47) - that is, the way in which the clause is organised as a message4INTRODUCTIONbearing unit. In particular, Gooniyandi is a theme-first language.
Clause complexes consist of paratactically or hypotactically related clauses.
However, it is impossible to distinguish these two types (or any others) on
purely formal criteria. There are no morphological markers signalling the
interclausal relationships, no structural differences between constituent clauses of
clause complexes and independent clauses, and no necessary cross-clause
reference relations (see Matthiessen and Thompson forthcoming, and compare
Dixon 1980:461). The clause complex types have linguistic validity as COVERT
categories (Wharf 1945/1972: 104). There is, however, a close connection
between subordination and mood, whereby subordinate clauses always have their
verb in a marked, non-indicative mood, either subjunctive or factive.","[14, 15, 16, 17]"
"The expected forms nganyi-yidda (I-ALL) and nganyi-yoo (1-DAT) do not occur.
However, this is the only context in which the oblique form may realise the
Entity function. If there is an intervening morpheme, such as a number marking
postposition, the nominative form occurs:
(3-77) ngidi-yooddoo -yoo gamba
we(R) DU
DAT water
'He'll show it to us two.'binabinawangiddangiyi
he:will:show:it:to:us:twoFinally, the oblique form is found in what would appear to be a type of
circumstance, indicating that the Actor did the process alone, or by him/herself.
The clause may be transitive, intransitive, or reflexive/reciprocal.
(3-78) ngaddagi -moowa ngoorloogla
my
ON
I:drank:it
'I drank it alone (i.e. by myself).'
(3-79) nhoowoo jijagjihis
he:spoke
'He was talking to himself.'
(3-80) ngarloodoo -ngga biddangi -nyali riddwiddarniddi
three
ERG them
REP they:pulled:themselves.,
POSTPOSIDONS173thaanoonggoo
up
'They pulled themselves up by themselves.'
If the pronominals in (3-78) and (3-80) were NP constituents it would beexpected that they might occur in construction with postpositions, indicating
their role in the clause. However, they never do (in the available examples), and
moreover they contrast with PPs such as yoowarni-ngga (one-ERG) 'by one' in
(3-81). Contrast this with (3-78) above.
(3-81) yoowarni -ngga ngoorloogla
one
ERG I:drank:it
'I drank it alone.'
In this respect the oblique forms resemble adverbials, and an alternative
(perhaps equally valid) parts-of-speech classification might place the nominative
pronominals in the class on nominals, and the oblique and emphatic
pronominals in the adverbial class.
The forms I have labeled emphatic are used very similarly to the 'adverbial'
function of the oblique just discussed, but seem to be somewhat stronger,
indicating that not only did the Actor act alone, or as a unified group, but
he/she/they did so for his/her/their own benefit:
(3-82) biddangjinga boorlooboowoodda biddangi mayaroo
their:EMP
they:follow:it
their
house
'They go their own way (i.e. are not directed by others).'
3.7 Postpositions
3.7.1 Preliminary remarks
The postpositions form a small class of non-ranking form units which enter into
constituency with noun phrases, forming postpositional phrases. They are
bound, phrase-level morphemes which typically occur one per phrase, and
attached to any word in the phrase, regardless of its position or role (see section
4.2 below).
Gooniyandi has fourteen postpositions. These may be divided initially into
two groups, as shown below:TIIEWORD174Number markingCase marking
-ngga
-yoo- -woo
-ya
-nhingi
-yangga
-yidda
-yayi
-yayoo
-yawpo
-binyi
-ngaddi
-winyjaERG(ative)
DAT(ive)
LOC(ative)
ABL(ative) 1
ABL(ativeh
ALL(ative) 1
ALL(ativeh
ALL(ative)3
ALL(ative)4
PER(Iative)
COMIT(ative)
DEP(rivative)-yooddoo - yiddi
-yarndiDU(al)
PL(ural)This classification is primarily semantic, although there is at least one
formal correlate: the number markers appear to be distributionally restricted to
nominals, whilst the case markers may also occur on adverbials (see page 140
above). The two members of the second column indicate a property of the
nominal phrase to which they are attached, namely its number- and hence their
label ""number marking"" postpositions. The postpositions in the first column,
on the other hand, do not indicate any property of quality of the referent of the
nominal phrase to which they are attached. Rather, they relate that referent to
something else. I have labeled these as ""case marking"" postpositions because
they express a range of functions that are covered by case-suffixes in many
Australian languages (we will.be returning to this point shortly, and later again
in section 42).
Most Australian languages have a set of suffixes comparable with those
laid out above for Gooniyandi (see Dixon 1980:293-301, 322-326). Most
grammars, however, classify the suffixes quite differently. It is customary to
distinguish between case suffixes and derivational suffixes. The former are
inflectional, and give rise to different forms of a single word appropriate to
different syntactic environments, while the latter are non-inflectional, and
produce new lexemes from other lexical items to which they are attached (Dixon
1980:293, 323; see also Huddleston 1984:25). In section 4.2 it is shown that
none of the morphemes listed above are inflections; it can also be demonstrated
that none are derivational suffixes.
Grammars of Australian languages usually treat the comitative, and the
number markers as derivational suffixes (Dixon 1980:324-325). It is easy toPOSTPOSIDONS175show that the number markers are not derivational: they indicate the number of
the whole phrase, not the word to which they are attached (see page 278 below).
The comitative postposition is not a derivational morpheme, since it regularly
attaches to a full NP (as in example (4-80)), and there is no evidence that the
constituent that it attaches to becomes a new lexical item. These same reasons,
show that none of the remaining postpositions are derivational suffixes.
The comitative, though not the dual and plural markers, do, it is true,
occasionally have derivational uses. But this occasional use stands in contrast
with the productive uses of this morpheme as a case marking postposition (see
section 3.7.2.9 below). It might also be noted on the one hand that the
morphemes which I have classified as stem forming suffixes ALWAYS
functional derivationally, and on the other, that -nhingi ABLlt as well as
possibly -ngga ERG and -binyi PER also on occasions form new lexical items
from the one to which they are attached.
I refer to the morphemes in the left hand column above as case marking
postpositions because they fulfil functions which are associated with case
inflections in many languages, including many Australian languages - they
indicate the function of the phrase in the unit of which it is a constituent (cf.
Dixon 1980:292). However, this should not obscure the important difference
that in Gooniyandi the case markers do not form inflectional variants of a
lexeme (see section 4.2 for further discussion of this issue).
One important consequence of this difference is that, unlike most
Australianist grammarians, I do not identify a zero-marked absolutive case,
which contrasts with the ergative. There are a number of reasons for this
descriptive strategy. Firstly, it would imply a postposition which had an
invariant zero form. Whilst it is possible to maintain such a notion, there is
simply no evidence in the language which lends support to it. (To argue this
would be tantamount to arguing that subject NPs in English were in fact
prepositional phrases with a zero preposition.) Indeed, what evidence there is
leads us to reject the idea: to maintain that there were a zero postposition would
imply that the zero marked unit were an exocentric construction; this is in fact
false. Secondly, zero marking does not signal anything in itself, but the absence
of other meanings. Thirdly, no significant semantic or syntactic generalisation
arises under the zero postposition hypothesis.
All but four of these postpositions show phonologically conditioned
allomorphic alternations, as follows:
(i) -ngga ERG. This postposition is affected by two sandhi rules. One is rule
R9, by which -ngga dissimilates to-ga following a vowel that is preceded by a1761HEWORDnasal-stop sequence (see examples on page 98 above). The other is rule R9,
which inserts an epenthetic /i/ when the root ends with the velar nasal. For
example, gooddanggooddang-ingga (diverbird-ERG) 'by the diverbird'.
(ii) {y} initial postpositions. Nine of the postpositions have an initial f y}. Inaccordance with rule R6 of section 2.4.2.3.1, this initial segment hardens to /j/
following non-continuant consonants. Few Gooniyandi nominals end in
consonants, and in most cases the form of the postposition with initial /j/ is
attested only when the nominal is a borrowing from English, or when the
postposition is attached to a verbal root with a final stop or nasal (see below).
Examples illustrating the hardening process are: Jag-joo (Jack-OAT) 'for Jack',
babligaj-jaljanggal-jiddal-jayil-jayoo!-jawoo (pub-LOC/ABJ..dALLtfALLjALL:J
ALL4) 'at/from/to the pub', goorij-jangga (hold-AB~ 'from holding', and Dayibjooddoot-jarndi (Dave-DU/PL) 'a pair/group including Dave'.
(iii) -woo DAT. The verb specific allomorph -woo of the dative postposition issubject to VR6, the effect of which is to harden the initial ( w} to /g/ when
following a non-continuant, as for instance in gaj-goo (cut-DAT) 'for cutting'
and ngarag-goo (make-DAT) 'for making'.
The -yooddoo- -yiddi allomorphy is not phonologically conditioned. The
choice seems to be a matter of speaker's preference: some speakers use the
former, while others prefer the latter. (Today at least, the two forms do not
appear to be dialectal variants associated with distinct regions.)
In addition to occurring in constituency with NPs, some postpositions also
occur in constituency with PPs, adverbials and/or non-finite clauses. The first
possibility gives rise to sequences of postpositions, since the postpositions
from each PP are typically attached to the same d-word. Only a small subset of
the sequences that COULD occur actually DO occur. The first member of any
postposition sequence must be one of -nhingi ABLI> -ngaddi COMIT, -binyi
PER, -yooddoo DU, or -yarndi PL. Of these, the number markers -yooddoo DU
and -yarndi PL can be follow~ by any other postposition (note also that they are
always flrst in a postposition sequence). The remaining three, the case markers,
may be followed by the ergative -ngga only.
Postposition sequences may also arise when a PP is embedded as a constituent of
an NP which is itself embedded in a PP. No new sequences arise in this way.","[157, 158, 159, 160, 161]"
