Paragraph,Page number
"1HEWORD168If the additional feature [+singular] is invoked, it is possible to distinguish
and characterise all of the pronominal categories, as shown in Table 3-4, which
cites the nominative forms.
Table 3-4: Feature specification ofGooniyandi pronominalss
H
0
sgnganyingidiyaadinginyjigidi+++-a+
+
++
+(-)(-)(+)a
(+)(-)niyibidi+
++The bracketed symbols of the bottom line indicate that number specification is
redundant for the non-third person categories. However, that number is relevant
to, or inherent in, these categories is evident from the fact that when the nonsingulars occur in the Entity role in NPs, it can be, but need not necessarily be
marked more precisely by number words, or by the postpositions -yooddoo DU
and -yarndi PL.
The feature analysis of Table 3-4 specifies each pronoun in such a way as
to distinguish it from every other pronoun, and associates with each an
underlying meaning specified in terms of features. This neatly encapsulates the
referential meaning of the two non-singular first person pronouns ngidi and
yaadi, providing a formal statement of the verbal description given earlier.
However, it should be noted that this does no more than provide a formal
summary of the earlier verbal statement. We must raise the question as to
whether the proposed analysis has any independent linguistic validity, and/or
whether any linguistic evidence might be invoked in support of it. The answer
to this would seem to be almost certainly NO: it is difficult to see how any
linguistic evidence might be relevant to the analysis. A more important problem
with the analysis, however, relates to the fact that the proposed features are
purely referential, and so cannot account for the avoidance usage of yaadi, in
place of ngidi, in reference to the speaker-hearer dyad, and of bidi 'they' in place
of niyi 'he, she, it', in reference to a single individual (see section 1.5 above).
As an alternative means of description, we might attempt to arrange the
Gooniyandi pronouns in a two dimensional paradigmatic set of the usual sort.
Something of this sort has already been implied by my reference to yaadi and
ngidi as first person categories in opposition to one another, the former beingPRONOMINALS169labeled unrestricted, and the latter, restricted. This implies an arrangement of the
pronominals as follows:
1sg
nganyi2
3nginyji
niyinon-sg
R ngidi
u yaadi
gidi
bidiAn alternative analysis might not take the + values for S in Table 3-4 as
defining the category of first person, but instead distinguish yaadi from all other
pronominals by virtue of the fact that it alone has a+ value for each of S, H and
0. The pronominals could then be arranged as follows:
12
3
1/2/3sg
nganyi
nginyji
niyinon-sg
ngidi
gidi
bidi
yaadiThe advantage of the paradigmatic approach is that it does not use strictly
referential features, and so does not suffer from the problems in avoidance usage,
inherent in the earlier analysis. However, there seem to be no strong arguments
for one paradigmatic arrangement over the other (see also McGregor forthcoming-c), and I have arbitrarily chosen to view yaadi as a first person form.
It will be clear that at least three individuals must be included in the
referent set of yaadi 'we unrestricted'. I have heard only the plural marker -yarndi
in construction with yaadi 'we unrestricted' in natural and elicited Gooniyandi
speech. However, when I constructed the d-word yaadi-yooddoo (first person
unrestricted-DU), it was not rejected outright, but speakers suggested that it
might refer to just three of us, the speaker, the hearer, and one other person.
(Alan Rumsey elicited a similar response to the corresponding constructed form
in Bunuba (pers.comm.).) This might be taken to suggest that -yooddoo marks
'plus one' or unit augmented (McKay 1978) rather than 'dual', were it not for the
fact that speakers themselves frequently use yaadi-yarndi (first person
unrestricted-PL) in reference to this particular group of three.
I have already mentioned (section 1.5 and immediately above) shifts in the
pronominal categories in avoidance contexts, whereby non-singular forms are
used in reference to and in addressing a single avoidance kinsman. Reference to
the speaker and a single hearer (where the two are in an avoidance relation to oneTHE WORD170another) is by means of the unrestricted yaadi, instead of the usual and predicted
restricted ngidi. One might predict that in such circumstances the dual
postposition could be used to mark the number: i.e. yaadi-yooddoo (we
unrestricted-DU) in reference to an S and a H in an avoidance relation. There are,
however, no supporting examples for this possibility.
Corresponding to each person-number combination distinguished in the
language, there are three distinct free-standing pronouns, which I will regard as
alternate forms of a single lexeme. I will refer to the forms as nominative,
oblique and emphatic; they are tabulated in Table 3-5.
Table 3-5: Gooniyandi pronominals123NOM
OBL
EMP
NOM
OBL
EMP
NOM
OBL
EMPsingularnon-singular
unrestricted
restrictednganyi
ngaddagi
ngaddajingangidi
ngiddangi
ngiddangjingayaadi
yaddangi
yaddangjinganginyji
ngaanggi
ngaangjingagidi
giddangi
giddangjinganiyi4
nhoowoo
nhoongjingabidi
biddangi
biddangjingaThe reader will observe that there are a number of striking regularities in
the forms shown in the table above.
The emphatic forms are obviously based on the corresponding oblique
forms: a segment -jinga is added to a truncated version of the oblique
pronominal. For the non-singulars, the final vowel is deleted; for the singulars,
the final vowel and preceding consonant are deleted; and for the third person
singular, the velar nasal is inserted preceding -jinga.
Secondly, the non-singulars show d in the second syllable of the
4 Although the third person singular nominative form is homophonous with the
determiner niyi 'that' (see 3.3.1.1), that they are indeed two distinct words is
evident from the fact that the latter does not have a distinct oblique form
nhoowoo, as does the pronominal; nor does it contrast with the non-singular
pronominal bidi 'they'.","[152, 153, 154, 155]"
"•
NOMINALS143It is, however, possible to distinguish some subclasses, nearly all of whichhave a limited number of members: determiners (3.3.1), kin-terms (3.3.2),
subsection terms (3.3.3), number words (3.3.4} and proper nouns (3.3.5). These
are semantically homogeneous subclasses, and they often have distinctive
distributions within the NP, and/or with respect to certain stem-forming
suffixes.
For the remainder of the nominal class I have been unable to identify
subclasses showing distinctive formal and semantic properties. The class of
nominals includes, in addition to the subclasses mentioned in the preceding
paragraph: words for concrete objects such as flora {types of plants and trees),
fauna (various animal species), humans (including sex and age specific terms),
and their parts ('root', 'tail', 'feather', 'eye', etc.); features of the weather and the
elements (including 'fire', 'water', 'rain', 'wind', etc.); topographical and
environmental features (such as 'rock', 'creek', 'hill', 'limestone', etc.); and
artefacts ('spear', 'boomerang', etc.). Also included are more abstract words for
songs, rituals, colours, shapes, sizes, feelings ('shame', 'fear', 'anger', etc.), and
just a few terms for the most common action types ('sleep', 'motion', 'travel' (or
'walkabout') and 'fight').
3.3.1 Determinersoeterminers constitute a small closed class of nominal words which normally
realise the function Deictic in the NP (see 4.L2 for a discussion of this term).
To be precise, determiners may be defined as those words which may realise the
NP roles of Deictic, Qualifier and Entity, but not the Quantifier or Classifier
roles. This formulation of the definition is necessary in order to exclude from the
class, words such as yoowarni 'one', garndiwangooddoo 'many', etc. which may
also realise the role of Deictic (but which are not determiners semantically).
Being closed, the class of determiners could be defined by listing its members;
however, it is useful to have this independent 'distributional' justification which
shows that it is not just an arbitrary collection, set up by the analyst in the
absence of good reasons.
Determiners may be assigned to one of two categories: definite and
indefinite.
3.3.1.1 Definite determinersDefinite determiners are of three types: (1) demonstratives, which point to
something in the situational context of the utterance; (2) endophors, which referTIIEWORD144to entities mentioned in the linguistic context -usually in the preceding text,
but sometimes in the following text; and (3) a non-demonstrative, nonendophoric determiner which identifies an entity which is, or need be in neither
the linguistic nor the situational context.
[1] Demonstrative determiners distinguish two degrees of distance with respect tothe speaker, proximal and distal:
Proximal:
Distal:ngirndaji
ngooddoo'this'
'that'Both of these terms are used in reference to places as well as things (although
not, it appears, in reference to times).
There is a third term, ngirnda, which also refers to an object in the
proximity of the speech situation. But it is not clear precisely how this term
differs in meaning and function from ngirndaji 'this'. In quite a number of
examples ngirnda was used in reference to something closer to the speaker than
to the hearer, particularly when the object was invisible to the hearer. For
example, it was used in reference to an object concealed in the speaker's hand
(which the hearer believed was elsewhere) (see example (6-57)); and in another
instance it occurred in a direct quote in a text, the purpose of which was to draw
the attention of the addressee to a dead body the speaker had found. To the best of
my knowledge, there are no examples in which ngirnda is used in reference to
something relatively closer to the hearer, and/or visible to the hearer and not the
speaker. The functions of the determiner ngirnda require further investigation.
[2] There are two endophoric determiners which are usually used in anaphoric
reference to a previously mentioned entity. They are:
niyaji 'this'
niyi 'that'
(Niyi 'that' is homophonous with the third person singular pronoun, but can be
distinguished from the latter on morphological, as well as functional grounds
(see section 3.6). However, it is often difficult to be certain that a particular
instance of niyi is the determiner or the pronoun.)
The difference in meaning between these two words is not perfectly clear,
but seems to be roughly as follows. Niyaji is frequently used in reference to
something which was mentioned in the immediately preceding text, often the
immediately previous clause, and which is assumed to be in the forefront of the
hearer's consciousness. It is frequently used in the ""reprise"" construction (see
section 5.3.2), illustrated in example (3-12) below. Niyi, on the other hand,•NO:MINALS145often 'picks up' a referent established earlier in the text, but which has not been
in the foreground for some time. For example, in a text about Pigeon (the so
called ""outlaw of the Leopolds"" -see 1.6 above), reference is made to an
Aboriginal police tracker by the phrase niyi-ngga yoowooloo-ngga Roebourne
Mick-ngga (that-ERG man-ERG Roebourne Mick-ERG) 'by that man
Roebourne Mick'. This person, who had been introduced ten clauses earlier, had
played no significant role in the events described in the eight intermediate
clauses. (See also line (42) of Text 1.) However niyi is sometimes used in
reference to an entity fore grounded in a text, or one which may be assumed to be
in the forefront of the hearer's consciousness. In this case it has an emphatic or
contrastive effect- see for example (6-30) below, and line (81) of Text 1. The
difference between the two terms thus seems likely to lie in the relative
prominence they give to the referent item, rather than in the proximity of the
anaphor within the text.
In addition to referring to previously mentioned things, the two determiners
niyaji 'this' and niyi 'that' are used in making reference to portions of text of size
larger than phrases - that is, to situations, and not just entities. For instance,
in
(3-ll) garingi ngangjayi
niyaji wila
wife
he:might:have:given:him this
OK
'Had he given him (his daughter) as a wife, it would have been OK.'niyaji 'this' refers to the whole clause garingi ngangjayi 'he might have given
him a wife'. More accurately, it refers to a FACT (Halliday 1985:227), the
situation referred to by the clause (see 5.2.1), rather than the actual wording of
the clause. But the section of text may be larger than a clause. For example,
niyinhingi (that-ABL) and niyaji-nhingi (this-ABL) are used as sentential
connectives, with the approximate meaning 'then, after that', where the thing
referred to is either a single event (referred to by a sentence), or an episode
(referred to by a larger stretch of text. (fhere appear to be individual preferences,
some speakers preferring and almost always using niyinhingi 'after that'; others
prefer niyajinhingi 'after this'.) None of the other definite determiners may be
used in this way: they always refer to material entities or places.
[3] The determiner ginharndi, which is normally glossed 'you know' or 'that one,
you know' by speakers, refers to something which is neither in the immediate
speech situation, nor mentioned in the surrounding text. It indicates that, in the
speaker's estimation, the hearer is able to identify the entity being referred to, it
being known to him or her. The fact that it is explicitly stated as being shared1461HEWORDknowledge is the only clue that is given to the hearer to help him/her identify it.
(I'he neighbouring Jaru language also has a determiner jangu with a very similar
meaning- Tsunoda 1981:63.)
The two most frequent uses of ginharndi in my corpus are (i) in reference
to individuals with whom both my Gooniyandi teacher and I myself had shared
some experience (e.g. a visit), and (ii) in reference to individuals spoken about in
previous conversations. For example, {3-12) illustrates the first usage:
(3-12) ngooddoo -ngga NPfginharndi goomboo]NP wardgilayi
that
ERG
you:know woman
she:had:gone
-ngangi moolooddja -yidda niyaji -ngga barnnginaddi
with:us Mulunja
ALL this
ERG she:retumed:me
gaddwaroo
afternoon
'The woman who went to Mulurrja with us brought me back
yesterday.'
It should be noted that ginharndi is not a definite article, and has a range of
uses quite distinct from the English article the. Ginharndi marks the referent of
an NP as identifiable, and so definite; but only a small subset of definite NPs
may be so marked. As distinct from the English definite article, ginharndi
indicates a specific characteristic by which the referent may be identified: it must
belong to the register of entities known, but not present in the linguistic or nonlinguistic situation. (Compare Halliday and Hasan 1976:71.)
3.3.1.2 Indefinite determinersThere are three indefinite determiners, which indicate that the identity of the
referent of the NP is not known to the speaker. They frequently carry the added
nuance of requesting this information from the hearer: that is, they are often used
with interrogative effect (cf. Dixon 1972:182ff). However, it is clear that this
interrogative sense is not a part of the fonnal meaning of the words (section
6.1), but is engendered or suggested by the context of its occurrence (see also
sections 5.4 and 5.3.1 below). This follows from the fact that there are contexts
of occurrence of these determiners (namely when they occur with the enclitics
-ngaddaya 'also, too' (section 6.3.5) and -widdi 'identity unknown' (section
6.3.6)), which do not admit interrogative interpretations. The three indefinite
determiners are:•NOMlNAI.Sngoorndoo
ngoonyoo
jaji147'someone, who'
'something, which'
'something, what'Ngoorndoo is used only when the unknown entity is believed to be human
(but see below page 148):
(3-13) ngoorndoo -ga
dijjingi
someone
ERG he:broke:it
'Someone broke it,' or 'Who broke it?'","[127, 128, 129, 130, 131, 132]"
"···PARTS-OF-SPEECH137be able to occur in most of the environments in which yoowooloo 'man' occurs,
and certainly always in the first two. Restrictions are generally attributable to
semantic and cultural factors. For example, many words that are notionally
nouns have not been encountered in contexts like (3-9); the reason for this is
obvious: people don't normally address ants, water, trees, etc.. But these are
semantic (or pragmatic), and not grammatical restrictions, and it is easy to
invent contexts in which addressing ants or trees would not seem too unnatural
-in fact, I have a short piece of text in which the speaker addresses a particular
tree of mythical significance. On the other hand, there are lexical roots that occur
only in a subset of these environments, not including the first two, and yet other
lexemes occurring in complementary environments. Thus, even though lexemes
are multifunctional, it is possible to identify classes by occurrence in common
ranges of syntagmatic environments.
In these respects Gooniyandi would appear to be intermediate between
English and what is reportedly the norm for Australian languages. According to
Dixon (1980:271), in the majority of Australian languages lexical roots belong
to disjoint classes which are defined by occurrence in specified syntagmatic
environments. In Gooniyandi, classes defined in this way overlap considerably:
as in English, as we have seen, a single word-form can usually occur in a variety
of syntagmatic contexts. But Gooniyandi is unlike English which has a large
number of pairs like dog (noun) vs. dog (verb), bottle (noun) vs. bottle (verb),
etc., where the meaning differences are not fully predictable, thus making it
necessary for the dictionary maker to provide separate definitions for each distinct
context of occurrence. In Gooniyandi the differences of meaning are as a rule
completely predictable, and one dictionary definition will suffice.
This is not to deny the existence of homophony in Gooniyandi. As far as I
have been able to determine, however, there are very few homophones. The only
convincing examples I have been able to find are doowa 'store' and doowa 'he
gets it'; and nginyji 'you', nginyji 'certainly, indeed' and -nginyji, a form of the
classifier +DI which refers to the action of a first person singular agent on a
second person singular patient (see below section 3.9.3.2).
Most examples which at first appear to be homophones turn out on closer
examination to be single lexemes whose variant senses can be explained as
contextualisations of a single basic meaning. Consider, for example, widdijwhich translates both 'dig (a hole)' and 'scratch'; yiniga which translates as both
'how, in what manner' and 'say or do something'; miga which translates 'that
way' and 'tell, say, think'; and yiganyi which corresponds sometimes to 'maybe,
perhaps' and sometimes to 'sneakingly'. For each of these four phonemic forms IiI
I!t
~THE WORD138have given two or three approximate English glosses. based on the native
speakers' glosses in various examples. Across a large number of examples
(consisting of Gooniyandi-English translation ""equivalents"") the glosses given
for the words fall into the two or three distinct English expressions as indicated
above. It seems likely, however, that these senses are not as unrelated as the
glosses would immediately suggest to the English speaker, and that each form is
a single Iexeme having a single basic meaning. Very approximately, widdijmeans 'scrape a surface with a relatively sharp or elongated instrument'; yiniga
means 'what or some manner of action'; miga means 'this manner of action'; and
yiganyi means 'uncertain, unsure' (where cultural factors determine what
constitutes lack of assurance).
The major parts-of-speech in Gooniyandi are set out in Table 3-1 below.
Each lexical word/morpheme can be uniquely assigned to a class.
Table 3-1: Gooniyandi word and morpheme classes
BoundFreeNon-verbal
OpenclassesVerbalNominals
Adverbials
ParticlesLinguisticVerbals
Nominal stem
forming suffixes- - Postposition&
- - - -1-Closed
classesEncliticsVerbal stem
forming suffixes
1-- - - .","[121, 122, 123]"
