Paragraph,Page number
"•, Ii'THE CLAUSEThere are two main possibilities: the action may be directed out from the
Agent to some (conceptually) distinct entity, or it may be directed back on itself,
from the Agent back to the same entity. In the latter instance, there are two
further possibilities: either the activity is directed from each single entity
constituting the (set of) Agent(s) back on to itself (giving the reflexive sense),
or it is directed among the entities constituting the (set of) Agent(s) if this has
more than one member. Only one inherent participant role is involved in this
process type, the Agent himself/herself, and the Process (realised by the VP) is
explicitly marked as directed back on itself by the choice of one of the two
classifiers +ARNI2 and +MARNI.
In case the action is directed from the Agent to a conceptually distinct
Goal, there are two possibilities: the clause may be transitive or middle. The
difference between these two modes concerns the relation that the Goal bears to
the process. In transitive clauses the Goal is an essential feature in the
actualisation of the process, and the action must extend to and reach it, in order
to be effected. Of course I do not mean to suggest that there must be some actual
physical connection between the Agent and the Goal. What I am saying is that
the 'transfer' of action must be completed. This transfer is clear enough in
processes such as gard- 'hit', galiny- 'carry', gaj- 'cut', gajgaj- 'chop', and other
such ""material"" processes, which are clearly actualised through the Goal. (If the
Goal is missed, the process goes unactualised.) But the same also holds for
processes of perception and cognition, such as mila- 'see, look at', danymili'hear, listen to', lingi- 'think about', etc.: the Goal must be actually perceived in
order for the transitive process to be actualised.
On the other hand, middle clauses refer to processes in which the Goal need
not be reached in order for the process to be achieved. Typical middle clauses
include such processes as nyimij- 'wink at', jijag- talk to, miga- 'tell to',
nyamnyam- 'whisper to', yiniga- 'do something to', moow- 'search for', etc .. In
all of these cases the Goal need not be reached in order for the process to be
effected: the person winked at, spoken to, etc. need not receive the
communication; the person sought after need not be found, and so on.
The differences between the two possibilities may be more accurately
described in the following terms. In the transitive mode the Goal is a MEDIUM
- that is, as above, it is something through which the process is actualised and
enacted. In the middle mode, the Goal is instead implicated or involved in the
process, as something towards which the action is directed, but not something
through which the process must be actualised. In a few cases there are minimal
pairs for this distinction. (5-65) and (5-66) are examples involving mila· 'see',THE CLAUSE AS REPRESENTATION325which in the transitive mode requires that the process be actualised through the
thing perceived, but which in the middle mode does not require actualisation.
Other minimal pairs can be found, and more particularly, every type (b)
transitive clause (see page 319 above) is agnate with a middle clause. The
Medium/Goal of the former corresponds with the non-Medium/Goal of the latter:III(5-70) nganyi -ngga boolja I tlrldda thoolnglimi -nhi
I
ERG ball I dog
!:kicked
acit
'I kicked the balVdog.'
(5-71) yaanya -ngga ngaddagi -yoo I -ya thoolngmi -ngadda
other
ERG my
DAT I LOC he:kicked at:me
'The other (man) kicked at me.'f'!","[308, 309]"
"200TilE WORD
~ {gardngind[oo
]ni} (by CCR3)
+retroflex
~ /gardngoondoorni/ (by CCR4 and CCR16)(4) Rule CCR9: i + bi ~ oo. Only the singular pronominals have final vowels,
so this rule applies only in the case of two singular actants (and then with the
exception of the cases in which (lsg) is Goal, since the (lsg)A pronominal has a
final consonant). Examples:
{gard
hit-li
(lsg)N{gml -nggi
hit
(2sg)A+bini) ~ /gardlooni/
+BINI
+bini)
+BINI'I hit him'~ /gardginggooni/'he hit you'Construction of the CC with the {boo} and {oo} allomorphs is somewhat
irregular in terms of the construction of the pronominal configuration, which
also varies according to whether it occurs with the present or future tense prefix.
The (oo} allomorph usually occurs following the dd of nominative plurals (cf.
CCR7) and (boo) elsewhere. For example,
{gard -wi
+ng
+iny
+boo -woo}
hit
PRES
(lsg)N
(2sg)A +BINI DEF
~ /gardginyboowoo/
(gard
hit-bi
+jidd
+oo} ~ /gardbiddoo/
FUT (lR)N +BINI'I hit you''we'll hit him'There are, however, irregularities in the distribution of the allomorphs.
{boo} is restricted to the three categories mentioned above, but in just a few
instances {bini} replaces the expected {boo}. These appear to be irregularities,
and I do not attempt to explain them. Instead, the occurring forms are tabulated
below, in section 3.9.3.2.3. In some cases {bini} and {boo} both seem to occur,
apparently in free variation. For example,
{gard -bi
+nggidd +ri
hit
FUT
(2pl)N
(3pl)A
~ {gard-binggiddroo}
~ /gardbinggooddroo/+boo}
+BINI'you (pl) will hit them'and(gard -bi
+nggidd +bi
+bini)
hit
FUT (2pl)N (3pl)A +BINI'you (pl) will hit them'20ITHE VERB PHRASE
~ {gard-binggidd+booni}~ /gardbinggoorooni/appear to be mutually replaceable. I do not know whether these are dialectal
variants, but there is no evidence at all that they differ in representational
(experiential) meaning.
Only one of the rules mentioned above, namely (4), CCR9, also applies to
{boo}, and it does so in similar grammatical environments. (2) (i.e. CCR7) is
prevented from applying by the choice of the oo allomorph following dd; (3)
(i.e. CCR4) can apply only to {bini}; and (1) (VR2) cannot apply since there is
always at least an intervening tense morpheme between {boo} and the verb root.
The following example illustrates the operation of rule CCR9 in conditions as
specified for (4) above:
{gan:l
hit-w1
+nggi
+boo
PRES (2sg)A +BINI
~ /gardginggoowoo/-woo}'he's hitting you'DEFThe function of the classifiers is to indicate the type of process that is
referred to. They cJassify the lexical words (which realise the VP role Process in
Fl) with which they occur, thereby modifying their significance. Classifiers do
not divide the set of verballexemes into disjoint subsets. Most verbal lexemes
collocate with more than one classifier, and the choice between these classifiers
distinguishes among various process types that may be referred to by the same
lexical item. The processes differ in terms of the meaning features set out in the
second and third columns of Table 3-7 (see also section 6.5.5).
The classifiers numbered (I) to (5), (9) and (IO) may occur with
pronominal prefix configurations referring to two actants in the referent
situation. However, all of them except (apparently) for +ADDI may occur with a
single pronominal prefix, which makes reference to a single actant. On the other
hand, those classifiers numbered (6) to (8), (II) and (12) may occur with only
one pronominal prefix. I will refer to them as monovalent rather than
intransitive, since they can occur in some clauses of 'directed action' (see section
5.2.I.3).
At the least 'delicate' level, classifiers may be divided into two groups: (a)
those which classify the process as an ACCOMPUSHMENT; and (b) those which
classify it as EXTENDIBLE. +I is the only exception: it usually indicates
extendibles, but in certain well defined circumstances it can refer to
accomplishments, as will be mentioned below. As I use the term here,
'accomplishment' refers to any process for which there is an inherent point at2021HEWORDwhich it is actualised, before which it has not yet occurred, and after which it has
occurred, and is completed. Examples are processes such as 'hit', 'arrive'. 'die',
etc •. Accomplishments often have 'trains' of circumstances leading up to their
point of actualisation, such as for example the nearing of the destination in the
process 'arrive'. But, until the point of actualisation is reached, the process
cannot truthfully be said to have occurred. After the point has been reached, the
process in usually completed, and may then be truthfully described in a clause in
the past tense. By 'extendible' I mean processes without such points of
completion: once started, they can (at least in principle) continue on indefinitely.
Examples include processes such as 'walk'. 'sit', 'see', 'carry', etc .. There is no
inherent point of accomplishment for processes like these.
Other meanings, very roughly glossed in the final column of Table 3-7 can
be attributed to the individual classifiers. These will be discussed in more detail
in section 6.5.5. A few further remarks may be in order here, for the reader's
orientation.
Many more subdivisions are made within accomplishments than
extendibles, of which there are only three subtypes, which very broadly
correspond to the trichotomy transitive (+A), intransitive (+I) and
reflexive/reciprocal (+ARNI:z). However, the importance of the major division
accomplishment/extendible can be seen from the fact that all distinctions other
than this one are neutralised in the reflexive/reciprocal.
It is tempting to analyse· the -rni in +ARNI2 and +MARNI as a
reflexive/reciprocal suffix to the two classifiers +A and +MI. However, +ARNI2
chooses different allomorphs of the first person singular to +A, and has an
irregular third person singular. And +MARNI cannot be regarded as consisting of
the (mad allomorph of +MI, since (i) the first vowel of +MARNI does not
harmonise with the vowel of the preceding syllable, and (ii) rule CCR13 cannot
be modified to give /a/ as the realisation of (a1 } preceding rn, since this does not
occur when the /rn/ belongs to the potential mode -rni (see below section
3.9.3.5). A special allomorph {rna}, occurring only before the
reflexive/reciprocal -rni would need to be proposed in order to account for the
occurring forms. The same problem would arise for the suggestion that +ARNI2
should be segmented into +I+rni. For all of these reasons, I regard +ARNI2 and
+MARNI as distinct classifiers.
+BINDI is much more restricted in behaviour than the other classifiers. It
occurs only with pronominal prefixes of singular number; the corresponding
plurals occur with the classifier +L For example, nyamaniloondi (from
{nyamani-li+bindi} (big-(lsg)N+BINDI)) 'I grew big', but nyamaniwiddi (from203THE VERB PHRASE{nyamani-bidd+i} (big-(3pl)N+I)) 'they grew big', or 'they are big'. Furthermore,
+BINDI explicitly refers to the point of accomplishment of the process. and so
is never found with the progressive aspect. Reference to the train of events
leading up to the accomplishment must be made through use of the classifier +I,.
as in nyamaniwangi (from {nyamani-wa-ng+i} (big-PROG+(lsg)N+I)) 'I was
getting big'. It is probably also for this reason that +BINDI is almost never
found in commands, or other uses of language aimed at modifying the behaviour
of the hearer, in all of which cases +I is again favoured. (This is presumablY
because the focus of commands is no engagement in the process over its
completion.) Example:
(3-106) mangaddi dirib -wi
+nggira1
-woo
not
enter PRES (2sg)N/PRES/I DEF
'Don't go inside.'","[184, 185, 186, 187, 188]"
"THE CLAUSE AS REPRESENTATION'319Reflexive/Reciprocal:
ERGPP NOM
Transitive:
(a)ERGPP NOM
NP
ACC(b)ERGPP NOM
NP
OBLMiddle:
ERGPP NOM
DATPP OBLRemarks:(1) The reflexive/reciprocal construction in Gooniyandi is typologically unusual:
in most ergative languages in which the reflexive/reciprocal is verbally encoded
the one obligatory constituent is an unmarked or 'absolutive' one (Edmonson
1978:646-647). It is normally only in those ergative languages in which it is
not verbally encoded that the inherent constituent is an ergatively marked one.
And in keeping with Edmonson's typology, in the Pama-Nyungan languages to
the south of Gooniyandi, Walmajarri (Hudson 1978:66), Wangkajunga (my
fieldnotes), Nyangumarta (Nash 1980:205), which also have the obligatory
constituent in the ergative, the reflexive/reciprocal is realised by an enclitic
pronominal, and is not a feature of the verb.
(2) Unlike a number of so called ""ergative"" languages, ergative marking in
Gooniyandi occurs on all phrase types, irrespective of person (cf. Dixon 1979).
However it is optional: in each of the clause types marked above as having an
ERG PP, the ERG postposition may be omitted, and the participant role may be
realised by an NP instead. There is however a strong correlation between
inanimacy and the realisation by an ERG PP. An inanimate in the appropriate
role is almost invariably realised by an ERG PP.
The exact significance of the presence vs. absence of the postposition remains
unclear. It might be remarked, however, that its main function is not simply to
di~tinguish between the ""subject"" and the ""object"" (to use these terms loosely,
Wlth the obvious senses), as has been claimed with respect to a number of
'optionally ergative' languages, such as Dalabon (Capell 1962: 111), Murrinhpatha (Walsh 1976:405), Motu, etc. (cf. Dixon 1979:71). That this is the case
should be clear from the following observations: In two of the clause types in
which ERG PPs occur, reflexive/reciprocal and middle, it is clear that the ERG is
not needed to distinguish between any roles. Secondly, there are many instances'l··I
III
I,
IrlI:
I~I;I:
Ii
Il'
If· · 'J. ,I1IiI
I320I.
I,II'::IC.","[303, 304]"
"1.2 Territory and surrounding languages
The Gooniyandi people traditionally occupied quite a large tract of land,
extending from Fitzroy Crossing in the west to the vicinity of Margaret River
Station in the east, a distance of some one hundred and fifty kilometres, west to
east. This territory abuts on the Great Sandy Desert in the south, and extends
into the King Leopold Ranges in the north. Two large rivers, the Margaret River
and Christmas Creek, as well as a number of smaller creeks, water the
countryside, which is predominantly river flats intersected by numerous
limestone ranges. The approximate extent of the Gooniyandi territory, as well as
the territories of the neighbouring peoples, is shown on Map 1 (see also Tindale
1974).
The languages spoken in the vicinity are representatives of five distinct
language families, according to O'Grady, Voegelin and Voegelin (1966), and
Wurm (1972)- compare Capell (1940) and (1956/1966). Although it has more
recently been suggested that aJl Australian Aboriginal languages (with two or
three possible exceptions) belong to a single family (Dixon 1980:3), genetic
relations between these five families have not yet been conclusively
demonstrated.
Walmajarri, Jaru, and Wangkajunga, traditionally spoken to the south and
east of Gooniyandi, are the local representatives of the Pama-Nyungan family,
which covers most of the Australian continent (see e.g. map facing page 112 of
Wurm 1972). The Jarrakan (Djeragan, in older spelling) family, of which Kija is
a member, was located to the north and north-east of Gooniyandi; languages of
the Nyulnyulan family, which includes Nyikina, were spoken to the west of
Gooniyandi; the Worrorran (elsewhere spelled Wororan) languages, including
Worrorra and Ungarinyin, were spoken to the north and north-west of Bunuba,5TERRITORY AND SURROUNDING LANGUAGESINDIANWorrorraWyndhameKununurrao
MiriwoongUnggumiWarrwa
Halls Creek o.Lam booJaru
Wangkajungka Community
WalmajarrloBalgoAUS'IRALIAGregory Lake~Map 1: Gooniyandi territory
Key:• Towns
"" Communities
• Stations
Approximate language boundariesINTRODUCTION6and were not geographically contiguous with Gooniyandi.
A comparison of Gooniyandi with surrounding languages shows the
following lexical resemblance rates:
Bunuba:Kija:
Jaru:
Ungarinyin:
Walmajarri:45%
38%23%
22%
22%Nyikina:
8%
Wangkajunga: 3%(see below)
(on Hale's 100 item list; Tsunoda 1981:5)
(on Hale's 100 item list; Tsunoda 1981:5)
(on an 138 item list (see above), Rumsey pcrs.comm.)
(based on Hudson's (1978:97-110) wordlist of approximately 400 items- but cf. Tsunoda 1981:5.)
(on approximately 1500 items of Stokes et a/1980)
(on Hale's 100 item list; my own field notes)The two members of the Bunuban family, Gooniyandi and Bunuba, arc
fairly close genetic relatives, and are lexically, grammatically, and typologically
quite similar. They are perhaps as similar as Italian and Spanish. There is also
quite a high degree of bilingualism in the two languages, especially among lhe
older generation of Gooniyandi and Bunuba people.
The phonological inventories of Gooniyandi and Bunuba are identical
except that Bunuba has a phonemically distinct lamina-dental lateral phoneme
/lh/ (Alan Rumsey pers.comm.), not found in Gooniyandi. Gooniyandi and
Bunuba showed a cognate density of about 45% on a 138 item list, which
included lhe 100 items of Hale's core vocabulary for Australian languages (the
words marked by double asterisks in Sutton and Walsh 1979), plus some other
starred words from an AIAS word list current as of 22/1/1975 (Rumsey
pers.comm.). A count of some of the more frequent and easily segmentable
bound morphemes (36 in number) showed a somewhat higher cognate rate of
66%. The verbal constructions in the two languages are quite similar. But
whereas in Gooniyandi the verbal complex is a minimal free form in which the
verbal stem and the classifier complex (see section 3.9.3.2) are bound to one
another, in Bunuba one of the verbal auxiliaries (which arc the Bunuba
counterparts of Gooniyandi classifiers), namely -ma, has the privilege of free
occurrence (Rumsey pers.comm.).
The Bunuban family differs in a number of typological respects from the
surrounding families. For example, unlike the Worrorran and Jarrakan families,
noun classes are not distinguished, and the nominal phrase exhibits ergative
marking. Secondly, the lamina-palatal vs. lamina-dental contrast in stops and
nasals is found in the Bunuban and Jarrakan languages, but not in the nearby
Pama-Nyungan or Nyulnyulan languages, and in only one Worrorran language,GOONIYANDI CULTURE AND SOCIETY7namely Unggumi (which is geographically contiguous with Bunuba).
However, the five families are by no means totally dissimilar, and there are
a number of common features shared by two or more families, or pairs of
languages from different families. A number of these similarities are fairly
certainly the result of areal diffusion; none can be said with certainty to be
retentions from putative earlier proto-languages. For example, all of the
languages shown on Map 1 have bound pronominals which cross-reference
certain actants in the clause. In the non-Pama-Nyungan languages, they are
typically prefixed to the verbal auxiliary (or classifier in the case of Gooniyandi),
while in the Pama-Nyungan languages they are suffixed to a ""catalyst"" (Capell
1956/1966: 11), or to the first word of a clause. It is also likely that at some
stage the preverb-auxiliary construction, as it may be called (following
McConvell pers.comm.), typical of most languages in the area, including the
Pama-Nyungan ones, was diffused. Such a construction is undoubtedly the
historical source of the Gooniyandi verbal complex, in which the two elements,
the preverb and the auxiliary, have fused into a single free word. Changes have
led to a reanalysis of the verbal complex into root plus classifier.
1.3 Geographical variation
A few minor geographical differences were encountered in Gooniyandi speech.
These were almost entirely lexical. In boundary regions there is usually a
slightly higher percentage of common vocabulary, shared with the neighbouring
language. For example, in the speech of the Gooniyandi people of Yiyili, which
is ncar the eastern border of their territory, a couple of words were encountered
which are shared with Kija and/or Jaru, but which are not usually heard in the
Gooniyandi speech of Fitzroy Crossing and nearby communities. One such word
is gardij- 'cut', which is shared with Kija. However, the differences are too few to
justify the identification of distinct dialects, and none are named (but cf. below).
The speakers themselves are aware of variation in their language, some of
which they attribute to regions, some to particular individuals in these regions
- but never, in my experience, to socio-linguistic factors such as formality.
The main variation perceived is lexical, but speakers are also conscious of some
minor grammatical differences,2 and of a handful of words which have two
2 For instance, on one occasion a verb form which I constructed was rejected as
proper Gooniyandi, but acknowledged as a form used by some Gooniyandi/Kija
speakers in Mulurrja. And some verb forms in the Gooniyandi word book produced
in the Yiyili School (Yiyili Aboriginal Conununity School 1983) differ from the8INTRODUCTIONslightly different phonemic representations. However, it seems that speakers are
not always strictly correct in their expressed beliefs. My observation of actual
usage showed that the variant pronunciation of ginharndi 'you know' as
ginyarndi, for instance, was not geographically determined, despite native
speakers' claims. The so called 'light' form, with the !amino-palatal nasal in the
second syllable, was found in the community in which it was claimed to be
used, but beside the 'heavy' form with the !amino-dental. Moreover, the light
form was also found in other, geographically remote, communities. It may be
that the choice is governed by other factors such as the age or linguistic
provenance of the speaker or the degree of formality of the speech situation, bm
I was unable to verify any of these possibilities.
Quite often speech differences were labeled joowarliny by native speakers of
Gooniyandi (although this term was never used to name anything which could be
unequivocally identified as a dialect). Interestingly, this term (Juwarliny in
Walmajarri orthography) is also the name of a western dialect of Walmajarri
(Hudson and Richards 1978:3). Tentatively, it would seem that the Gooniyandi
term signifies unusualness, non-standard variety (with reference to the speaker's
variety), with connotations of barbarism.","[17, 18, 19, 20, 21]"
"PHONOfACTICS73-di deletion applies to only a small subset of words ending in -ndi,
and this subset is not characterisable or distinguishable from its
complement either formally or semantically; and as remarked above, only
one known -rndi final word undergoes deletion of final -rdi. It is therefore
necessary to mark with a diacritic those words which may optionally
undergo the rule.
It is possible that the -di in -ndi is a relic of an old gender suffix (Alan Rumsey,
pers.comm.). In Ungarinyin, di is an anaphoric element for w-class nominals
which include words for languages, stone things and water (compare the list
above). When used attributive, di (which is a free word in Ungarinyin) always
follows the head noun of the phrase. Furthermore, the majority of Ungarinyin
nouns with final -n are of thew-class (Rumsey 1982b:37,40,41). Additional
evidence suggesting an earlier morpheme boundary within these words is the
existence of a number of close cognates in Jaru, which differ only in the absence
of the fmal -di (and sometimes of fmal -doo). For example, the subsection called
jawandi by the Gooniyandi is invariably jawan in Jaru (fsunoda 1981:8);2 and the
term for 'ashes' is kawun in Jaru (Tsunoda 1981:33), but gawoondoo (never
gawoon) in Gooniyandi (see also Rumsey 1982b:41). (The form gawoondoo
'ashes' is easily accounted for in terms of vowel harmony.) It has been noticed
that the variants with fmal -n are more frequent in the Yiyili community, which
borders on Jaru territory. Indeed, Yiyili people have more contact in the direction
of Halls Creek than with the Gooniyandi communities of Fitzroy Crossing.
Variants with fmal -ndi are more frequent in Fitzroy Crossing, where, for example,
I have never heard jaw an in place of jawandi.",[68]
