Paragraph,Page number
"171Grammarians who treat grammatical postpositions as case-markers define objects marked by ko
as being in the dative case.",[46]
"20~Urdu: An Essential Grammar208Oblique (inflected) pronounsPronouns20921Exception to §208, ‘to’
Whenever a pronoun is followed by a postposition (for example, k6 reFirst and second person pronouns occur in the nominative case before theka , ‘of’, méth (+, ‘in’, SS , ‘from’ , etc.), it occurs in the oblique case,
as shown in the following examples.
The functions of location and direction, as well as many grammatical functions,
are shown in Urdu by postpositions, described in Chapter 5.
The oblique case of the pronouns ham, tum and ap is identical to the nominative
case.","[18, 19]"
"2Grammarians who treat grammatical postpositions as case-markers call subjects marked by kd
dative subjects.",[46]
"110Oblique casea lot of waterWhenever a noun is followed by a postposition (for example, kO 55 , ‘to’; ka~ ot et BTol olyLS, ‘of’; mémhamaré pas kaft cini hai
We have plenty of sugar.
If one has occasion to speak of more than one variety of non-count nouns, they
may be pluralized. However plural amounts of non-count nouns are usually
qualified by the measure or container used to hold them. See §116.ur> ‘in’; sé oa‘from’, etc.), it occurs in the oblique case. Theergative postposition né 2 also takes the oblique case of nouns. (See Chapter
5 for information about postpositions; see §211 for pronouns before né.)1The term ‘case’is used in this work to refer only to bound nominalsuffixes (nominative,oblique and vocative) described below and in Chapter 2. Other grammarians treat grammatical
postpositions (Chapter 5) as case markers. According to this school of thought, a noun followed
by the ergative postposition né is in the ergative case; a noun followed by k6 is in the dativecase, and a noun with no postposition is in the nominative-accusative case.",[12]
"Like nouns, pronouns may occur in the nominative case (for example as
subjects of sentences) or in the oblique case (followed by postpositions; §208).’rsd pewsau dafa sé zyada
more than one hundred timesFODEMONSTRATIVE PRONOUNSGe 20S 92 etmaith dd ghanté
méth airh gi
I will come in two hours.",[16]
"UTae Soe 3. In the nominative case, the plural forms of ye and vo are identical to their
singular forms. Only the verb shows whether the pronoun refers to a singular orBut:plural noun.",[16]
"In some cases, the noun may be omitted, leaving the Noun + vala phrase to
function as a noun.",[31]
"518tak as an emphatic particle$tak is sometimes used as an particle meaning ‘even’. It is more emphatic than
bhi. In this usage it is not a postposition, and the noun (or pronoun) is not in the
oblique case.",[49]
"200Relative-correlative sentencesUrdu: An Essential GrammarRELATIVE ADJECTIVESTable 26: Oblique and plural forms of jo
NowmiNaTIvE
SINGULARPLURALOBLIQUERelative adjectives express a similarity or comparison between nouns in the
relative and correlative clauses. In English they are often translated by words orreoo46, who, which?jisphrases that describe similarity/comparison: ‘such’, ‘like’, ‘just like’, ‘as’. They
agree with the noun they qualify.rcee1108jo, who, which?jin8 9 et et) oSTSTkjaisaIn the nominative case jaisa may be used adjectivally, qualifying a noun (‘like’,
‘similar to’) or adverbially, qualifying a verb (‘as’). The oblique case, jaisé, is
also used adverbially and is described in §1117.","[110, 111]"
"~ UT BS La Igy hy ge Obs
vaharh kuch hilta@ hia sa nazar aya
I could make out something moving there.kaun
+ sa
kaun s& expresses ‘which’ (out of a finite number of possibilities).sa added to nouns and pronouns
Following a noun or personal pronoun, sais similar to jaisa, ‘like’. Personalpronouns will be in the oblique case. Nouns may be in the nominative or obliquecase, with different nuances in the meaning of sa.",[30]
"Nouns may occur in the nominative, oblique or vocative case.",[12]
"Adjective-noun agreementAdjectives agree with nouns in gender, number and case (however adjectives
have no feminine plural form). See §303-§305.",[108]
"INTERROGATIVE PRONOUNSow OS)Sow a) dp217ye log Kaun haith?
Who are they (these people)?kaun sahib b6l rahé hain?
Whois speaking (sir)?kya, ‘what?’ky means ‘what’ (referring to things). It is also used as an adjective qualifying
a noun, especially before oblique case nouns, where it means ‘which’ (§220).
kya shares its oblique case with kaun. See §220, Table 8.
Interrogative words usually come right before the verb. See §1006.",[22]
"Obliques as adverbs of placeSome common adverbs of place are made from (a) adjectives, in the masculine
oblique singular case and from (b) nouns, in phrases consisting of an obliquenoun preceded by an oblique demonstrative. In many instances, the adverbial
use is much more common than use as an adjective or noun.",[37]
"Pronouns before the postposition né-YS>When pronouns occur as the subjects of sentences, the sentence verbs agree withLp She Sl
Vly TS gets! orham né Unto ka karvam dékha
Wesaw a caravan of camels.them in gender, number and person. There is an exception to this rule: thesubjects of transitive verbs in perfect tenses agree with the direct object, and the
subject is followed by the postpositionné (see §510, §629). When followed by-Fné, first and second person pronouns occur in the nominative case. Third person
singular pronouns occur in the oblique case. Third person plural pronouns have
special forms which occur only before né.",[20]
"The infinitive is also used in the nominative case with cahnd, ‘to want’, sikhna,‘to learn’, Janna, ‘to know (how)’, and na, ‘to come’, ‘to know’. The infinitiveoptionally agrees with the noun it refers to (sair, sitar and gari in the examples
below) like an adjective.",[77]
"Table 5: Oblique pronouns + alternate forms Of KB...........ceceesesesesenereteenees 21
Table 6: Forms of pronouns before 06 ..........cceccsseeteesseressenseensaneesecsesereneeneens 22Table 7: Possessive forms of personal Promoumss ........scsscsecsssessrsseeeesseeseeeseesneees 24
Table 8: Oblique and plural forms of ky@ and kaum..........cccc essences 27
Table 9: Gender and number suffixes of adjectives...........scsssssseseesserenseneees 34Verb forms
Present and past verb stemsTable 10: Case suffixes of adjectives...",[5]
"4Grammarians who treat grammatical postpositions as case-markers calf subjects marked by né
ergative subjects.",[47]
"531(ka) + Persian preposition + oblique nounkd is inflected to ké or ki, agreeing with the noun in gender and case.",[52]
"($110). Pronouns also occur in the oblique case before postpositions (§208),
except for the first and second person pronouns when preceding the postpositionné (§209).
If bhi, ‘also’ or bi (emphatic particle) also occur, they normally follow the
postposition. (However see §1206 for an exception.)The commonest postpositions, with their short translations, are:S-S-SKi(~ ke ~ 1d), of, ’s
kito2vé (ergative)Donsé, from, byorsMméth,inxpar, on, atSStak, till, untilka marking objects503Inflected ka in compound postpositionsMany compound postpositions are phrases consisting of ké ~ ki (inflected formsof ka) followed by a noun, adjective or adverb. See §527-§531.
NounX ki taraf < taraf (f.), direction, side, way
in connection with XADJECTIVEoles LxX ké mutabigq < mutabiq (adj.), conformable, similar
according to XGRAMMATICAL POSTPOSITIONS
Grammatical postpositions express for the most part grammatical functions,
such as possession or marking of objects and subjects.ob SS xADVERBnalS xX ké par < iipar (adv.), above, up, over
above X501ka ~ ké ~ ki expressing possessionThe postposition ki (~ ké ~ ki) shows a possessive relationship between two
nouns. It agrees with the noun it qualifies in gender, number and case, like anadjective.",[45]
"5POSTPOSITIONSPostpositions69les ey ol
marh ki dua
mother’s blessing
Postpositions follow nouns or pronouns, and mark (a) grammatical functions,(b) location, movement or extent in space and time. A particular postposition
may have both grammatical and spatial-temporal functions. Urdu postpositionsfunction similarly to prepositions in European languages. Urdu has only a few502Some verbs mark objects with ka. See §526 for examples of the way that verbs‘take’ (collocate with) postpositions.prepositions, borrowed from Persian or Arabic (§1404, §1505).","[44, 45]"
"First and second person pronouns take the nominative case when followed by
né. Third person pronouns take the oblique case, and third person plural pronouns89-90. For theAgreement in perfective tensesVerbs in non-perfective tenses agree with the subject noun or pronoun. (See
§1007-§1010 for a detailed discussion of subject-verb agreement.)= Fad Doers JS peas~F as Obed GSI)anjum imtihin dé gi
Anjum will take the examination.zahidimtihan dé ga
Zahid will take the examination.geil » jinhom()5,-~ )which occur only before né. See Table 6 in §211.
630629onmaith né kahani parhi
I read the/a story.(ye, vo, j6) have variant forms (inhdth (5,3! , unhdrmhVERB13 on pages125Simple pastThe perfective participle is used alone, without an auxiliary, in the simple past
tense. (See §604 for the forms of the perfective participle.) The simple past
shows the completion of a single action or state at a point in the past, without
teference to prior or subsequent events. An adverb of time may focus on the
time the event happened; an adverb of place may focus on where it happened, oran adverb of manner, how it happened. When the context of the event or action
is not the focus, the simple past is typically used in narration.
The simple past is a perfective tense. If the verb is transitive, it agrees with aIn perfective tenses, the agreement pattern depends on whether the verb isnominative direct object (§629). If it is intransitive, it agrees with the subject.intransitive or transitive. (See §801 for a definition of transitivity.) Intransitive
verbs agree with the subject. The subject is in the nominative case.",[73]
"The pronouns mairh, ti, ye and vo, however, have distinct oblique case forms.can also be spelled with » .
Table 5: Oblique pronouns + alternate forms of ko
PRONOUN + koSee Table 5, p. 21.",[19]
"Compounds
Miscellaneous
Comparison of adjectives with tar, tarin; Persian numbers
15S ARABIC ELEMENTS IN URDU
Triliteral root structure of Arabic wordsArabic derived verb forms; Arabic verbal nouns and participles
Noun duals and plurals
Dual form of Arabic nouns; plural forms of Arabic nounsArabic prepositions and particles
Prepositions; negative particles
Miscellaneous
The definite article; nouns of place; nouns of instrument; elative;suffixes272Greetings; introductions and polite exchangesFormal and ceremonious speech276Formal polite requests; thanking someone; congratulationsPious phrases and exclamations
Mentioning holy prophets; phrases for planning or beginning277cc ccscsssesseneesserssessrssraressenesssesesenenes 35Table 11: Symmetrical y-v-k-j word Sets......c.ccccescssseeseeeseeeeeenerscaeeeeneenenenees 39
Table 12: Symmetrical y- v-k-j adverb sets .........ccccccsssesessstsreseenenstesenesatsaneneees 52
Table 13: Overview of aspect, tense and MOO «00... ccc secsetsnrsssersetseeesseeeeeees 89
Table 14: Irregular perfective participles...........c
cusses seeresseeeeneeeeeeeeeenenenerees 92
Table 15: The present, past, subjunctive and future forms of h6na...............00. 92
Table 16: Forms of the subjunctive..........c:cccscssssssesesesssneensenssenessesseeseeeeesenses 97
Table 17: Irregular request fOrms.........cccccsssssesesstesesesceeeseneseseeesessesenenseeatersees 105
Table 18: Forms of the future... ececetcceseeeereneeseeeeeeessstenenersenenesesresenenees 107
Table 19: Continuous present tense Of kan .............cccccssssescessseseesetenenrseneeneess 112
Table 20: Continuous past tense Of karma ...........cecccsesesssnesenesscneereseeeeeesenenes 113
Table 21: Habitual present tense of karin ............cssseesesesessessseceeneeseseneeseeseneees 119
Table 22: Habitual past tense Of karma...
cee ecseseseseeeetseseseeesseenennereneeens 121
Table 23: Immediate past Of JAM...
ccs ssesseecssseeeessenecensssensensesenesseeeseeneneees 127
Table 24: Remote past Of Jama...
ccc cece seneseeeseesseeesenesennenenesteeneneenenes 128
Table 25: Relative (j) words and their ‘far’ (v~u) counterparts... 197
Table 26: Oblique and plural forms Of JO.............ccceeesceeeessetstenesseneteeeereees 200
Table 27: Personal pronouns + bound forms OfDL..........:cccsseseseseeeerseeneeeees 213
Table 28: Adverbs + bound forms Of BE... ccccesecsseteteteesesenenenetseeteeeens 214
Table 29: Cardinal numbers from 1 to 100 0.0... cccceseesseeeeseesceteeeeteeesneenenere 230
Table 30: Numerals from 1 to 100... eeceecstesteneereseeseneeseseesestseeneseesenes 232Table 31: Forms I-VII and X of (od faala.........sssssssssssesseeseseseseseeeensssnnsnssen 260something; phrases invoking protection and short prayers;
phrases of repentance and requests for forgiveness; phrases for
sad occasions; phrases for happy occasionsBibliography
Indexcscs eesessteeseeeeresesessstsnsearsessseseseseerssesseneses 10Table 3: Vocative case Of MOUMNS ......ccissseceesesorssersreresereseseetssseessesenteresenenseas 12
Table 4: Persons and cases of personal pronoumMs ........sccesesessreseereeeesseeeeeeeneees 1714 PERSIAN ELEMENTS IN URDU
The enclitic izifat
Word-forming affixes
Nominal suffixes; prefixes; prepositions; plural suffixes16 CEREMONIOUS AND PIOUS SPEECH
Greetings and introductionsccs sectcnsersesesesseeesseasersrensesecsecsaansrsessesneneneres 6Table 32: Verbal nouns and participles of hs284
286and its derived forms............ 261PREFACEPrefaceby Gopi Chand Narangxvread from cover to cover in a systematic way. As such it breaks fresh ground,
and I do hope it will serve as a model for future intrepid scholars in the difficult
terrain of South Asian grammatical studies.
New DelhiUrdu is a major language of South Asia which has been gaining in popularitysince the advent of independence of India and Pakistan. It is one of the eighteen
national languages listed in the Constitution of India, as well as the national
language of Pakistan. Unlike Arabic and Persian, Urdu is an Indo-Aryan language
akin to Hindi. Both Urdu and Hindi share the same Indic base, and at thephonological and grammatical level they are so close that they appear to be one
language, but at the lexical level they have borrowed so extensively from different
sources (Urdu from Arabic and Persian, and Hindi from Sanskrit) that in actualpractice and usage each has developed into an independent language. This
distinction is further marked at the orthographic level, where Hindi uses Devanagari
and Urdu uses the Arabo-Persian script indigenously modified to suit the
requirements of an Indo-Aryan speech. With this context in view, although the
grammars of these languages cover much common ground, nevertheless in order
to do justice to the differing sociolinguistic paradigms, separate materials have
to be developed for each of these languages, which taken together form the
fourth largest speech community in the modern world.
The grammatical tradition of Urdu and Hindi is now almost three centuries
old, beginning with Ketelaar in the seventeenth century and continuing through
Schultze, Forbes, Fallon, Platts, Shakespear, Gilchrist and others down to thenineteenth century. While Platts’ work has become a classic and is reprinted
time and again, the others have fallen into disuse. Lately, with inputs from
modern linguistics, and the fresh impetus given by Urdu’s new status as a
national language as well as a cultural vehicle of the Indo-Pakistani diaspora, the
need for new teaching materials is ever on the increase. The work of scholars
such as Barker, McGregor,Russell, Shackle, Glassman, Pray, Naim and othershas met some of the present need, however most of them have developed languageteaching books in which a discussion of the grammar is included as part of the
pedagogical requirement. As far as I know, no reference grammar of Urdu (or
Hindi) has so far been written, and it is precisely this gap which the presentvolume attempts to fill.
I have known Ruth Laila Schmidt for more than twenty years, since herstudy of Dakhini Urdu appeared. She is widely travelled in India and Pakistan,
spending years in research and teaching. Her research in the Dardic languageShina, and her Practical Dictionary of Modern Nepali, have in particular been
well received. She belongs to that brand of South Asian linguistic scholars who
deserve attention for their sense of dedication and thoroughness. It has been my
pleasure to interact with her on this grammar,and I found the work fulfilling.","[5, 6]"
"1Table 1: Plural of nouns
109SINGULARMasc. MARKEDPLURALShMarkao>— larkéoSkama<ySkamreroid)- TUpaya2a) § 49)“lySilarMASc. UNMARKEDmsFEM. MARKED
Fem. UNMARKED
108Nominative caseNominative nouns most commonly occur as the subjects of verbs. (In perfective
tenses, however, the subjects of transitive verbs take the postposition né, and are
in the oblique case. See §629.)Mlipaé, rapé-Leykitlarka yahar rahta haigharPsgharo>»larkOlLS3)— larkiyambo— ciriyaObj— ciriyahCLSkitants”kitabérhThe boy livesrupaya kal milé gaThe money will be available tomorrow.
A nominative noun may occur as the direct object of a sentence.",[12]
"SULTObjectsIndirect objects marked by ké or its alternate forms (§210) precede unmarked
direct objects. (See §505 for k6 with objects.)but precedeother adjectives.maith kal ap k6 urdii bazar méth ék acchi dukin dikhairh ga~ FUSS OWS peel SI geeyh 99)
7 OT (gee) GTpossessives,189JT ols at)WOTLal ALmalik
sahib ka kaun sa riStédar
kal aya tha?
Which of Mr. Malik’s relatives came yesterday?~ a Ube U9 ST Ob BaePostpositions (Chapter 5) follow nouns or pronouns, and mark (a) grammatical
functions, (b) location, movement or extent in space and time. Whenever a nounbacci né mehman ké phil pés kiyé
The little girl offered flowers to the guest.is followed by a postposition it occurs in the oblique case (§110). Pronouns also
occur in the oblique case before postpositions (§208), except for the first and
second person pronouns when preceding the postposition né (§209).- begsESolyalA altSahid né apni valida k6 tar bhéja
Shahid sent a telegram to his mother.
1003-5NS eon- 5 SS |bairé ko bulas
Call the waiter.us k6 bulad
Call him.",[105]
"Oblique nouns resulting from dropping of koThé postposition k6, ‘to’, ‘at’ is often dropped in expressions describing movement
to a destination. The noun remains in the oblique case. See §507.
Nouns in time expressions also appear in the oblique case. See §1309, §1311.c9sSTEM PLUS -OmTotality-S111STEM BEFORE -O1h9larké22) * £49)bwksBasic FORMOBLIQUENomiNATIVEWhFEM. UNMARKED11113STUF 63 CT
sab ka sablut gaya
Every last thing was looted.",[14]
