Paragraph,Page number
"Explanations containpose
minimal jargon and emphasis has been placed on the aspects of Urdu that
students.
a particular challenge for English-speaking
Features include:
+
*
*
¢
*language examples throughout in both Urdu script and romanization
user-friendly layout
network of cross-references between sections
detailed contents list
comprehensive index.
Urdu: An Essential Grammar presents a fresh and accessible descriptionof thecolleges,
language. It will prove invaluable to students at all levels in schools,universities and adult classes. Its clear explanations makeit ideal forindependent learners too.n and
Ruth Laila Schmidt lectures in the Department of East Europea
.
Norway
Oslo,
of
ty
Universi
Oriental Studies at theTABLE OF CONTENTSTable of contentsviikya kya; kaun kaun; k6i k6i, koi na koi; kuch kuch, kuch na kuch
3ADJECTIVES
Marking32
32Marked adjectives; unmarked adjectivesList of tables
Preface by Gopi Chand Narang
Introduction
Symbols and abbreviations used in the textAgreement
Agreement in gender and number; agreement in case; agreement
with noun sequences of different gender; attributive and predicate
adjectivesPronouns used as adjectives
iNOUNS
Gender and marking38Interrogative pronouns; indefinite pronounsSymmetrical y-v-k-j word setsGender; marking; marked nouns; unmarked nouns; natural gender;
some other clues to gender of nouns38The categories NEAR - FAR - INTERROGATIVE - RELATIVEAdjective phrases formed with sa and vala
The adjectival particle sa (~ sé ~ si); the suffix vala
Repeated adjectives
Simple repetition; repetition with an echo word
Comparison of adjectives
Comparison of adjectives with sé; comparison of adjectives withNoun plurals
Forms (nominative case); non-count (mass) nounsInflection of nouns
Nominative case; oblique case; oblique nouns resulting from
dropping of k0; expressing totality; vocative case of nounsRepetition of nouns
Simple repetition; repetition with an echo word
Nouns as units of measure
Other parts of speech used as nouns4l
45
46tar, tarin; zyada, ‘more’, ‘most’ and kaff, ‘quite’, ‘too’; superlativeswith adjective + s& + adjectiveAdjectives with other grammatical functions49Adjectives used as adverbs; adjectives used as nounsAdjectives discussed in other chapters
234PRONOUNS
Demonstrative pronouns50Participles used as adjectives; possessive adjectives; the reflexivepossessive adjective apna; numbersye, ‘this’ and vo, ‘that’Personal pronouns
Forms; honorific levels in second person pronouns; ham used as aADVERBS
Symmetrical y-v-k-j adverb setsfirst person singular pronoun; omission of personal pronouns;The categories NEAR - FAR - INTERROGATIVE - RELATIVE15g as a plural specifier; nominative pronouns; oblique (inflected)
pronouns; the suffix € ~ (h)éth replacing kG; pronouns before the
postposition né; possessive forms of personal pronouns
Reflexive pronouns
The reflexive possessive adjective apna; xud and 4p, ‘self’;24apné ap, xud baxud, apas mém, ‘among’
Interrogative pronounsRelative pronoun jo
Repeated pronounsAdverbs of time
ab-ab-kab- jab; is vaqt-us vaqt-kis vaqt; calendar and clock time
Adverbs of place
yaharh-vaharh -kaharh ; idhar-udhar-kidhar, is jagah-us jagahkis jagah; is taraf-us taraf-kis taraf; obliques as adverbs of place;51
55adverbial phrase or compound postposition?
26kya, ‘what?’; kya marking questions and exclamations; kaun,
‘who?’; oblique forms of kya and kaun
Indefinite pronouns
k@i, ‘some(one)’, ‘any(one)’; kuch, ‘some(thing)’, ‘any(thing)’51
5128
30
30Adverbs of manner
yurh- kyon jiith; aisi-vaisi-kaisa-jaisa; is tarah-us tarahkis tarah-jis tarah; adverbial phrases of manner with the
postposition sé; participles used adverbially59Adverbs of degree61Modal adverbs62The negative words nahirh, na, mat; bhi, ‘also’, ‘too’; ‘both ... and’,VitiTable of contentsTable of contents‘neither ... nor’; phir, ‘again’, ‘then’
Arabic adverbs ending in -anRepeated adverbs65
65Simple repetition, idiomatic repetition
Interrogative adverbs used with irony; indefinite adverbs used
with irony; interrogative pronouns used with ironycontinuous tenses; continuous present; continuous past; othercontinuous tenses; root + sakna (ability, possibility); root + panaother habitual tenses; imperfective participle + rahnd (iterative);68imperfective participle + jana (progression); imperfective
participle used as an adjective
Verb forms based on the perfective participle
Agreement in perfective tenses; simple past; immediate past; remoteka ~ ké ~ ki expressing possession; ka marking objects; inflectedpast; other punctual tenses; derived passive; incapacity; perfectivekd in compound postpositions; k6 and its alternate forms; ko marking
objects; ks marking subjects; ko showing movement in a directionparticiple + karna (habit or practice); perfective participle + rahna
(continuation); perfective participle used as an adjectiveor to a destination;k6 after days and dates; k6 following infinitives;ré marking subjects
Spatial-temporal postpositions
sé with ablative function; sé marking the instrument; sé in comparison
of adjectives; sé in adverbial phrases; sé marking objects; sé forming
postpositional sequences; tak showing extent or limit; tak as an
emphatic particle, mém with locative function; infinitives followed
by mérh; par with locative function; par showing movement to a
destination; par following oblique infinitives; oblique infinitive +
par bhi; par marking objects; collocations of verbs with118Imperfective participles alone; habitual present; habitual past;Order of multiple adverbs
POSTPOSITIONS
Grammatical postpositionsconjunctive participles; repeated roots in conjunctive participles;(possibility); root + cuknd (completion); compound verbs
Verb forms based on the imperfective participleInterrogatives and indefinites used with ironyix73124Infinitives
Infinitives as verbal nouns; infinitives as request forms132Constructions with nominative case infinitives134Impersonal constructions; infinitive + hai (necessity); infinitive +cahié (advisability); infinitive + parna (obligation, lack of choice)
Constructions with oblique case infinitives
Oblique infinitive + vala; oblique infinitive + k6; oblique infinitive139+ lagna (commenced event); oblique infinitive + déna (‘let’);
oblique infinitive + verb of motion (purpose); oblique infinitive
+ kd (negative assertion)postpositionsCompound postpositions81COMPOUND VERBS
Compound verbs and simple verbs
The structure of compound verb phrases; the difference between85Intransitive vector verbs
The vector verb jana; the vector verb parna; the vector verb nikalna,
the vector verb uthna; the vector verb baithna
Transitive vector verbs
The vector verb dénd; the vector verb léna; the vector verb dalna; the
vector verb rakhna
Mixed transitivity in compound verbska + oblique noun + postposition; kA + oblique noun; ka + obliqueadjective; ki + adverb; (ka) + Persian preposition + oblique noun;
noun + izafat
Postpositional sequences
Spatial-temporal postpositions + sé
Expressing possession (‘to have’)compound and simple verbs85Inalienable possession: ka (~ ké ~ ki); alienable possession: ké pas;intangible possession: ko
VERBS
Forms of the verb
Root; infinitive; imperfective participle; perfective participle
The verb hina, ‘to be’
The conjugation of honda; honda as an auxiliary verb
Denominative verbs
Verb forms based on the verb root
Subjunctive; conditional sentences; request forms; future tense;143
143146148151Transitive main verbs with intransitive vectors; intransitive mainverbs with transitive vectors
Restrictions on occurrence of compound verbs
95
96152Constructions based on the verb root or infinitive; participial
constructions; passive constructions; negative sentencesPerfective participles as main verbs
Nominative perfective participles; oblique perfective participles155x8Table of contentsTable of contents = xiDenominative verbs in compound verb sequences156INTRANSITIVE, TRANSITIVE AND CAUSATIVE VERBS
Intransitive and transitive verbs157
157The difference between transitive and intransitive verbs; agreement
of verbs; the increment -a; transitives derived with the increment -a;
compound verbs; transitivity with denominative verbs; verbswhich function both intransitively and transitively; exceptions:
transitives without né, intransitives with né
Causative verbs
Direct causatives derived with the increment -4; indirect causatives
formed with the increment -va; causative denominative verbs;
causative verbs in requests168PARTICIPLES AS QUALIFIERS
Imperfective participles176
176Relative adverbs of place10 WORD ORDER AND AGREEMENT IN SENTENCES
Word order
Word order in sentences; objects; noun phrases; adverbs; negative180Subject-verb agreement; verb phrases; agreement with mixedsubjects; agreement with transitive verbs; agreement with
impersonal verbs; mixed transitivity; adjective-noun agreement202jaham, jis jagah; jidhar, jis taraf
Relative adverbs of time
jab; jab sé, jab tak; jab tak+ negative, ‘until’, ‘unless’; jab ke,
‘while’; jis vaqt
Relative adverbs of manner
jaisé; jaisé hi;jis tarah; jum
Indefinite compounds and repeated relatives203205
20712 PARTICLES, INTERJECTIONS AND CONJUNCTIONS
Particles
The contrastive emphatic particle t6; t introducing result clauses210
210in conditional sentences; nahith t6; t6 introducing correlativeclauses; the exclusive emphatic particle hi, sequences of nouns and
pronouns + postpositions + hi; hi occurring as a suffix; kahirh
expressing improbability or apprehension; oblique imperfective
186187
187participle + hi, ‘as soon as’; bhi as inclusive emphatic particle, ‘even’;emphatic and concessive phrases ending in bhi; hi nahim ... bhi in
parallel clauses; oblique infinitive + par bhi, ‘despite’; indefinite
pronouns + bhi, ‘at all’; relative words followed by bhi, ‘-ever’;
the adjectival particle sa (sé ~ si)
Interjections217Vocative interjections; free interjectionssentences; interrogative sentencesAgreement201Relative words followed by indefinite words, ‘-ever’; relative words
followed by bhi, ‘-ever’; repeated relative wordsrepeated perfective participles; perfective participles used as nouns;
perfective participles in compound verbsConjunctive participles
Conjunctive participles used adverbially; repeated roots in
conjunctive participles199jaisa; jitnaAdjectival use of imperfective participles; adverbial use ofimperfective participles; imperfective participle + vaqt, ‘while
(veRB)-ing’; imperfective participle + hi, ‘as soon as (VERB)’;
repeated imperfective participles; imperfective participles used
as nouns
Perfective participles
Adjectival use of perfective participles; adverbial use of perfective
participles; adverbial perfective participles in expressions of time;196
196Relative words and their counterparts; deep structure of relativecorrelative sentences; order of clauses in relative-correlativesentences; stipulative relative clauses; correlatives specified by hi
The relative pronoun jo
Nominative form of jd; oblique and plural forms of j6
Relative adjectivesdouble transitives derived with the increment -4; transitivity with911 RELATIVE-CORRELATIVE SENTENCES
The structure of relative sentences192Leaders and tags
The leaders kyGrh and kyOth na; accha introducing sentences, the
concessive tag sahi; the rhetorical tag na
Conjunctions
Coordinating conjunctions; correlative conjunctions; causal
conjunctions; concessive conjunctions; subordinatingconjunctions; ke introducing subordinate clauses; ke introducing
coordinate clauses; ke introducing quotations and reported facts218220xiiLIST OF TABLESTable of contents13 NUMBERS AND TIME
Numbers228
228Cardinal numbers; ordinal numbers; fractions; ‘once’, ‘twice’, etc.;multiplicatives (‘twofold’, ‘double’, etc.); repeated numbers;numbers with the oblique plural
Calendar and clock timeTable 1: Plural of NOUN...","[1, 2, 3, 4, 5]"
14Reversed form of ké xilaf.in the m. obl. sg. case.,[53]
"132VerbsUrdu: An Essential Grammar
constructions= 56 AT
ee TS Gl ATS oyshowingthe agent,impendingaction,beginning,133permission,purpose, and negative assertion.yirh t6 aksar ap ki avaz suna karti thi
Well, I often used to listen to your voice. (Rusva, Umrad Jan Ada)= et oS bgp Ly 02 dales pa! Gee HAN)639_Infinitives as verbal nounsThe infinitive is basically a verbal noun. It may occur in the nominative case as
the subject of the sentence or, in the oblique case, be followed by postpositions.lakhnau mésh aise mudmlé din rat hiia karté hairh
These things go on night and day in Lucknow. (Rusva, Umra6 Jan Ada)The regular perfective participle of jana is used in this construction.","[76, 77]"
"TRILITERAL ROOT STRUCTURE OF ARABIC WORDS
The TRILITERAL ROOT is the basic structure of the Arabic word. Most ArabicArabic elements in Urdu1501olse hisnazmpoetry259elaswinse Ui \e a5manzimtanzimmunazzam_intizamnizammetricorganization organizedarrangementsystemArabic derived verb formsArabic derives nine verb forms from simple verbs.' The simple verb is designated
as ‘Form I’, and the remaining forms are numbered from Form II to Form X.
Form IX does not occur in Urdu. Each verb form has its own verbal noun (VN),active participle (AP) and passive participle (PP). Arabic verbal nouns and
participles are common in Urdu, and the student will find it rewarding to learnthe formation of verbal nouns and participles.
The Arabic root ae(fa‘ala), which means ‘do’, is traditionally used as akey to demonstrate the affix and vowel patterns in the derived forms. The
function, derivation and formation of Forms I-VII and X of bs are shown in
Table 31 on p. 260. The verbal nouns and participles belonging to these forms
are shown in Table 32 on p. 261. Strong verbs (verbs which do not have the
letters « 9 <¢(’vy)as one of their radicals) conform to the pattern ofhe.words consist of three root consonants, or radicals (a few consist of four). ThePlatts, Dictionary of Urdu, Classical Hindi and English may be consulted forvowels do not belong to the root, but to the grammatical structure of the language.
Various derived verbs, with their associated participles and verbal nouns, are
formed by adding affixes and vowel patterns to the root ($1501). The derived
participles and verbal nouns (rarely the finite verbs) have been borrowed into
Urdu, and the Arabic grammatical patterns are evident mainly in semanticinformation about the derivations of Arabic vocabulary.
The aspects distinguished in the derived verbs (intensive, causative, reflexive,relationships between words with the same root:on the semantic links between related words, but do not substitute for a dictionaryin finding the meaning of a borrowed Arabic word.idesOber!",[140]
"Months; days; writing the date; telling the time
Money
Contemporary currency; old currencyTable 2: Oblique case Of NOUNS...",[5]
"CONSTRUCTIONS WITH OBLIQUE CASE INFINITIVES
645mujhé vaqt za6 karna nahi cahié tha
I shouldn’t have wasted the time.",[80]
"What are these?ye gharé hairnThese are water pots.or abLS 2In the oblique case, however, ye and vo have distinct singular and plural forms.denoting nationality, are classified as both nouns and adjectives. See §319.",[16]
"A variety of infinitival constructions is made with verbs, postpositions or theagent suffix vala (§311). These constructions may be divided into two groups:
(a) impersonal constructions with nominative case infinitives, and (b) personal
constructions with oblique case infinitives plus a postposition or sentence verb.
The first group includes three common impersonal constructions showing
advisability, necessity and obligation. The second includes six personal- ge WWGe ajlye Be ee Ahsee 6ghar chOmné sé pahlé darvazé mérh tala laga dérh
Before leaving the house, (you) should lock the door.aptle lee
~ 2 SIS o pbs otalké liéSSacchi Aly
talim zariri haiaccha muafara banané
In order to build a good society, good education is necessary.",[77]
"LEgStgSSometimes there is not much difference in meaning between direct causatives——khatkhatiind, to knockLESLSkatna, to be cutIn some cases the presence of a direct object or quasi-direct object in the deep
structure may explain the phenomenon.",[95]
"1See Chapter 1, footnote 3 for a definition of the term ‘case’ as used in this work.",[16]
"In that case the pronoun vo introduces the correlative clause.be (5) Gapjab ke, ‘while’jab sé hamid Sahar gaya, tab sé naukari dhiithd raha haiThe correlative phrase tab sé may be omitted, but the sentence is less idiomatic.",[113]
"114
Table 3: Vocative case of nouns
SINGULARSimple repetitionThe doubling of nouns expresses variety or multiplicity.
NomiINATIVEVOCATIVEMasc. MARKEDShlarkai3)larkéMasc. UNMARKEDolebhaiowbhaiFEM. MARKEDoh)larkdo>larkiFEM. UNMARKEDcybahenGr?bahenwun cle Sh
bsMasc.",[15]
"CONSTRUCTIONS WITH NOMINATIVE CASE INFINITIVESTransitive infinitives may take objects of their own, in which case they usually
agree with those objects in gender and number, like an adjective. (However the
force of the agreement weakens in longer sentences, and there are dialects of
Urdu in which the infinitives remain masculine singular.) The agreement of hai641Impersonal constructionsImpersonal constructions are sentence types in which the verb agrees with thelogical direct object of the sentence, while the ‘real’ or logical subject of the
sentence (if expressed) is marked by the postposition k6 (§505) or its alternatewith the object of the infinitive is obligatory.- a (Ke) AP ah gygreemujhé darxast déni (~ déna) haiforms (§210). Impersonal constructions occur very frequently in Urdu. (SeeI have to submit the application.§506 for a treatment of ‘experiencer’ impersonal constructions.)= Gi (LUD) (>PERSONALap ko kal darxast déni (~ déna) thi
You were supposed tosubmit the application yesterday.mairh sair karnd (~ karni) cahta hitmCel gto 9S GI Ate—Here agreement of the verb is visible because thi is marked for gender.",[78]
"36AdjectivesUrdu: An Essential Grammar(c) There are no special oblique plural suffixes for masculine or feminine adjectives.9h 445 2 ty)bare ghOrorh ki, of big horses92hbari ghoriyémm
ka, of big maresoe ooh(d) An adjective modifying a vocative noun is in the oblique case.","[26, 27]"
"Not shown on the chart are:se - droAehyehazar, 1,000one thousandeylakh, 100,000one hundred thousand33,5karOr, 10,000,000 _ ten million (a hundred lakh)wy!arb, 1,000,000,000a thousand million (a hundred karor)Numbers are grammatically unmarked adjectives (§302), and precede the nounthey qualify. They are treated as masculine, but do not inflect. Cardinal numbers
in the ‘teens’ which end in -a ( «) do not change when qualifying plural or
oblique nouns. As is the case with other adjectives ending in choti hé ( 0 ), the h
is not pronounced.le aye gay yal Slog) ods 6 and gh
bara qamis, cauda riimal, aur pandra joré jurrab
twelve shirts, fourteen handkerchiefs and fifteen pairs of socksOrdinals agreewith the noun they qualify in gender, number and case (see Table 9, §303 and
Table 10, §304).",[125]
"Imperfective participlewl ine
girti
hai divarém
falling wallsUL Igy the a 3 og ls ely
polis val6rm né ghar jalta hia paya
The police found the house on fire.(b) Qualifying the object, the participle agrees with objects which are in the
nominative case (§109). If the object is marked by ko, the participle is masculinesingular by default.",[101]
"206Urdu: An Essential Grammar1117Relative-correlative sentencesjaisé- #8 Alyse Ce gel ebThe oblique case of jaisa, jaisé, is used alone, without the correlative (vais&),
meaning ‘like’, ‘as’.","[113, 114]"
"The two verbal nouns of Form III will have different but related meanings. In the case of the
TootpeeRoots which have the same consonant in the second and third place may lose
short vowels, unless one of the radicals is further doubled in the pattern.
Some very common Urdu words contain doubled radicals, but this is not
apparent until the roots are inflected, because in Urdu a final doubled consonantis not pronounced, and taSdid is usually not written.y~», the verbal noun on the pattern of fi°al, jihad, has a religious sense, whereas theverbal noun on the pattern mufa alat, mujahada, has a secular meaning. Arabic
Deen changed to Urduo (-a).",[142]
"CompareLge jalo — & ry jets
daxil karnd, to enro! — daxil h6na, to enter, be enrolledsikhana, to teachnasim né mujhé tasvir dikhar~ oe by Kew Ue Ue
bacca calna sikh raha haiThe baby is learning to walk.
Case Ill
This group is the remnant of a formerly larger group of verb roots ending in
aspirated voiceless consonants, which took the increment in -la. kahna, ‘to say’
is now virtually the only member of the group. It forms a double transitive with
-]d, and is translated by an English passive.",[93]
"Nouns used as adverbs, such as taraf, jagah, samna, aga, etc. can also occur in
compound postpositions. Here they are usually preceded by the possessive ka(ké ~ ki). See §527-§530.aisa - vaisa - kaisa - jaisaaisd, ‘like this’, vaisd, ‘like that’, kaisé, ‘how?’ and jaisd, ‘such as’ (See Table11 in §309) are adjectives, but may be used as adverbs of manner, usually in the
masculine oblique singular case. As adverbs, jaisé and vaisé occur in relativecorrelative sentences (§1117).",[39]
"1123~ at BS el pel 09 Ox ES Ge ge
JO kuch maith karta him, vo etiraz karti haiRepeated relative wordsRelative pronouns and adverbs may be repeated. The repetition has distributive
force, and is in some cases similar to the use of indefinite compounds (§1121).",[115]
"806
Case IlWhen compound verbs are used, transitive verbs usually take transitive vector
verbs, and intransitive verbs usually take intransitive vector verbs (Chapter 7).",[93]
"16Urdu: An Essential GrammarPronouns17PERSONAL PRONOUNS
Nominative and oblique demonstratives
NomiNaTIVESINGULAR
PLURAL202FormsTable 4: Persons and cases of personal pronounsayeCy)vo~yeIst personux—s Mairh, Iqxmujh09vo2nd person3you4— tujh3rd person09va, he, she, itolus~ye,he, she, itwlislst personoe“ham, weredham2nd person@‘tum, youradtum«1ap, youwlap09~—-va, theyOlunnmye, theyoO!inNoMINATIVE
SINGULARExamples
PLURALg Z LS pb Sylis ka nam kya hai?
What is the name of this?uski nam kya hai?
What is the name of that?o ow on LS 5 ol= oe AES AS SO! eeunko kya kahté haith?ham in k6 gharé kahté hairh
We call these water pots.","[16, 17]"
