Paragraph,Page number
"9.5Case markingA nominal expression (NP) takes a grammatical case in an utterance. Grammatical
cases such as nominative, accusative, dative, static locative, dynamic locative, source,9 Grammatical structure327goal, instrument, and directional indicate the grammatical relation that a noun has visa-vis its predicate, another noun (in genitive, comitative, and connective cases), a
clause (in multiple nominative constructions), or a discourse (in the vocative case).
Cases are marked by case particles, which may often be omitted in various discourse
contexts. Nominative, accusative, dative, static locative, goal, and genitive particlesare frequently omitted in sentences, especially in colloquial speech, because these
cases are most easily predictable from the syntactic structure, word order, and the
nature of the predicate used. Thus, for instance, in Mia enni hak.kyo ka-ss-ta ‘Mia’solder sister went to school’, Mia is still in the genitive case, enni in the nominative
case, and hak.kyo in the goal case, despite their not being marked by any particle.
Cases may be divided into two groups: (1) those that mainly indicate syntactic
functionsof nominals,complement),accusativesuchas nominative(usually(usuallyfunctioningasfunctioningobject),andas subject
genitiveand(usuallyfunctioning as possessive), and (ii) those that mainly express semantic functions of
nominals such as dative, goal, locative, source, directional, instrument, and function.","[342, 343]"
"A nominalized clause is different from a relativeclause in that it does not have a head noun but only a nominalizer suffix (NOM) and
from a conjunctive or complement clause in that it functions as a grammatical case
suchas nominative,accusative,dative,locative,genitive,etc.",[335]
"For instance, in Alan.i ka hak.kyo eyse w-ass-e ‘Alan came from school’, Alan plays
the grammatical function of the subject of the sentence, whereas hak.kyo, marked by
the source particle eyse ‘from’, has the semantic function of indicating the location
from which Alan came. This dichotomy, however, does not preclude syntactic caseparticles from having some semantic functions as well and vice versa.
Among the particle slots of a noun phrase, nominative, accusative, and genitive
particles occupy the last slot, whereas the semantic particles occur in an inner slot
even before the delimiter slots, as in na man i (I only NM)‘only I’ (subject), nehanthey man ul (you to only AC) ‘only to you’ (object), and ape-nim kkey man uy
cinci (father-HT to only GN meal) ‘the meal only to father’ (genitive).
9.5.1Syntactic cases: nominative, accusative, and genitiveNominative,accusative,andgenitivecases,whichmaybetermedsyntactic(orstructural) cases in Korean fulfil the most productive grammatical functions. Since
they are, by and large, predictable from context, case particles are frequently omittedin colloquial speech if no emphasis, deference, or exclusiveness is intended. These
three particles (ka/i, (ul, and uy) cannot cooccur with a delimiter denoting topicality
such as (n)Jun ‘as for’, (i)ya ‘as only for’, and fo ‘also’ because all of them occupy the
last position in a noun phrase.",[343]
"Which one of a sequence of case particles becomes privileged depends on the
argument structure (or thematic roles) of the predicate. For instance, the copula ita
requires a theme subject, hence the nominative case in yeki eyse puthe ka must be
privileged in (136a). Similarly, in (136b), the predicate ponayta‘send’ requires adirectional role, hence the directional case in Kim sensayng eykey lo manul isprivileged. Dependence on the argument structure of a predicate can be more clearly
observed by comparing the two sentences in (137).
(137)a.tong-ccokulomanul —ka-ss-ta.east-side
DR only AC’
go-PST-DC
‘(He) went only to the east side.’
b.tong-ccokulomanylpo-ass-ta.east-sideDRonlyAC — see-PST-DC‘(He) looked only toward the east side.’In a sequence of cases which are equally case-relatable to the predicate, the last
one acquires priority in case privilege hierarchy over the preceding ones. Thus, in Kim
sensayng-nim eykey lo, both eykey ‘to/at’ and /o ‘towards’ can be relatable to ponayta9 Grammatical structure345‘send’, but /o is regarded as privileged and eykey is interpreted as a static human
locative ‘at’. As noticed in this example, there is a slight semantic difference in
certain semantic case particles between when the particle is used as a privileged one
and when it is used as a privative one. In a privative case, a goal particle (kkey, eykey,
ey) in a privileged case loses its goal meaning and functions as a static locative, and
the directional particle (uj/o also loses its directional meaning ‘toward’ and denotes a
general direction, as in hak.kyo lo puthe w-ass-ta ‘(He) came from the direction of
school.’ The ablative puthe means ‘from’ in a privileged case as in hak.kyo lo puthe
w-ass-ta, but ‘starting from, beginning with’ in a privative case as in (136a),
9.6Delimiter constructionsWhile case particles mark syntactic relations amongmajor constituents, delimiterparticles delimit the meaning of the cooccurring element with little syntactic function.
Many case particles including the nominative ka/i, accusative (J)ul, ablative puthe, anddirectional (ujlo behave like delimiters with their own semantic content, especially
when they become privative case particles as observed in 9.5.8. Delimiters appearmost productively in noun phrases but also with adverbs, complement clauses, and
even main sentences. Due to their syntactic and semantic properties, delimiters can be
classified into two types, constituent and sentential (or discoursal) delimiters, the
former occurring in noun phrases (including nominalized clauses) and with adverbs
and complement clauses, and the latter occurring at the end of a sentence and/or after
any major constituent.
9.6.1
MostConstituent delimiters
of the importantconstituentdelimiter particles weregivenin 8.1.9.","[360, 361]"
"Mikwuk
Americauy
GNSaiphan
Saipankwa uy
with GNcencayng
war‘America’s war against Japan in Saipan’
In (136a), three case particles occur in sequence. While the locative and ablative
cases, marked respectively by eyse ‘at, in’ and puthe ‘from’, are inert in that they are
not associated with the predicate (the copula in this case), only the nominative case,344The Korean languagemarked by the particle ka, is related to the copula as its subject. The two inert caseparticles simply contribute their semantic content to the subject noun phrase. In this
respect they are like delimiters. In contrast to such inert cases, the case which
maintains its syntactic relation with the predicate may be called the ‘privileged’ case.
Thus, in (136a) the nominative case is the privileged case, while the locative and
ablative case particles are privative.
In (136b), the three case particles eykey, lo, and ul are flanked by a delimiter (man
‘only’). Here, the directional /o is the privileged case and is related to the predicateponayta ‘send’, whereas the particle eykey ‘to’ and the accusative particle u/ become
privative andfunction as delimiters. In (136c), the source particle eyse and theconnective particles wa ‘and’ and na ‘or’ all function as privileged, in that the former
is related to the predicate and the latter two connect two noun phrases.","[359, 360]"
"As shown in the above examples, Korean reflexives occur in the direct or indirectobject position, copular complement position, and possessive and other case positions.
Unlike in English, Korean reflexives may also occur as the subject of an embedded
clause as in (240a) and (241a). In such cases, Korean reflexives usually correspond toEnglish personal pronouns. For more on anaphoric phenomena in Korean, see W.C.M.
Kim 1976, S.H. Park 1985, B.M. Kang 1988, S. Kang 1990, J.O. Choi 1992, H. Lee
1993, W.H. Kim 1994, and K. Lim 1998.",[423]
"9 Grammatical structure9.2.8293Word orderAs an SOV language, Korean has the basic and neutral word order of subject, object,
and verb/adjective. This order holds in both main and embedded clauses. Due to the
basic SOV order, all modifiers including determiners, genitive constructions, relativeand complement clauses, and conjunctive clauses precede their head elements. Case
and delimiter particles always follow the nominals they are associated with, These
orders are fixed and do not allow any variation. Amongnoun phrases that carryvarious cases, however, there seems to be a preferred or neutral word order. Roughly,
the order in (49) appears to obtain. Note that case markers are optionally or
obligatorily deleted in certain syntactic collocations.
(49)Order of casesCase marking particlesa.","[308, 309]"
"9.3Syntactic relationsSyntactic relations among various constituents in simplex and complex sentences may
be observed in terms of the overall syntactic structure. The relations between an
embedded clause and its head are expressed by various clause enders, each of which
consists of one or more inflectional suffixes, and certain connective particles (e.g.,quotative particle ko), while the relations among nominals or between a nominal andits clause-mate predicate (verb or adjective) are represented by particles that carry
various case functions (e¢.g., nominative, accusative, dative, locative, ablative, source,goal, instrument, and directional). Clause embedding will be discussed in 9.4, and
case relations in 9.5. The syntactic structure of Korean may be represented in terms of
traditional grammatical categories as in the following set of constituent structure rules.
These rules are not exhaustive, but they do cover most of the essential constituents of
Korean sentences.",[313]
"Notice that semantic case particles such as comitative and dynamic locative in this
example are intact, cooccurring with uy. Only the other syntactic case particles
(nominative and accusative) are obligatorily omitted before the genitive uy, hence
*Mikwuk i uy and *Mikwuk ul uy are ungrammatical.
Whena nominalin the genitive case contains case or delimiter particles, thegenitive particle also must occur. Thus, in Sewul lo puthe uy phyenci (Seoul DR from
GN) ‘a letter from Seoul’, uy must occur. Similarly, when a noun phrase in the
genitive case consists of conjoined nominals as in ne wa na uy chai-cem ‘differences
between you and me’ or a clause with a sentence ender as in cwuk-nu-nya sa-nu-nya
uy cencayng ‘a war of whether to live or die’, uy cannot be deleted.",[349]
"In genitive constructions such as (136d, e), the privileged syntactic case is always
the genitive(markedby the particle uy) whichgenitively to the head nominal.occurbeforethe genitivecase.relates the cooccurringnominalIn addition, one or more semantic cases may alsoIn (136d),the privilegedsemanticcaseis thedirectional marked by /o which semantically relates its cooccurring nominal Kimsensayng eykey to the head verbal noun Aoysin. Here, the static locative case marked
by eykey is privative. In (136e), the dynamic locative case marked by eyse and the
comitative case marked by Awa are privileged.",[360]
"InhoTCcoldduetohomeatrest-POL‘Inho is resting at home due to a cold.’Another intransitive type comprises simple sentences with two nominative cases.
One such subtype includes inchoative (change of state) sentences where a subject and
a complement,bothin the nominativecase, occur withthe inchoativeverb foyta‘become’ as in (18a). Another subtype consists of experiencer~—theme sentences as in
(18b). Verbs in this category include tu/ta ‘suffer from’ (lit. ‘enter’) and nata ‘appear’.
Both the experiencer noun (subject) and the theme noun are in the nominative case.
(18)a.",[293]
"MilanNMfactACvisit-PST-DCdislike-IN-RL‘I visited Milan, despite the fact that she doesn’t like it.’The genitive case which connects one noun phrase to a head noun is marked by theparticle wy, although the particle is frequently omitted. The genitive phrase has various
semantic relations with regard to the head, including possession as in Milan.i uykwutwu ‘Milan’s leather shoes’), relationship as in ne uy eppa ‘your older brother’,9 Grammatical structure333authorship as in J Kwangswu uy Salang “Yi Kwangsu’s book Love’, classification as
in twu chay uy cip (2 CL GN house) ‘two houses’, pertinence as in tokse uy kyeycel ‘a
season for reading’, origin as in Mikwuk uy soykoki ‘beef from America’, location as
in Hocwu uy inkwu ‘the population of Australia’, and reference as in kaul uy nolay ‘a
song of autumn’. In addition, when the head word is a verbal or adjectival noun, the
relation is that of an argument and a predicate, as in pesu uy chwulpal ‘the departure
of the bus’ [subject—verb], Alan.i uy hayngpok ‘Alan’s happiness’ [subject—adjective],
llakhu uy phakoy ‘the destruction of Iraq’ [subject—verb; verb—object], and Nam Puk
uy thongil ‘unification of South and North Korea’ [subject-verb; verb—object]. The
genitive particle in most of these constructions may be omitted in casual speech.
The genitive case may incorporate various thematic roles that the genitive nominal
has in relation to the head nominal, as in Mikwuk uy Ilpon kwa uy Thayphyengyang
eyse uy cencayng ‘America’s war against Japan in the Pacific Ocean’ where Mikwuk
‘America’ functions as agent, //pon ‘Japan’, comitative, and Thayphyengyang ‘the
Pacific Ocean’,dynamiclocative in relation to the verbalnouncencayng‘war’.","[348, 349]"
"PARTICLE:Case, Delimiter, ConjunctiveIn this volume, the term nominal is used to encompass noun, pronoun, and numeraland the term predicate to encompassverb and adjective in view of their sharedgrammatical properties.",[220]
"(PROlo)(well-water with)—_celm-eci-nu-nsaym-mulyoung-INFbecome-IN-RLwell-water‘the well-water by which one becomes young’
Notice that the nouns coreferential to the head noun are omitted together with the
case particle, unlike in English where prepositions like to and in appear before a
relative pronoun or at the end of the relative clause. It is often claimed that, in
English, relativization involves the movement of a relativized noun to the front of the
relativeclausewhereit isthenpronominalizedordeleted.",[327]
"[Tonghwan.i
Tonghwanuy]
GN[yel
10.kwen
uy]
chayk
volume GN _ book“Tonghwan’s ten books’
Rule (60g) is the expansion of a genitive phrase into a noun phrase (NP) and thegenitive case particle uy (GN). Frequently, the genitive particle uy is omitted in
utterances if no ambiguity or semantic anomaly is thereby caused, as in ce salam (uy)
nolay ‘that person’s songs’ and Sewul (*uy) salam ‘a person living in Seoul’. It
cannot, however,be omittedif the noun phrase has a particle, as in na manuysayngkak (I only GN idea) ‘only my idea’.
As noticed in [Puk.kyeng ulo puthe man] uy phyenci (Peking DR from only GN
letter) ‘letters only from (the direction of) Peking’, one or more semantic case anddelimiter particles mayoccur (as NPelements) before the genitive particle. Nosyntactic case particle (i.e., nominative ka/i and accusative (/)u/) may occur before thegenitive particle which is also a syntactic case particle.
Since a genitive phrase may embed another genitive recursively, (60f) and (60g)
accommodate recursiveness by allowing the NP in (60g) to reapply in (60f). This
recursiveness may be demonstrated as in (63).",[317]
"Yongho
Yonghonun
TC[Mia
Mialul
ACtow-a)
help-to(lul/*ka) cwu-ess-e.yo.
AC/NM ss give-PST-POL*Yongho helped Mia (for her).’In a clause- or sentence-final position, the accusative particle and the preceding
noun kes ‘fact’ are compounded to mark an antithetical clause, with senses such as ‘I
wish’, ‘I think’, ‘I should have done’, and ‘despite the fact that’. The compound kes u/or its contracted form ke-/ may have developed from kes ul kaciko ‘with the fact that’,
with the deletion of kaciko ‘with’ (< kaci-ko ‘have-and’). This grammaticalized form
of the accusative particle has nothing to do with a case or delimiter function.
(117)a.nanunan_ka-lke-L.",[348]
"Alanimunsensayng-nimkkeyka-ss-e.yo.(goal)AlanTCteacher-HTtogo-PST-POL‘Alan went to the teacher.’As in (119a), the dative case occurs with ditransitive verbs that take both direct and
indirect objects (e.g., cwuta ‘give’, poita ‘show’, kaluchita ‘teach’, myenglyenghata
‘order’, pokohata‘report’, allita ‘inform’), As in (119b), the static locative caseoccurs with existential, static, and passive predicates (e.g., manhta‘be much’, issta‘exist, stay’, salta ‘live’, namta ‘remain’, kellita ‘get caught’, palphita ‘be stepped
on’). The goal case occurs not only with movement verbs (e.g., kata ‘go’, ofa ‘come’,
fanita ‘go to and from’, o/uta ‘climb’), as in (119c), but also with non-dative transitive9 Grammatical structure335verbs (e.g., ponayta ‘send’, nohta ‘put’, chilhata ‘paint’, ssuta ‘write’, moita ‘gather’,
ancta ‘sit’). These three cases, represented by the same set of particles, share the
semantic component [GOAL], in that a theme (in the nominative or accusative case) is
oriented to the referent of a nominal. Therefore, these particles may be termed goaloriented locative particles.
The distinction betweendynamiclocationandsourcecasesis madeby thepredicates used.
(120)a.","[350, 351]"
"(58)8.5.9cem-cem(gradually-)‘gradually’cha-cha(order-)‘by and by’cuk-kak(immediate-time)‘immediately, at once’e-cha-phi(at-this-that)‘anyhow, after all’hang-sang(always-usual)‘always’ka-lyeng(false-command)‘supposing (that)’ka-pu-kan(right-wrong-between) ‘at any rate’man-il(ten thousands-one)‘by any chance, if?sel-sa
fa-so(establish-use)
(much-less)‘even if”tan-ci(only-only)‘merely, however’‘more or less’Compound particlesCompound particles consist mainly of sequences of case, delimiter, and/or conjunctive
particles. Many of these compounds are syntactic rather than lexical, as noticed in the
following examples, where N stands for a nominal element (a noun, a pronoun, anumeral, or a noun phrase).",[274]
"Nami
NM
sister
with
fight-PST-POL
‘Nami fought with her older sister.’
b.nwunahakokuuysa-ka_khisuhay-ss-e.yo.sisterandthedoctorNM _ kiss-PST-POL‘My older sister and the doctor kissed.” or
‘The doctor kissed my older sister.’
A fourth intransitive type consists of passive sentences where a passive or pseudopassive verb occurs with a ‘patient’ subject in the nominative case and an ‘agent’
nominal in the locative case marked by eykey or hanthey in the sense of ‘by’. If theaction denoted by a passive verb affects only a part of the patient’s body or a thing
belonging to the patient, that body part or thing can be expressed as an object in theaccusative case.
(20)a.totwukiswunkyengthiefNM _ policeeykey(phal ul) cap-hi-ess-ta.byarm AC catch-PAS-PST-DC‘The thief was caught by a policeman (by the arm).’
b.",[294]
"8.1Word categories8.1.1ClassificationThe Korean lexicon becomes richer, due not only to extensive borrowings but also to
productive coinages of new words through derivational processes such as affixation,
compounding, abbreviation, and contraction. In addition, Korean predicates (verbs
and adjectives) conjugate productively by means of a wide variety of inflectionalsuffixes.
In order to examine the word structure and word-formational processes in Korean,it is essential to determine what kinds of significant lexical-functional categories of
words are to be recognized. Linguists disagree on this issue. H.P. Choy (1971)
proposes ten categories, North Korean grammar books eight, and some others more orless. For instance, Choy (ibid.:198) establishes ten categories based on form, function,
and meaning: noun, pronoun, numeral, verb, adjective, copula, determiner, adverb,
interjection, and particle. To Choy’s scheme, W. Huh (1984:193) adds the category of
conjunctor which includes fossilized compounds such as kuliko ‘and’, kulena ‘but’,
and kulemulo ‘therefore’, which are assigned to the category of adverb in Choy. On
the other hand, North Korean grammars (e.g., Kwahak.wen1960) establish eightcategories: noun, numeral, pronoun, verb, adjective, article, adverb, and interjection.
In H.M. Sohn (1994), seven categories are proposed: noun, pronoun, verb, adjective,204The Korean languagedeterminer, adverb, and particle. It is common practice among Korean linguists and
lexicographers to set up an independent numeral category, and so in this volume, the
followingeightcategoriesandtheirsubcategoriesareestablishedbasedonmorphosyntactic and semantic properties.
(1)a.","[219, 220]"
"22The Korean languageIn the same vein, many linguists have argued for the Japanese relationship to the
Altaic, notably Boller (1857), Prohle (1916-17), Ramstedt (1924), Murayama (1962,1974), Miller (1971), Street and Miller (1975), Street (1978), and Starostin (1991).
Thus, the Altaic origin of Korean and Japanese is a generally accepted hypothesis,
although the hypothesis must be further refined and verified, In terms of the number
of seeming cognates, it is safe to say that, among the Altaic groups, Manchu-Tungus
is the closest to Korean, followed by Mongolian and then Turkish, It must be noted,
however, that there are scholars such as Haguenauer (1956), P. Kim (1960), H. Kwon(1962), Kawamoto (1974), and Kiyose (1986) who are sceptical about the affinity.
Many typologically shared features have been cited to relate Korean to Altaic (e.g.,
Fujioka 1908; Ogura 1935; K.M. Lee 1976). Although typological relationships helpsupport genetic relationships especially when exclusively shared among the languages
beingcompared,theyaregenerallyconsideredofsecondaryimportanceincomparative work. Some salient typological features are as follows.
Korean, Japanese, and Altaic languages manifest striking syntactic similarities.
The basic word-order common to them is Subject-Object-Verb (SOV). Conformingto the general tendencies of SOV languages, modifiers such as adjectives, adverbs,
and conjunctive, relative, and complement clauses precede the elements they modify,
while postpositions occur in place of prepositions. In all of these languages, the
singular and plural forms of nouns are not strictly distinguished; articles and
conjunctions are not developed; no affix exists in adjectives to express the
comparative or superlative degree; relative pronouns do not exist; the endings
indicating sentence-types such as declarative, interrogative, propositive, and
imperative are placed at the end of the sentence; and sentences may consist only of apredicate, with the subject and other cases contextually or situationally understood.
Further, possession is expressed by an existential predicate in these languages. For the
syntactic parallelism regarding grammatical cases, see J. Sohn 1973.","[37, 38]"
"9 Grammatical structure(135)343cwuye,cehuylulposalphy-ecwu-sose.lordVOCusAClook after-INFgive-IM‘Lord! Please look after us.’
The hyper-deferential particle ye is also used to address a group of people in writing,
in which case the sentence enders may be either the plain- or blunt-level forms, as intongpho ye ilena-lalilena-o ‘Brethren! Wake up!’9.5.8Case-particle stackingA series of case particles may occur in sequence all associated with the same nominal,
reflecting the agglutinative nature of Korean. However, not all of such stacked case
particles perform active case functions in a given sentence as will be discussed
shortly. In the sentences in (136), the particles performing an active case function are
underlined.
(136)a.yekieyseputhekawulittang—i-a.hereatstarting-fromNMourland _is-INT‘Our land starts from here.’
b.","[358, 359]"
"Post-nominalelements,ontheotherhand,havearelatively fixed order in the sequence of plural suffix, ‘semantic’ case particle,
delimiter particle, and ‘syntactic’ case particle. For instance, in haksayng-tul eykey
man ul cwu-ess-ta ‘(1) gave (them) only to students’, -fu/ is a plural suffix, eykey ‘to’
is a dative (semantic) case particle, man‘only’ is a delimiter particle, and ui is anaccusative (syntactic) case particle.
More than one relative clause (RC*) or genitive construction (GNP*) may modify
a head nominal, as illustrated in (62).",[317]
"In Type 1, NOUNand [NUMERAL+ COUNTER]are separable in a sentence,when the classifier construction is in the nominative or accusative case, as illustratedin (15la, b). This phenomenon is often called quantifier floating, and does not apply
when the construction is neither nominative nor accusative, as shown in (15lc).
(151)a.haksayngseymyengiceki—s o-n- ft.student
3
person
NM _ there
— haksayng i sey myeng i ceki o-n-ta.
haksayng i ceki sey meyngcome-IN-DCi o-n-ta.",[369]
