Paragraph,Page number
"4.2.1 Nominal clauses, formed with copula de
Drabbe 1957: section 15, p. 8a-bNominal clauses are always formed with the copula de. Semantically, they
can express either equality (‘X is Y’), as in (459) to (463) below, or proper284PART I: GRAMMAR. Chapter 4: Clause structureinclusion (‘X belongs to the category of Y’), as, for example, in (464) and
(467).
(459)xon-etodeDST1SG-fatherCOP‘that one over there is my father’ (Drabbe 1957:8a)
(460)xoten-etodeDSTNOM1SG-fatherCOP‘that one over there is my father’ (Drabbe 1957:8a)
(461)xoken-etodeDSTFOC1SG-fatherCOP‘that one over there is my father’ (Drabbe 1957:8a)
(462)nabüsiüde1SGhouseCOP‘it is my house’ (Drabbe 1957:8b)
(463)wo(ke)nabüsiüdeTHATFOC1SGhouseCOP‘that there is my house’ (Drabbe 1957:8a)All of the examples except (462) have an overt subject. In (460) and (461),
the human subject is marked by the case marker te or by the focus makerke, respectively. In (463), where reference is made to an inanimate object,
we find the focus marker ke; the use of te would be ungrammatical. In the
examples (464), (466), and (467) below, we find the same markers te or ke
not as modification of the subject, but as part of the nominal predicate, or
— to follow the terminology used in Dixon (2010b:159f.) — as modifying
the copula complement.
(464)Efenamotedeefen-amotede3SGLNK-husbandNOMCOPPART I: GRAMMAR. Chapter 4: Clause structure285‘it’s her husband’ (6.200c)
(465)WidepigCOP‘it’s a pig’ (Drabbe 1957:8b)
(466)WitedepigNOMCOP‘it’s a pig’ (Drabbe 1957:8b)
(467)WikedepigFOCCOP‘it’s a pig’ (Drabbe 1957:8b)Note that in the examples above, the predicate noun wi ‘pig’, referring to a
large animal can combine with either te or ke. A noun referring to an
inanimate, however, can only combine with ke, so that (469) below is
ungrammatical.
(468)büsiü(ke)dehouseFOCCOP‘it’s a house’ (Drabbe 1957:8b)
(469)*büsiütedehouseNOMCOP‘It’s a house’ (deduced from Drabbe 1957:8b)The following example shows the use of a free pronoun as a subject.
(470)nu (ke / te)de1sg (FOC /NOM)COP‘It’s me’ (Drabbe 1957:8b)An interesting example from the text corpus is the following, where we find
the copula clause followed directly by a verbal clause. It is part of a
passage where a woman attempts to get a fish trap that is far away, using a286PART I: GRAMMAR. Chapter 4: Clause structurelong stick. A man comes out of his hiding place, and takes hold of the outer
end of the long stick. The woman feels this, looks behind her, and sees a
person who appears to be her husband, taking the outer end of the stick:206
(471)Abum'etoxe,abumet-oxelook.backsee-N1.RLS[SG]efenamotedekesaxetoxuaxe,efen-amotedekesaxetoxua-xe3SGLNK-husbandNOMCOPtreeouter.endtake-N1.RLS[SG]mokike.moki-keafraidbecome-N1.RLS[SG]‘She looks back, it is her husband who is taking hold of the outer end of the
stick, and she gets afraid.’ (6.200a)4.2.2 Adjectival clauses, formed with copula de or oxo
Drabbe 1957: section 15, p. 8Adjectival clauses can be formed either with the copula de or with the
copula oxo. In predicates formed with de, the adjective is optionally
modified by the focus marker ke.207 Some examples of adjectival clauses206In a note to this verse it is noted that the she does not immediately recognize the man asher husband, even though the addressees (those who listen to the story) are informed that it
is her husband that she sees. First she gets afraid, and does not recognize him yet, and only
in 6.200c she really recognizes that it is her husband.
207Although it may be strange at first sight to see focus markers combined with adjectives,I believe constructions like these can be thought of as having an incomplete or headless NP
as a predicate, so that a sentence like (473) could also be translated as ‘that man there is astrong one’. This is confirmed by the fact that it is also possible to have an NP plusadjective as a predicate, as in the example below (which is analogous to (477), where we
have a similar construction with the copula oxo):PART I: GRAMMAR. Chapter 4: Clause structure287formed with de are given here, where (473) contains an example of an
adjective marked by ke.
(472)nabüsiüjafide1SGhousebeautifulCOP‘my house is beautiful’ (Drabbe 1957:8b)
(473)axuxokoaŋ(ge)dehumanDSTstrongFOCCOP‘that man there is strong’ (Drabbe 1957:8b)Interestingly, Drabbe seems to contradict himself when he points out that
adjectives can only be modified marked with ke and not with te. In spite of
Drabbe’s claim that adjectives do not combine with te, he gives several
examples where this is the case, like (474) below.
(474)axuxokoãtedehumanDSTstrongNOMCOP‘that man there is strong’ (Drabbe 1957:8b)Adjectival clauses can also be formed with copula oxo. Unlike clauses
formed with copula de, in these clauses adjectives cannot be marked for
case. Two examples of adjectival predicates are given with (475) and (476)
below, the first of which is fully analogous to (472) above.
(475)nabüsiüjafioxo1SGhousebeautifulCOP‘my house is beautiful’ (Drabbe 1957:8b)xofeteaxukoaŋgede3SGNOMhumanstrongFOCCOP‘that one there is a strong man’ (Drabbe 1957:8b)288(476)PART I: GRAMMAR. Chapter 4: Clause structurexamikioxo.xamikioxotrueCOP‘It is true.’ (1.034)Drabbe points out that the copula oxo can not only be used for the
formation of adjectival clauses (and numeral clauses, see below), but also
for nominal clauses in which the predicate nominal is modified by an
adjective. An example of such a construction is the following.
(477)xofe208teaxukoanoxo3SGNOMhumanstrongCOP‘that one there is strong man’ (Drabbe 1957:8b)The remainder of this section presents some of the adjectival clauses withoxo that were attested in the text corpus. First consider (478). The subject
of the clause is formed by the noun phrase headed by kokü ‘belly’. As we
do not have access to the intonational pattern of the language, it is not clear
whether we have to do with one complex possessive NP running fromAtumio through kokü (‘the bellies of the clan mates of Atumio’) or with a
construction in which Atumio through naxu is extra-clausal, setting the
theme for the rest of the clause, so that the clause should be read as ‘as forAtumio’s clan mates, the bellies were very big’. The predicate is formed byisiom= tadixa oxo, where isiom= serves as an adverbial modifier of
tadixa.
(478)Atumioefenaxukoküisiom'tadixaoxo.","[301, 302, 303, 304, 305, 306]"
"3.1.3 Possessive constructions with nisi
Drabbe 1957: section 16, p. 9a; section 23, p. 11aDrabbe describes the meaning of nisi as ‘owner’. In its semantic structure, a
construction with nisi is similar to a compound of type 1 in that the
modifying part precedes the head. It is different from this type of
compounds, however, in that the modifier can also be an entire clause.
While an example like (177) below shows that the modifier may be a noun,
in most of the examples provided by Drabbe and in all the examples
attested in the text corpus, the modifier is a clause.
(177)büsiünisibo-de116houseownersit-1.RLS[SG]‘I am the owner of the house’ (Drabbe 1957:11b)In case nisi is preceded directly by a verb, it causes word stress to shift
from the ultimate to the penultimate syllable of the word, see e.g. sìke in
(179) below. Example (178) represents a case where the position of the
possessed is filled by a nonverbal clause. In all other examples that follow,
the position is filled by verbal clauses.",[172]
"PART I: GRAMMAR. Chapter 3: Other word classes189The text corpus contains no examples of efe or eke as (in)direct object or
used in a nominal clause, although these uses are mentioned by Drabbe (cf.
Table 43 in 3.2.3.1 above). This may, therefore, very well be due to lack of
data.
Conclusively, we can state that efe and eke differ in their distribution. Efe
is used mainly to refer to the possessor in a possessive construction. In
addition, it is attested only four times in subject position: once followed by
the nominative marker te, and three times followed by ke ta FOC IN.TURN, in
which case the expression seems equivalent to eke ta. Eke, on the other
hand, is used in combination with ta IN.TURN in the majority of cases, and
attested in the text corpus exclusively in subject position. Also in cases
without ta we have to do with events where one out of two topical
participants is reintroduced, reactivated, or contrasted with the other one,
which is the reason why I have glossed eke as a focused form of efe.","[206, 207]"
"Persons, reference to _ -> animateness
Phonology1Plural, morphological _ of kinship nouns see number
Plurality, verbs implying _ of subject of object see number
Polarity and modality see modality
Progressive see durative
Polar questions2.7Polar questions vs. open questions and embedding in a copula4.3clause
Possession, inalienable _3.1.4Possession, inherent _3.1.4Possession, inherent _ and bleaching3.1.4, note 118Possession, posture verbs used in the expression of _2.8.1Possession, negative _ (‘not having’) expressed by negative
existentials4.2.4Possessive affixes on kinship terms3.1.4Possessive constructions consisting of two full NP’s3.1.2Possessive construction with possessor expressed by pronoun3.2.2Possessive, distinguishing between compound and _3.1.2Possessive construction, nesting of _3.1.2Possessive linker n-3.2.2Possessive pronouns3.2.2; 3.2.3Postpositional case markers3.6Posture verbs2.8Presence, expression of _ see be present
Primary and secondary stems see stems of type I and type II
Progressive aspect see aspectINDEX837Prohibitives2.3.2.2.10; 2.5Pronouns3.2Pronouns, demonstrative _ see demonstrative pronouns
Pronouns, emphatic _3.2.1Pronouns, free or independent _3.2.1Pronouns, free or independent _ used in possessive construction
with kinship terms3.1.4Pronouns, interrogative _3.2.5.1Pronouns, possessive _3.2.2; 3.2.3Pronoun, 3SG pronouns efe and eke3.2.3.2Proper inclusion, relation of _ in nominal clauses see inclusion
Quantifiers, Floating _3.9Quantifiers non-numeral _3.9Question clause, nominal and adjectival _4.2.5Question clause, verbal _2.7Questions, open _ see polar questions vs. open questions
Questions, polar _ see polar questions
Quinary base of numeral system3.10Quotative construction5.8Realis and irrealis mood as a basic opposition in the language2.1Realis markers2.3.1Realis, stems of type I generally used for _2.1; 2.3Reduplication, full and partial _ of a root2.4.1Reflexive reading of emphatic pronoun3.2.1Relative clause, no evidence of _5.3, note 223Relative clause, possible example of _2.219Reciprocal, kotomu as a marker of reciprocity3.4.2Resultative relation between clauses5.4.2.2Root structure1.2.1Same-Subject forms in -dV or-bu2.3.2.1Same-Subject marker kue3.8.2.1Secondary and primary stems see stems of type I and type II
Semifinite, nonfinite and finite verbs2.1Semifinite verbs2.3.1Semifinite verbs and switch-reference5.4.1.2; 5.4.3Sentence as combination of clauses or clause chains5.1Sequential events5.4.2Sequentiality, the use of connective =k not stronly related to _2.3.2.1838INDEXSexes, division of labor over the _ see labor
Siblings, listing of _3.10.1Spatial nouns see nouns
Specific reference in possessive construction, not in compound3.1.2Stance verbs -> posture verbs
State, verbal noun predicated with copula oxo or ki for the
expression of a _2.3.2.2.7Stem types; form of stems I and II2.2Stress, lexical _ see lexical stress
Subject, overt _ in verbal clauses4.1Subject, unspecified _ in verbal clauses4.1Subjective mood see mood
Subordinate and coordinate clauses in relation to clause chaining5.3Suppletive verbs for plural see number
Switch reference5.4Syllable structure1.2.2Taboos, white pigs and cultural _4.17Ta ‘IN.TURN’ following the 3sg focus form eke3.2.3.2Tail-head linkage5.6Tally, bodypart _ system3.10Target, expression of the _ of directional verbs3.5.1.2Tense, summary about tense2.3.3.3Tense, underspecification of verbs for _2.3.1.2Tense, past _2.3.3.1Tense, future _2.3.3.2Topics, narrative _3.7.1Transitivity2.1 (end)Unspecified subject see subject
Verbal clauses see clause
Verbal caluses compared to non-verbal clauses4.6Verbal nouns see nouns
Verbs, directional _3.5.1Verbs, numeral _3.10.2; 2.3.2.2.8Vigesimal base of numeral system3.10Volitive modality see modality
Vowel elision1.4Vowel harmony1.3Vowels1.1.1INDEX839Vowels, fluctuation of _ see fluctuation
Vowels, nasal_1.1.1.1Vowels, long _1.1.1.1Vowel, floating _ see floating vowels
Vowel, unspecified final _ in semifinite5.4.2.2 note 236Word order in verbal clauses4.1Zero-marking, of mood in irrealis2.3.1.3, esp. note 43840INDEXDrabbe s terminologyThe list below is meant as a help for those who want to use Drabbe’s
original publication. While the relation between Drabbe’s terminology and
the one used in this publication can often be found through the use of a
dictionary, in certain cases the relation is less straightforward. It is these
cases that have been mentioned in the list below.
Term in DrabbeTranslationTerm in this publicationAccentAccentLexical stressEventief gebruik vanEventive use ofExperiential constructionwerkwoordenverbsConditionalisCondtionalisConditional sentenceFuturum-stammenFuture stemsStems of type IIGenitief-constructieGenitivePossessive constructionconstruction
IndefinieteIndefinite verbVerb vorms that are neutral withwerkwoordsvormenformsrespect to tenseNominaleNominal futureVerbal nounsfuturumstammenstemsPrimaire stammenPrimary stemsStems of type ISecundaire stammenSecondary stemsStems of type IISemi-nominale zinnenSemi-nominalNonverbal clauses other than nominalsentencesclauses: adjectival and number clausesLinking elementsCover term for postpositional caseSchakelelementenmarkers and other postpositions; focus
markers; conjunctions; SS-marker ku
and DS-marker -ne; the possessive
linker n=; ta ‘IN.TURN’
IrrealisirrealisIrrealis--RealisZero-vormenZero-formsSemifinite realis formsZero-futurum vormenZero-future formsSemfinite irrealis forms","[854, 855, 856, 857, 858, 859]"
"Coming back to the tendency in Papuan languages to avoid a stacking of
(pro)nouns for referent tracking, it should be pointed out that Aghu has278PART I: GRAMMAR. Chapter 4: Clause structuredeveloped an effective way of referent tracking: In addition to the inflection
of person and number on the verb, the language has developed a switch
reference system, with nonfinites indicating same subject (SS), and
semifinites implying different subject (DS). More on this can be found in
chapter 5, especially 5.4.
To conclude, it should be noted that the word order as described by Drabbe
is not without exception. The text corpus does contain a number of
examples where the object precedes the subject. One of these cases is
presented below. Although the number of examples is too small to draw
any rigid conclusions on factors influencing word order, it is not unlikely
that in a case like (453) the initial position of the indirect object has to do
with its topicality. The sentence is about the two boys who have received
food (from a parrot), even though the two are not framed here as a subject
(which is the grammatical role that usually coincides with the pragmatic
role of topic (cf. footnote 202)).
(453)Abudadekbüsiüetoxenã,a-buda-de=kbüsiüet-oxe-nãtake-SScome-SS=CONhousesee-N1.RLS-N1PLjoxon-amokookuomãiaxajodüabudaxe;joxon-amokookuomãiaxajodüa-buda-xe3PLLNK-childtwowhite.parrotsagotake-SScome-N1.RLS[SG]abudaxejoxon-amokofakiedoxenea-buda-xejoxon-amokofakied-oxe-netake-SScome-N1.RLS[SG]3PLLNK-childsecretlygive-N1.RLS[SG]-DSeŋgenã.
ẽ-ge-nã
eat-N1.RLS-N1PL
‘They take them, come and see the house, to their two children a white parrot
brings sago; he brings sago and secretly gives to their children and they eat.’PART I: GRAMMAR. Chapter 4: Clause structure279(2.007)Another example of a deviating word order is the following. Here Drabbe
adds a footnote stating that this is not the normal word order and that the
translation should be as given below.200 His translation can be seen as a
clear indication that also here the deviating word order has to do with the
topicality of the object.
(454)Kiasid'emedektetebagoefenagãaxe.kiasi-d=eme-de=ktetebagoefen-agãa-xechat-SS-finish-SSvaluables3SGLNK-wifetake-N1.RLS[SG]‘After they have chatted, the valuables, the wife takes them from the husband.’
(6.202)4.1.1 Experiential clauses
Drabbe 1957: section 60, p. 23b-24aLike many Papuan languages, 201 Aghu has a number of ‘experiential verbs’,
which are listed below. Semantically, these verbs have at least one200“En de spullen, die neemt de vrouw over” (Drabbe 1957:87, note 127).","[295, 296, 297]"
"(228)Tafeaxabüsiübaxenã,bagidiefeküdatafeaxabüsiüba-xe-nãba-gidiefeküdaagainhousesit-N1.RLS-N1PLsit-next.day3SGyounger.siblingdebüsiübaxe.debüsiüba-xeOPPhousesit-N1.RLS[SG]‘They stay home again, and the following day only the younger sister (lit. her
younger sibling) stays home.’ (1.050)PART I: GRAMMAR. Chapter 3: Other word classes(229)183Efen-enimidikxoxe.efen-enimi-di=kxo-xe3SGLNK-elder.sistercome.down-SS=CONgo-N1.RLS[SG]‘The eldest sister comes down and goes.’ (1.051)If we exclude the use of efe in possessive constructions, we are left with
only four attestations of efe in the entire corpus. In only one case, the
pronoun efe is followed by te, which is the nominative marker that is also
optionally used after other pronouns or nouns in subject position (see
above). The sentence is part of narrative 2; father and mother have just put
their penis gourd and their skirt in a water quiver. They tell the children to
watch these objects; if they start to perish, then they know that Apupüsimo
has killed them:
(230)Boasĩ,Apupüsimoefetenüguxomüge.boasĩApupüsimoefetenüguxomü-gewear.down_II.N1SGApupüsimo3SGNOM1PLfight-N1.RLS[SG]‘(If) they wear down, then (you know that) Apupüsimo he has killed us.’ (2.074)The sentence above is the only example in the entire corpus where we findefe combined with te. In all other cases, three in total, we find efe preceded
by a NP and followed by ke ta FOC IN.TURN. The context of use of efe ke ta
is identical to that of the far more frequent eke ta, which will be discussed
below.140
Turning to the use of eke, its distribution as attested in the text corpus can
be summarized as follows:140We will come back to the use of NP efe ke ta in note 141 below.","[200, 201]"
"177Dixon stresses that case may be expressed in different ways: either as affixes (ideallyand typically called case inflection, or as clitics (ideally called case clitics, typically called
case or apposition), or — as is the case in Aghu — as grammatical words, in which case
they are ideally called case words, and typically called adpositions. This book uses the
term postpositional case marker, to express both its realization as a grammatical word that
directly follows the NP and to express its function as a case marker.",[258]
"PART I: GRAMMAR. Chapter 3: Other word classes1653.1.5.3 Nouns in non-subject function
We now come to cases where nouns or NP’s are used in other than subjectposition. Here, singular number may be specified by the use of fe ‘3SG’,
while plurality may be expressed by the use of a 3PL pronoun following the
noun. Of the latter the text corpus contains only one example, however.123
In my view, fe functions as a marker of singular number, which expresses
that reference is made to one token out of a set of tokens of the same type.
This makes my analysis somewhat different from Drabbe, who states that fe
“actually means ‘other’”:
“Where we use an indefinite pronoun, we sometimes find fe, used both in combinationwith things and with persons. The actual meaning is ‘other’; büsiü fe may mean ‘the otherhouse’, ‘another house’ but also ‘a house’.”124123Other than in this book, Drabbe does not make a systematic distinction between nounsused as subject and nouns in other functions. On the basis of Drabbe’s discussion, onemight conclude that nouns can be specified for plural number by the use of joxo ‘3PL’irrespective of their syntactic or semantic function. NP’s in fe, however, are attested innon-subject position only. In the data available to us, we have only one example of a nonsubject modified by joxo:
(...)efenapigijoxoedoxeneeŋgenã.efen-api-gijoxoed-oxe -neẽ -ge-nã3SGLNK-mother-PL3PLgive-N1.RLS -DS eat-N1.RLS -N1PL‘He gives his mothers and the two of them eat.’ (1.095)
More on joxo, especially its use in subject NP’s can be found in 3.1.5.5 below.
124“Waar wij een onbep. lidw. gebruiken vinden we bij zaken zowel als bij personen weleens fe, dat eigenlijk „andere” betekent; büsjü fe kan betekenen „het andere huis”, „een
ander huis”, maar ook „’n huis.” ” (Drabbe 1957:5b)166PART I: GRAMMAR. Chapter 3: Other word classesThe different ‘meanings’ described by Drabbe are, in my view, allcontextual implications of the use of fe ‘3SG’ and have to do more with the
translation into Dutch than with actual meaning differences. The formative
is often used in series of references to several tokens of the same type. In
these contexts it often refers to ‘another one’ of the same token, or — whenthe series is restricted to two tokens — ‘the other one’, cf. the examples
from (198) onwards.
The formative is used both independently, and in combination with a noun,
but attested in non-subject position only.125 This latter fact can be seen as a
confirmation of my analysis of fe as a marker of singular number; it is only
as a non-subject that number marking makes sense. The number of the
subject is already clear from inflection on the verb, so that marking of
number on the subject-NP is often redundant.126
In (198) we find an example of an independently used fe.
(198)Emuosüdükfeüge.emuosü-dü=kfeü-gethengo.down-SS=CON3SGstab-N1.RLS[SG]Then he goes down [out of the tree] and stabs one. (1.184)In (200), on the other hand, fe is used attributively, modifying the noun wi.
Note that the pig was introduced in the preceding sentence, given here as
(199).","[182, 183, 184]"
"150
NP1PossessorPART I: GRAMMAR. Chapter 3: Other word classes
(3SG/3PL pronoun)NP2PossessedFigure 11: Possessive construction with full noun phrase in possessor position; main stress
is on NP2The optional pronoun can be either efe ‘3SG’ or joxo ‘3PL’, as in neto efebüsiü [father 3SG house]113 ‘father’s house’ or Ma joxo büsiü [Ma 3PL house]
‘the village of the Ma clan’. Examples without a pronoun are neto xasi
[father spear] ‘father’s spear’; büsiü tò [house opening] ‘the doors and
windows of the house’. It should be noted that in possessive constructionsthe use of the pronoun efe is not restricted to humans and larger animals, as
is the case when it is used in other positions (cf. 3.2.1).
If the possessed noun starts with a vowel, it is obligatorily prefixed with n-,
which will be referred to as a possessive linker and which will be glossed
as LNK.114 The prefix serves to avoid a vowel clash at word boundaries, and113It should be noted that Drabbe’s description contains several examples where vowel-initial kinship nouns alternate with forms in n, without any apparent difference in meaning.
Thus, eto ‘father’ alternates with neto; api ‘mother’ with napi. The origin of vowel-initial n
is unclear. It could either be a grammaticalized form of the first person possessive prefix ndescribed in 3.3, with the meaning of ‘my father’ bleached into ‘father’, or be the
possessive linker described later on in this section, with an unexpressed possessor.
114Drabbe compares this linker to the marker na in Pisa. About this na, Wester remarks thefollowing: “Pisa (...) frequently makes use of a possessive marker na, ‘of’. This na appears
between the two nouns that stand in a possessive relation to each other, for example nabona xãy, literally ‘father of house’, which means ‘father’s house’. The possessive marker na
is also found in Mandobo. (...) There are no occurrences of a possessive marker na
inYonggom Wambon, Digul Wambon or Kombai.” (Wester 2014:53) Wester sees thePART I: GRAMMAR. Chapter 3: Other word classes151is used within the possessive construction only. Its function is not purely
phonological, as we do find clashes of vowels at word boundaries in other
positions,butormorpho-phonologicalconfined to this specific construction.","[167, 168, 169]"
