Paragraph,Page number
"V.8.   The parts of speech.
   In the foregoing sections we have mentioned several types of words
with the distinctive names of the traditional parts of speech. These
distinctions are obviously based on structural, morphological and
syntactical, features, characteristic for them, which will be clear enough
from the examples cited. But on some points further explanation and
justification seems necessary. It will be clear, for instance, that the
verb is characterized as such by its flexion; that the noun and the
adjective are distinguished from each other by their different syntactic
positions in word subordination with another noun; the demonstrative
pronoun from the adjective by its similar syntactic position as the
noun’s, and the personal pronoun from the noun by its pseudo-flexion
of “genetive”   (possessive) forms through apophony.          But some doubt
may be justified as for the “adverbs” and the “numerals”.             Notably
the latter allow more than one interpretation.
   The “adverb” has no specific characteristics to distinguish it from
the noun or the adjective. Often nouns can function as adverbial
expressions, e.g., huwe, “evening, afternoon”, but also “in the evening” ;
makaj, “manner, way”, but also “apparently” ; etc. Similarly adjectives
may function as adverbs, e.g., nahinki, “sufficient(ly)”. The syntactic
position of the “adverb” as attribute to the adjective is not different
from that of the adjective to the noun. But many “adverbs” occur
only as such, i.¢., as attributes to adjectives or verbs, and never occur
as adjectives to nouns nor as nouns themselves, e.g., nahi’bi, “promptly,
suddenly, further”; manam, “still, yet”; ba, “only, just’; mo, “id.”;
bamo, “id.” ; bamba, “exceedingly, violently” (bam, “not” + ba, “only,
a little’); mana, “to-day”; wena, “yesterday”; wahena, “tomorrow” ;
etc. Some are apparently formed with a preposed na or na, which may
be none other than the 3"" p.s. pronoun as a possessive or a demon-
strative (cf. III.2.1       and III.3.1),    eg., na-hu’we,   “in the evening,
 evenings”;   na denijaj,    “in the night, of nights” ; and possibly also the
example already mentioned, nahi’bi. Others seem to be distinguished
by repetition, e.g., dala wahawowmi, nahinki-hinkt jejwowmi, “he dealt
out to them goods, sufficiently he gave to them” ; but bele nahinkt bamo,
“that (was) just sufficient”. But in such cases the repetition may
 62                   GRAMMAR     OF THE SENTANI     LANGUAGE represent intensity rather than adverbial quality. Also many “adverbs”
 seem to have an irregular stress, notably final stress even when the
 word ends in a vowel, eg., na-hu’we, “in the evening’, cf. ’huwe,
 “evening”, with normal stress; nahi’bi, “suddenly”; and with both
 irregular final stress and repetition wa’la-wa’la, “quickly”. But, as we
 have seen (III. 2) repetition is found in several adjectives as well; and
 irregular final stress also occurs in other words. Yet the latter seems
to be more frequent in such “adverbs”.
   As to syntactic position in relation with the verb, the relative freedom
of the “adverb” as compared with other attributive word-types is
certainly a specific feature, cf. the examples cited: nahi’bi duwawoke,
“suddenly it sank”; but also dowke nahi’bi, “she took suddenly”. All
evidence taken together, I feel justified in regarding the adverbs as
a separate part of speech, although it must be admitted that its distinc-
tive features are not very pronounced.
   The “numerals” I have included in the adjectives. But a different
interpretation is, for some historically at least, equally possible. The
lower numerals 1-4 are, as far as we can judge at present, independent
words: ambaj, “1”; be, “2”; name, “3”; kali, “4”. They follow the
noun to which they refer and therefore can be classed as adjectives.
But if the construction of noun plus numeral is taken as a subordinative
combination of type (1) in section V. 7 (noun plus noun), these numerals
can also be regarded as nouns, meaning “unit”; “pair”; etc. And
certainly nouns are, historically at least, the higher “numerals” which
appear to be formed with names of parts of the body, eg., mahambaj
(< ma     fe ambaj,   “one   hand-palm’’),   “5”;   mahina   ambaj,   “6”;   which
are derivational and partly derivational partly syntactical respectively
(cf. III. 2.1 and V.6); ma be, “10” (lit. “2 hands”); ma be odo fe
ambaj, “15” (lit. “2 hands, one footsole”); u ambaj, (“one body”) or
odo be ma be (“2 feet, 2 hands”), “20” ; etc., which are fully syntactical.
For the sake of simplicity and unity, however, we do not distinguish
between the various types for our classification as part of speech.","[69, 70]"
"      Person                   I                 II               Ill                IV
1™    sg.                  doje                  da              dej                 da
2™    se.                  woje                  wa              wej                 wo
3""    sg.                  noje                  na              nej                 no
1**   du., pl. ex.         meje                  me              mej                 —
1** du., pl. in.7          eje                   (e)             gj                  —
2™ du., pl.                moje                  ma              maj                 mo
3° du., pl.                naje                  na              ngj                 no
    The no.I series, which is probably composed with the emphatic
particle je, contains the stressed absolute forms of the personal pronoun.
The no. IT forms are at the same time the indifferent absolute forms
of the personal pronoun used as subject, the personal forms used with
postpositions, and the possessive forms. In quick speech they may
be abbreviated to d-, w-, etc. before vowel, except for the 1°* p. du., pl.
incl. and excl. No. III is a strongly stressed possessive, also used as
absolute (substantive) possesive (Eng.                 “mine, yours”), and hence as
a kind of reflexive (Eng. “myself, yourself”). It is sometimes abbre-
viated to de, we, etc. The 3"" p, is also used sometimes as a demon-
strative; and this may be the case also for na of the II series, if at
least na, na in the abstract nouns of ITI.2.1 and in certain adverbial
expressions as na-huwe, “in the evening(s)” (cf. huwe, “evening”’) ;
na-denijaj, “in the night(s)” (cf. denijaj, “night’”), and others (cf. V. 8),
must be regarded as demonstrative and not as possessive. The no. IV
series lastly represents a toneless proclitic possessive, which is often,
though    not   necessarily,       abbreviated    to d-,   w-   etc.    before   vowel,   but
which is not a prefix, and is not essentially different from no, II
as possessive. Often the two types may be used for each other, eg.,
da ahamam or da ahamam, “my food”; na falam or na falam, “his7 I have included this “inclusive” form of the 1** p.du., pl., although it is not
  in general use and is probably a dialectal form adapted to this specialized end
  under Austronesian influence. For in the closely related Tanah Merah language
  the unique form for the 1** p.du., pl, both inclusive and exclusive, is ee,
  while it is mi, me in Nafri. Also in the inflected forms of the verb there is
  not a single trace of separate inclusive and exclusive 1** p.du., pl. forms. The
  series II type of this pronoun (e) is put between brackets because I have
  never met it in actual usage, while my informants were divided in their
  opinions on the point.
                                     MORPHOLOGY                                    17
head”; but often also speech usage assigns the one or the other form
to definite words, eg., wa ma, “thy hand”; na dama, “his tail”; na
ime, “his house”;       na jo, “his village”; na kalu,   “his (brother’s)   son” ;
da u, “my body”; etc., but na fa, “his child” (though na hokolo-fa, “his
younger child”); na a’hanajala, “his rations”; na waku, “his drum” ;
na jam, “its (the house’s) roof”; etc. Neither euphony nor classification
of nouns plays a demonstrable part in this, although, naturally, the
latter may have existed in an earlier phase of the language and may
have had its influence at the time.","[24, 25]"
"V.7.     Subordination of words.
   There are ten types of subordinative combination of words: (1) noun
and nominal attribute (noun); (2) noun and noun in paratactical ap-
position ; (3) noun and nominal attribute (adj ective, including numerals) ;
(4) noun (including gerund) and pronominal attribute ; (5) noun and
verbal attribute; (6) adjective and adverbial attribute; (7) adverb and
adverbial attribute; (8) verb and adverbial attribute; (9) verb and object
or goal; and (10) combination of types (1) and (4) to form possessive
phrases.
   In type (1) the attribute precedes the head, and the function is that
of a generalized relation of possession or origin. We have already briefly
mentioned this type in III.2.2 on borderline cases; e.g., aka’la obo,
 “jungle (i.e. wild) pig”; joku falam, “dog’s head” ; ondofolo fa, “chief’s
 child” ; ondofolo i’fa, “‘chief’s canoe” ; etc. The attribute may be accom-
 panied by the postposition le ~ de, “with”, to indicate a possessive
 relation in the sense of “having something on or with one”. The
 attribute in this case is itself a (postpositional) phrase, e.g., ondofolo
 le fola, “the chief’s bow-and-arrow”          (that he has with him); Dasim
 58                   GRAMMAR    OF THE SENTANI     LANGUAGE Kalawbew de omi, “D.K.’s daughter” (whom he has with him) ; ne-waw
 de joku, “his uncle’s dog”; joku le falam, “the dog’s head” ; etc.
      In type (2) the apposition follows the head, a slight pause intervening,
 eg., ney jo da awojde        Hubulew    Jawbe-jo    da Abala     Jakali nej —
 a bala-jo — da; “they both went to their own villages, H. to Jawbe
 village (and) Jakali of Sbala to his — the Obalo village’; Ajokoj
 — Dasim Kalawbew de omi — ake kolukawna, “A. — D.K.’s daugh-
ter —     went (and) held him”; etc.
      The adjective (and the numeral)     of type (3) follows the head, eg.,
ime kabam, “big house”; do hokolo, “young man”; mije nale, “old
woman” ; fa hokolo, “young child” (as distinct from the composite form
hokolo-fa, “the younger or youngest child of a family”; cf. III. 2.1);
fa bana, “an older child” (as distinct from bana-fa, “elder, eldest child’’) ;
ja ambaj, “one day, a certain day” ; hokolo be, “the two young (ones)” ;
do name, “four men’ etc.
   If the noun is accompanied by a pronominal attribute, demonstrative,
interrogative, or possessive (type 4), the latter precedes the head, e.g.,
bele do, “that man”; daka ime, “this house”; dika no, “yonder tree
(trunk)”; na falam, “his head”; na dama, “its tail”; da ime, “my
house”; da or da ahamam, “my food”; nej jo, “his (own) village” ;
dej ime, “my (own) house”; na ma, “his hand”; nej ma na, “on their
hand” (i.e. “at their expense instead of his own”); wej mej, “your due” ;
hina mej, “whose due?”’; maka mej, “due for what, for what end?”;
n-aj-aj (contracted from na or na ajaj),            “his going”   (gerund);   na
bej-bej, “his seeking, the seeking of him”; n-ajdi n-oj-oj, “its going
up (and) its falling down”; etc. The attribute may be accompanied by
the postposition Je ~ de, “with”, as possessive, e.g., hina le ime, “whose
house ?”; etc.
  Type (5) consists of a noun followed by a finite verb form which,
however, has not finite, but participial or relative, function, eg., dois, moreover, restricted to standing expressions like the one mentioned,
is really only functionally subordinated (as from our point of view),
but structurally it is not essentially different from the serially coordina-
tive type of construction of phrases mentioned in V. 6.1, 374 para.
    The adverb which determines an adjective (type 6) follows it, eg.,
foj sala, “very good” (s for h after j); hele najkaj sala, “a very loud
shouting” ; mahs-mahe bamo, “only some, only a few”; do ambaj fam,
“even one man”; do halan nam, “so many men” for *halam +
fam ~ ham); etc.
                                 SYNTAX                                    59
  If the adverb determines another adverb        (type 7), it has the same
position, eg., wala wala hala,       “very quickly”;   foj moj sala, “very
exceedingly good” ; etc.
   As attribute of a verb the adverb (type 8) may either precede or
follow the verb, the former position being favoured, notably (but not
exclusively) when the adverb is stressed, e.g., nahi’bi duwawoke,
“promptly it sank”; wala-wala jadonko, “quickly fetch” ; wahena daje
kulum udale, “to-morrow I shall pack up”; banam dilowfoke, “again
he dived”: nawa dowke, “you’ve got it indeed, all right”; but also:
duwke mo fam, “it only just fell, started falling” ; w-om Jakali dowke
nahi’bi neji molo da, “thy daughter has suddenly taken J. for her
husband” ; nabe u nabe wa jewboke ama-foma, “it was restored entirely
in its original condition” ; etc.
   If the verb has an object for attribute (type 9), the latter as a rule
precedes the former, e.g., fi ukake, “he beat the sago”; dejmaj koma,
“let us make a feast”; na kada-nala awsajawboke, “he squandered his
possessions”;   i fownanake,   “he    jabbed   fire at him’;   na   kada-nala
wahewmikoke, “he divided their goods to them”; aka mije jawaw-
nohonde, “thou wilt accompany thy elder brother’s wife”; etc. But
for reasons of emphasis the order is sometimes reversed, e.g., wala-wala
jadonko malo, “quickly bring here clothes”; adajnobo gha!, “lodk at
the thing!” ; etc.
   The object may be qualified or stressed by a postposition, in which
case the attribute is itself a two word phrase of the postpositional
type (V. 5). Postpositions are the rule, of course, for an indirect object
or, with intransitive verbs denoting a movement, for the direction. But
just as in the forementioned examples the incorporated object affixes
referred both to the direct object (aka mije jawawnohonde) and to the
indirect object (¢ fownanake and kada-nala wahewmikoke), a post-
position may refer to a direct or an indirect object. The use and the
choice of postpositions with the object depends on the nature of the
action expressed in the verb. In so-called intransitive verbs as a-, “go”,
etc., a postposition indicates the direction of the movement, eg., jo da
ake, “he went to the village’; ime da owoke, “he descended from the
house” ; etc. Similarly in Dajma da wawna, “he-said-to-him to Dajmo”,
Dajmo is the indirect object with the postposition da to the verb wa-,
“say to, tell”, which is at the same time inflected for this same indirect
object by the person object affix -na. And the same situation is found
in Hijako da huwawnokoke, “she related (it all) to H.”. But in joku
na foke hoje, “a dog thou wentst kill”, and in ko na anke anke, “he
 60                 GRAMMAR   OF THE SENTANI       LANGUAGE had eaten coconuts”, it is the direct object, which is accompanied by
 the postposition na, “in”.
    Type (10) lastly, contains two subtypes: (a) one in which the com-
 bination consists of a single noun as head preceded by a two-word
 phrase of type (1) or (4), with a noun, interrogative pronoun, or the
 emphatic possessive,   plus mej,    “due”,   as attribute;   and   (b) one in
which the combination consists of a single noun as attribute, followed
by a two-word phrase of type (4), with the normal possessive of the
3 p. na    na plus another noun, as head. The first subtype denotes
a relation, possessive or other, in which the head is the due of, is the
thing destined or meant for, the attribute, eg., Nakahabo mej ko,
“the Lobster’s coconut (his due, his part)”; hina mej habakaj, “whose
tobacco (due to whom) ?”; we7 mej ime, “thy house (meant for thee)” ;
nej mej kada-nala, “goods due to them’; etc. The second subtype
denotes a specialized relation of origin or possession, as distinct from
the generalized relation of type (1); eg., joku na falam, “the head of
the dog”, as distinct from joku falam, “dog’s head”; Dajma na joku,
“D.’s dog”; am oloku na fe, “oloku-banana leaf”, as distinct from am
fe, “banana leaf” (generally); ondofolo na fa, “the chief’s child”, as
distinct from ondofolo fa, “a chief’s child” ; Dasim n-omi, “D’s daugh-
ter” ; ondofolo na fala, “the bow-and-arrow of the chief” ; etc.","[65, 66, 67, 68]"
"   The Sentani verbal system is extremely complicated. A verbal form
consists of one or two verbal roots to which may be added affixes for
person (including number) both for the subject and the object (direct
or indirect), mood, tense and aspect. The only prefix in use is the
negative a-. These facts, together with the frequent contraction of
affixes, justify the analysis of the verbal structure on the basis of root
plus affixes only, without making distinction between suffixes and
infixes, and without introducing the notions of “stem” and of “imme-
diate constituents” which would in most cases hardly be a simplification.
   Structurally three principal types of verbal forms can be distinguished :
(1)         primary forms, which are formed without an aspectual affix;
(2)         secondary forms, which contain an aspectual affix; and
(3)         composite forms, which contain two verbal roots.
     In the last category two types can be distinguished:
(a)   the two roots are different, the first of them indicating a move-
ment and each being inflected differently, in which case the compound
denotes a sequence of events ;
(b) the two roots are the same; this is the case of repetition of root
forms indicating the gerund.
                                         MORPHOLOGY                                                19
   An apparent third possibility of composition of similar roots in
inflected forms other than that mentioned in (b), is really that of a
verbal root indicating movement, which takes what seems to be origi-
nally a bound variant of the same root as an aspectual affix and
thereby stresses the direction of that same movement (see IIT. 4. 4. 1).
This belongs, therefore, in the category of secondary forms of (2) supra.
   Repetition of fully and independently inflected verb forms is syn-
tactical and does not belong in this chapter (see III. 2.2 and V. 6).
   In the categories of non-composite, i.e., primary and secondary,
forms alone, a simple calculation will show that the number of theore-
tically possible verbal forms, including all moods, tenses and aspects,
and including both forms with and without object affixes, amounts to
more than 4,000, of which the indicative alone accounts for some 2,500.
Naturally these possibilities do not all occur for every single verb, and
some have similar forms for dual and plural object affixes. But the
calculation shows clearly enough that the actually possible forms do
number some thousands.
   The following table gives a schematic conspectus of the verbal system
as far as non-composite forms are concerned:
       Person                    Mood                  Tense                           Aspect
                                                     Present
                                                |    Imperfect                         —
3 persons, each               Indicative             Aorist
in sg., du. and                        .             Habitualis
pl., and for both                                    Future                secondary forms
subject and ob-          {| Adhortative                                    derived with
ject                     |    Conditional               —-                 apectual         affixes
                                                                           for     goal         deter-
2"" p.s., du., pl.                                                          mination
subject ; all per-            Vetative                  —
sons for object
uninflected                   Negative               uninflected
   Examples: root a-, “go”; a-j, “go thou!” (adhort. 2 p.s.); a-le, “he
goes” (pres.); a-j-de, “they two go” (pres.); a-wo-le, “he went’ (im-
perfect);       a-ke,   “he   went”      (aorist);   a-da-le,     “I   shall     go”      (future);
e-j-ja-le, “he uses to go” (habitualis) ; root folo-, “cut” ; folo-w-ko-k-a-le,
“T cut (something)” (aorist with aspectual affix -ko-); folo-w-no-ko-k-
a-le, “I have cut something for him” or “I have cut it” (with obj. aff.
3 p.s.); folo-w-di-ke, “he cut upwards”                (with asp. aff. -d1-) ; etc.
20                    GRAMMAR      OF THE   SENTANI   LANGUAGE
III. 4.1.   The   verbal   root.","[26, 27, 28]"
