Paragraph,Page number
"335The following table lists the tense-aspect-mood categories associated with
each of the six status-polarity combinations for ordinary verbs (for copulas, see §6.4).
Positive realis and positive irrealis are indicated by zero morphs (but the tenseaspect-mood affixes for positive realis and positive irrealis moods are mutually
exclusive); negative realis (§6.1.3) is conveyd by negative realis verb boke (class I)
or -boka (class II); positive semi-realis (§6.2.1) is conveyd by the positive semirealis verb samby or its bound form -mby/ -mb; negative-semi-realis (§6.2.2) is
conveyd by a particle ga; and negative-irrealis (§6.3) is conveyd by an affix ma-/ -ma/ -me/ -m.","[349, 350]"
"6.2SemiSemi-realis status
Semi-realis status encompasses only one tense-mood category — futuredeclarative (other future categories are irrealis; §6.3). Future declarative verbs of
positive and negative polarities have markedly different morphological forms:
positive semi-realis verbs are characterised by a serialised ‘positive semi-realis verb’
366samby (class I) (§6.2.1), whereas negative semi-realis verbs have a negative semirealis particle ga (§6.2.2). Finite verb stems are used for semi-realis verb forms
(§5.1.1), and if the lexical verb lexeme makes a distinction between future versus
non-future finite verb stems (§5.1.2), the future form must be used. The form of the
positive semi-realis verb varies greatly depending on the person-number-gender
features of the subject, and it is difficult to give a general morphological template of
positive semi-realis verbs. In some cases the positive semi-realis verb forms a
separate phonological word from the lexical verb, and in other cases the positive
semi-realis verb forms a phonological word together with the lexical verb (see
§6.2.1). On the other hand, negative semi-realis verbs are morphologically simple in
comparison. Negative semi-realis verb forms begin with a negative semi-realis
particle ga and then followed by a (future) finite verb stem (§5.1.1-2) together with
its cross-reference suffix(es). The cross-reference suffixes used in negative semirealis verb forms are always class A suffixes (§5.2). The negative semi-relias
particle ga is a separate phonological word.ga(FUTURE) FINITE VERB STEM — CLASS A CROSS-REF SUFFIX(ES)The following verbs exemplify realis versus semi-realis, and positive versus
negative verb forms of the verb lexeme hofu (hof-/ gof-) ‘come’ (class I).6-84. hof-efa-hwa.6-85. hofu boke-efa-hwa.come-1PL-PASTcome NEG:R-1PL-PAST‘We came.’ (-efa class IA)‘We did not come.’3676-86. gof-efusamby-efu.6-87. gagof-efa.come:FUT-1PL POS:SMR-1PLNEG:SMRcome:FUT-1PL‘We will come.’ (-a class IB)‘I will not come.’The functional differences between semi-realis verbs and other future verb
forms will be discussed in §6.2.3.","[380, 381, 382]"
"Table 6.5Cross-reference suffixes in positive/ negative realis independent verbsverb class of verb stem/ verb
IIHIIBIIIIIIAIHAIIBIIAIIIAlexeme:
cross-referencing in positive realis:
negative realis verb:bokebokacross-referencing in negative realis:IAIIAThe negative realis verbs boke and boka are not used as independent verbs.
The negative realis verb always take subset A cross-referencing (§5.2). Other than
independent verbs, the negative realis verb boke/ boka is also used in realis
subordinate clause verbs (§7.1) and disjoint-referential chain clause verbs (§7.2.1).
Coreferential chain clause verbs (§7.2.1) and non-finite chain clause verbs (§7.3.1)357cannot be in negative polarity, while verbal noun phrases (§7.3.2) are negated by an
abessive case clitic =mboka (§4.5.5.)Also notice that due to the a-deletion rule and the vowel degemination rule
(§2.3), the initial segment of cross-reference suffixes which begin with a or e would
be deleted by the preceding a or e segment at the end of boke or boka, e.g. boke-aha
(NEG:R-1SG) > bokeha, boke-efa (NEG:R-1PL) > bokefa, boka-Ø-a (NEG:R-N1SG3FSG:O) > boka . The following are examples of positive and negative realis verb
forms formed from class I lexical verb lexemes.","[371, 372]"
"7.2.1.2Polarity and cross-reference suffixes on chain verbs
Except for class IIB verbs which can only take class IIB cross-referencesuffixes (§5.2.2), DR chain verbs take subset A cross-reference suffixes, and CR chain
verbs take subset B cross-reference suffixes. DR chain verbs can be in positive or
negative polarity; CR chain verbs must be in positive polarity. In Menggwa Dla, the
domain of negativity does not extend beyond clause boundaries; if the subjects of13See also §7.4 on the use of mefi (ma-)/ me as a grammatical verb indicating completive aspect.",[465]
"Independent verbs carry cross-reference suffixes (§5.2) and other affixes
which indicate tense, mood, status, polarity, and sometimes aspect (§6). There are
three tenses: past, present and future. Three statuses are distinguished: realis (§6.1),
semi-realis (‘certain future’; §6.2) and irrealis (§6.3). Morphology associated with
the three statuses is markedly different, especially the way negatives are formed
(negativity is independent from status in Menggwa Dla; §6.1.3, §6.2.2, §6.3).",[22]
"There is no affix marking positive irrealis specifically. The positive irrealis
verb forms have the following morphological structure (the prohibitive mood verbs
are never in positive polarity):FINITE VERB STEM — CROSS REF SUFFIX(ES) — TM SUFFIXFormally, the negative irrealis verbs differ from the positive irrealis verbs by
having an extra negative irrealis affix which is affixed to the verb stem. The
negative realis affix has the form of ma-, -ma, -me or -m. The negative realis affix
is always ma- when affixed to non-finite verb stems (§5.1.1). For finite verb stems,
the regular allomorphy of the negative irrealis affix is as follows:•-ma is suffixed to class IIB, class II or class III verb stems.",[393]
"3626-69. a. Conservative negative realis:
wamlaaflambli seru boke-aha-hwa.betel.nut manyeatNEG:R-1SG-PAST‘I did not chew (‘eat’) a lot of betel nut.’ (-aha class I)
b. Innovative negative realis:wamlaaflambli ma-ser-iha-hwa.betel.nut manyNEG:R-eat-1SG-PAST‘I did not chew (‘eat’) a lot of betel nut.’ (-iha class IH)Positive realis:6-70. wamlaaflambli ser-iha-hwa.betel.nut manyeat-1SG-PAST‘I chewed (‘ate’) a lot of betel nut.’Negative irrealis:6-71. wamlaaflambli ma-ser-i-naho.betel.nut manyNEG:IR-eat-1SG-CNTR‘I would not have chewed (‘eaten’) a lot of betel nut.’ (-i class IHB)6.1.4Questions in realis status
Except for copulas (§6.4), there are no verb forms which indicateinterrogative mood specifically. Polarity questions are only distinguished from their
statement counterparts by intonation: statements usually end in low pitch, whereas
questions end in a high pitch (§2.4.2).","[376, 377]"
"Independent verbs are grammatically marked for status1, tense, aspect, mood
and/or polarity. In terms of verbal morphology, the most important categories are
status and polarity (polarity is independent of status in Menggwa Dla), as the overall
morphological structure of a verb is determined first by its status and polarity. A lot
of languages have a binary realis-irrealis status distinction; Mithun (1999:173)
generalises the binary status distinction as follows: ‘The realis portrays situations as
actualized, as having occurred or actually occurring, knowable through direct
perception. The irrealis portrays situations as purely within the realm of thought,
knowable only through imagination’. In addition to realis status and irrealis status,
there is also an in-between status category called ‘semi-realis’ in Menggwa Dla,
which signifies that on one hand it is like irrealis in that the situation is imagined,
but on the other hand it is like realis in that the speaker is conveying his/ her
certainty over the realisation (positive future declarative) or non-realisation (negative
future declarative) of the situation.",[349]
"Table 6.1Realis categories
Positive realis:Negative realis:Ø (§6.1)boke (class I)/ boka (class II) (§6.1.3)
Present transitional -mbi (§6.1.1.1)
Present stative -mbi (§6.1.1.2)
Present continuous -hi (§6.1.1.1-2)
Past -hwa (§6.1.2)
‘Past with focus’ -hya (§6.1.2)Table 6.2Semi-realis categories
Positive semisemi-realis:Negative semisemi-realis:
realis:samby (class I)/ -mb / -mby (§6.2.1,3)ga- (§6.2.2-3)336Table 6.3Irrealis categories
Positive irrealis:Negative irrealis:Ø (§6.3)ma- ~ -ma ~ -me ~ -m (§6.3)Imperative and jussive moods -Ø (§6.3.1)Prohibitive moodCautious mood -we ~ -e (§6.3.2)ma- … -we ~ -e (§6.3.2)Tentative mood -ni (§6.3.3.1-2)
Future interrogative mood (§6.3.3.3)
Indirect imperative mood (§6.3.3.3)
Counterfactual mood -naho (§6.3.4)For independent clauses, tenses always have the time of utterance (‘present
time’)2 as the point of reference; for dependent clauses, the point of reference may
be the time of utterance (absolute tense) or the time of some other clause (relative
tense). Three tenses are distinguished: past, present and future tense. Present tense
in Menggwa Dla conveys present time or near present time. Near present time
refers to immediate past time or immediate future time, in other words time which is
considered by the speaker to be near the present time, typically no more than a few
minutes away from the present time. Correspondingly, past tense and future tense
convey non-immediate past time and non-immediate future time respectively. If the
progression of time is represented by a horizontal line running from left to right, and
the time of utterance by an × on the horizontal time line, this is how the tenses in
Menggwa Dla dissect the time line:2‘Time of utterance’ and ‘present time’ here refer to the time of utterance in real time or the time of
utterance of a direct quote.","[350, 351]"
"4347.1.2.1Realis -hwani ‘when’ clauses
A realis -hwani verb has a (non-future) finite verb stem (§5.1.1-2), subset Across-reference suffix(es) (§5.2), and a -hwani ‘when’ suffix at the end. With realis-hwani clauses, the situation is known by the speaker as having occurred (positive
polarity) or not occurred (negative polarity), or habitually occurring (positive) or
habitually not occurring (negative), and the situation of the matrix clause begins
after the inchoation point of the situation of the -hwani clause. The use of
subordinate realis -hwani clauses is rather rare, for that sequential meaning is mostly
conveyed by chain clauses (§7.2). A realis -hwani clause is used as the final clause
of a non-finite clause chain or when it is followed by non-finite chain clauses (and
non-finite chain clauses themselves are rather rare; §7.3.1). In a non-finite chain
clause, the subject must be coreferential with the subject of the following clause in
the clause chain. On the other hand, the subject of a -hwani clause must be disjointreferential with the subject of its matrix clause. In effect, a non-finite chain verb
and a realis -hwani verb is the coreferential (CR) and disjoint-referential (DR) verb
forms — respectively — of a switch-reference (SR) system. Nevertheless, this nonfinite/ -hwani SR system is used much less often than the chain clause SR system.
(See §7.2 on chain clauses and §7.3.1 on non-finite chain clauses.)In the following examples, the clauses preceding the -hwani clauses are nonfinite chain clauses; in example 7-48 the -hwani clause is followed by another nonfinite chain clause, and in example 7-49 the -hwani clause is followed by an
independent clause. Notice the change in subject between the realis -hwani clause
and the following matrix clause in both examples.","[448, 449]"
"451two adjacent clauses are coreferential but the first clause is in negative polarity, the
first clause cannot be a chain clause (a subordinate (§7.1) or independent clause (§6)
can be used instead).","[465, 466]"
"8While the negative semi-realis verb form remains unchanged: the negative semi-realis particle ga
plus followed by a (future) finite verb stem plus subset A cross-reference suffix(es) (§6.2.2).",[376]
"The negative form of a DR chain verb is formed by serialising a negative verbboke (class I) or boka (class II) in DR chain verb form to a non-finite form of the
lexical verb; class I, IH and IIB lexical verbs take boke (which takes class I crossreference suffixes), whereas class II and III lexical verbs take boka (which takes
class II cross-reference suffixes). This is formally the same as the negative realis
verb boke/ boka used in independent clauses (§5.1.3). Nevertheless, the chain clause
negative verb boke/ boka does not indicate status, unlike the independent clause
negative realis verb boke/ boka which indicates realis status. The following are
examples of positive CR chain verbs, positive DR chain verbs and negative DR chain
verbs in different verb classes. Notice the changes in the cross-reference suffixes,
especially when the negative verb boke (class I)/ boka (class II) is used. The class
III verb lexeme sefi (sa-/ da-) ‘give’ has a special negative non-finite form sekoni
(§5.2.3).",[466]
"Class II lexical verbs:6-61. klikli-Ø-a-hwa.
scratch-N1SG-3FSG:O-PAST
‘S/he scratched.’ (klikli ‘scratch’ class II, -Ø-a class IIA)6-62. kliklibokahwa (< boka-Ø-a-hwa).scratchNEG:R-N1SG-3FSG:O-PAST‘S/he did not scratch.’ (-Ø-a class IIA)6-63. iŋgufu-hi-Ø-hwa.
attack-1SG-3MSG:O-PAST
‘I attacked him.’ (iŋgufu ‘attack’ class II; -hi-Ø class IIA)6-64. iŋgufu boka-hi-Ø-hwa.
attackNEG:R-1SG-3MSG:O-PAST‘I did not attack him.’ (-hi-Ø class IIA)Class III lexical verbs:6-65. sa-ka-wa-hwa.
give-3SG-3SG:O-PAST
‘S/he gave (it) to him/her.’ (sefi (sa-/ da-) ‘give’ class III; -ka-wa class IIIA)3616-66. sekoniboka-i-Ø-hwa.give:NEG:R NEG:R-3MSG-3MSG:O-PAST
‘He did not give (it) to him.’ (-i-Ø class IIA; 50I)6-67. sekoniboka-ya-Ø-hwa.give:NEG:R NEG:R-3FSG-3MSG:O-PAST
‘She did not give (it) to him.’ (-ya-Ø class IIA)6-68. sekoniboka-Ø-a-hwa.give:NEG:R NEG:R-3SG-3FSG:O-PAST
‘S/he did not give (it) to her.’ (-Ø-a class IIA)Another important point concerning the negative realis verb form is that in
the eastern villages of Menggau and Wahai, but not in western villages of
Wanggurinda and Menggwal, there is a trend of the negative irrealis suffix (ma-/ -ma/ -me/ -m; §6.3) being used to indicate negative realis.8 These innovative
negative realis verb forms are formed by the positive realis verb form (e.g. example
6-70) affixed by a negative irrealis affix, which now also indicates negative realis
(e.g. example 6-69b, compare this with the conservative negative realis form 6-69a).
Example 6-71 demonstrates a negative irrealis verb form.","[375, 376]"
"6.3.3.1Non-future tentative mood
Positive non-future tentative mood verb forms consist of a non-future finiteverb stem (§5.1.2), followed by subset A cross-reference suffix(es) (except for class
IIB verbs which must always take class IIB cross-reference suffixes; §5.2.2), and
finally by a tentative -ni. Negative forms have a negative irrealis affix ma-/ -ma/ -me/ -m/ (§6.3) affixed to the non-future finite verb stem (§5.1.2).6-141. yafli sihafaiplwa ser-yefye-ni.dog 2SG:GEN fisheat-N1FDU-TENT‘Maybe the dogs ate/ is eating your fish.’
(seru (ser-/ det-) ‘eat’ class IH; -yefye class IH)6-142. nyewi tupopo-Ø-a-ni.people egg take.egg:MASS-N1SG-3FSG:O-TENT
‘Maybe someone took/ is taking the eggs.’
(popo ‘take eggs from nest’ class II, mass undergoer; -Ø-a class IIA)6-143. fa-ya-a-ni.
leave-3SG-3FSG:O-TENT
‘Maybe s/he has just left.’
(fefi (fa-) ‘leave’ class IIB; -ya-a class IIB)3876-144. hwahwamayani.
a. hwahwa-ma-Ø-ya-ni.
know-NEG:IR-N1SG-1SG:O-TENT
‘Maybe s/he/you does not know me.’b. hwahwa-ma-ya-Ø-ni.
know-NEG:IR-N1FSG-3MSG:O-TENT
‘Maybe she/you does not know him.’
(numu (num-) ‘sit’ class I; -Ø-ya, -ya-Ø class IIA)11Another strategy to convey tentativeness is having a realis clause followed by
a tentative copula (§6.4.1). The following is an example.6-145. akana num-u-hi
theremeni.sit-3MSG-PRES:CONT COP:TENT‘Maybe he is there.’ (numu (num-) ‘sit’ class I; -u class IA)6.3.3.2Future tentative mood
Future tentative mood verbs always carry a negative irrealis affix; there is nopositive formal counterpart. Even though all future tentative mood verbs have a
negative irrealis affix, the speaker is not biased towards the positive or negative
outcome by using a future tentative verb. Future tentative verb forms are formed by
a future finite verb stem, a negative irrealis affix (§6), a set of cross-reference
suffixes, and optionally a tentative suffix -ni. The sets of cross-referencing used are
11The speaker cannot remember which the intended interpretation was. Without context this
sentence remains ambiguous. Also see the paradigm of class IIA cross-reference suffixes in §5.2.2.","[401, 402]"
"3516-33. yesini=mbe pe-u-mbithen sky=INSrani.be.gone-3MSG-PRES:STAT that‘(The moon) went into the sky and stayed there (ever since).’
(pe ‘be gone’ class I; A)In Menggwa Dla, dynamic situations in negative polarity are treated like
stative situations. Like other states, the present continuous -hi is used to convey that
the negative state is temporary, and the present stative -mbi is used to convey that
the negative state is permanent or the inchoation and completion points are not
salient. See §6.1.3 for negative realis verb forms.6-34. seru boke-aha-hi.
eatNEG:R-1SG-PRES:CONT‘I have not eaten yet.’/ ‘I am not eating now.’
(seru (ser-/ det-) ‘eat’ class IH; -aha class IA)6-35. utiseru boke-wa-mbi.prawn eatNEG:R-3FSG-PRES:STAT‘She does not eat prawns.’6-36. ai fofo
3boke-wa-hi.smoke NEG:R-3FSG-PRES:CONT‘She is not smoking currently.’ (fofo ‘smoke’/ ‘blow’ class I)3526-37. ai fofo
3boke-wa-mbi.smoke NEG:R-3FSG-PRES:STAT‘She does not smoke.’6.1.2Past tense -hwa and past tense with focus -hya
Past tense in Menggwa Dla signifies non-immediate past time.5 Both -hwaand -hya mark past tense, and neither are specified for aspectual information. The
difference between -hwa and -hya is that -hwa only marks past tense, whereas -hya
also indicates that a constituent in the clause or the whole clause is focused. We
will see some examples of the semantically less marked -hwa first.6-38. tikyewi ap-ehye-hwa.
smallsleep-1DU-PAST‘We slept a little bit.’ (apu (ap-) ‘sleep’ class I; N)6-39. kapaliimbu na-Ø-pa-hwa.tree.kangaroos two shoot-3SG-N1DU:O-PAST
‘S/he shot two tree kangaroos.’ (nefi (na-) ‘shoot’ class II)6-40. mi=lofoklo-hya-a-hwa.mother=COM separate-1SG-3FSG:O-PAST
‘I parted with my mother.’ (klo (klo-) ‘separate’ class IIB)5Immediate past time is conveyed by present tense. See §6.1.","[365, 366, 367]"
"4357-48. [hofahi-Ø, hofo=hi
[fall-DEPek-wa-hwani,]ground=ADS exist-3FSG-when]palaŋgi=nambo hwela numuli-Ø,
machete=ALLskinremove-DEP‘(The
The sago palm)
people)
palm falls, and then it lies on the ground, then (people
people remove
the bark with machetes, and…’ (B)7-49. [waŋguharifi-mbo, num-wa-hwani,] butya-hwa-a-Ø.[sparrow enter-DEPsit-3FSG-whenhit.with.stick-1DU-3FSG:O-JUS‘The
The sparrows enter (the cave), and when they are already there, we will
catch the sparrows.’ (N)The following is an example with two positive realis -hwani clauses.
Whether the first -hwani clause is subordinate to the second -hwani clause or not is
unclear.7-50. efi-ya-a-hwani,hwalfehi ap-ei-hwani,become.dark-3SG-3FSG:O-when womanyani dofo heli=nasleep-N1FPL-whenpi-mbo,man secret ceremony=ALL go-DEP
‘When it becomes dark, when the women sleep, the men go to the secret
ceremony, and…’A negative realis -hwani verb is formed like an independent negative realis
verb: the lexical verb is in its non-finite form; class I, IH and IIB lexical verbs are436serialised with the negative verb boke (class I), and class II and III verbs are
serialised with the negative verb boka (class II) (see §6.1.3). The following is an
example of a negative realis -hwani clause.7-51. hihifuboke-Ø-hwani,wulihanu-mbo,be.happy NEG:R-3MSG-when house go.down-DEP
‘When he is not happy, (the
the foreign bride j) would leave the house, and…’7.1.2.2Irrealis -hwani ‘if/ when’ clauses
Positive irrealis -hwani verbs have the same form as realis -hwani verbs(§7.1.2.1), except that sometimes a future finite verb stem is used instead of a nonfuture finite verb stem (see below). Negative irrealis -hwani verbs are formed by
affixing the negative irrealis affix ma-/ -m/ -ma/ -me (§6.3) to the verb stem of a
positive irrealis -hwani verb.","[449, 450, 451]"
"Other than having defective paradigms (as they cannot have object crossreference suffixes other than -a (3FSG:O)), these monovalent class IIB verbs have the
same formation as other class IIB verbs. Most importantly, these monovalent
transitive class IIB verb lexemes form the realis negative form in the same manner as
other bivalent class IIB verb lexemes. The realis negative form of class IIB verb
lexemes are formed with the lexical verb lexeme in its non-finite verb form followed
by the realis negative verb boke (class I). In other words, negative realis clauses
with a class lexical IIB verb would only have one cross-reference suffix, i.e. they can
be intransitive as class I verbs only have one cross-reference suffix. The following
example shows that kefi ‘break’ in negative polarity is ambiguously monovalent and
bivalent,Monovalent:5-105. kefiboke--efye
efye-mbi.break NEG:R-N1DU-PRES
‘The two (things) are not broken.’
(kefi (kefi-) ‘break (monovalent)’ class IIB)315Bivalent:5-106. kefiboke--efye
efye-mbi.break NEG:R-N1DU-PRES
‘They two did not break it.’
(kefi (ka-) ‘break (bivalent)’ class IIB)The completive verb fefi (fa-) ‘class IIB’ can be serialised with a monovalent
lexical verb in a coreferential chain verb form (§7.2.1), in which case the object
cross-reference suffix would be semantically empty. In the following example, the
completive verb fefi (fa-) is serialised with apu (ap-) ‘sleep’ (class I) which only has
one semantic argument; the 3FSG object suffix -a on the completive verb is
semantically empty.5-107. ap-ehifa-hwa-aØ-numb-ehi-mbo,sleep-1DU COMPL-1DU-3FSG:O SEQ-1DU-DEP
‘After we have slept…’ (N) (ap ‘sleep’ class I, fefi class IIB, nuŋgu class I)The only semantic argument of hihili ‘turn around/ back’ has an actor
semantic role. The actor is treated as the subject; the object cross-reference suffix is
semantically empty.5-108. (yo=na) hihili-hwa-aØ-numb-ehi-mbo,(1=TOP) turn.back-1DU-3FSG:O CR-SEQ-1DU-DEP
‘We turned back, and then…’ (N)316There is also the class IIB verb efifi ‘become dark/ late’ which has two crossreference suffixes but no semantic arguments. For this avalent transitive verb, both
cross-reference suffixes take the default person-number-gender combination of 3FSG,
and expectedly there can be no (pro)nominals representing core relations in the
clause.205-109. efi-ya-a-mbi.
get.dark-3SG-3FSG:O-PRES
‘It is getting dark.’ (lit. ‘It darkens it.’)
(efifi (efi-) ‘get dark’ class IIB)Most other avalent meteorological verbs belong to class I (but not all
meteorological events are expressed by avalent clauses; see below). The following
are examples of meteorological events expressed by avalent class I verbs.5-110. hwi-wa-mbi.
rain-3FSG-PRES:STAT
‘It is raining.’5-111. mumri-wa-mbi.
thunder-3FSG-PRES:STAT
‘It is thundering.’20There seems to be no verb which specifically means ‘to get bright’; the notion of ‘getting bright’
can be conveyed by simbu ‘be morning’ (class I).","[329, 330, 331]"
"3566.1.3Negative realis verb boke and boka
A negative realis independent clause is formed by the lexical verb in its non-finite form (§5.1.1) followed by a negative realis verb boke (class I) or boka (class
II). Whether boke or boka is used depends on the verb class membership (§5.2) of
the lexical verb: for class I, IH and IIB lexical verbs, boke (class I) is used; for class
II and III lexical verbs, boka (class II) is used. Class IH, IIB and III lexical verbs
have mismatching classes of cross-reference suffixes between positive and negative
realis verb forms: in positive realis, the finite lexical verb stem itself controls the
class membership of the cross-reference suffixes; in negative realis, it is the negative
realis verb boke (class I) or boka (class II) which controls the membership of the
cross-reference suffixes. The following table summarises the class of crossreference suffix used in positive realis verb form versus negative realis verb form.","[370, 371]"
