Paragraph,Page number
"Anumberof others,partly simple stems and partly unanalyzable derivatives, are listedhere, such as have been already listed under adverbial suffixes not
being repeated.
1. Local adverbs:
no"" down river 17.9;63.1;124.15no's: next door ([?] related to n6“) 17.4; 188.2
hina‘u up river ([?] compounded with n6“) 22.7; 23.1; 61.13;
192.14da‘-o'l near (cf. -t', § 112, and see § 93) 100.15; 102.6; 126.2
dihau(ya’?) last of all (see § 93) 120.18
gi **wa far off 48.8; 192.1
aba’ in the house (cf. § 37, 14) 28.8; 43.13; 140.5
ha’**ya‘ on both sides, mutually (cf. § 37, 5) 172.10; 176.62. Temporal adverbs:bd"" now, to-day 49.13; 50.1; 56.11; 61.11
ha’ur still, yet (cf. § 37, 9) 78.1; 126.21;
porn Soon}192.8;198.11soon 128.18olo’m (ulu‘m) formerly, up to now 43.11; 63.1; 71.15; 166.2
hemdi‘ when? 132.24; a’ni® hem never
mi now, already (often proclitic to following word) 22.4; 63.1;
190.9gané then, and then (often used merely to introduce new state
ment)47.14; 63.1, 2, 16A noteworthy idiomatic construction of adverbs or phrases of tem-poral signification is their use as quasi-substantives with forms of
la*lit- Become. Compare such English substantivized temporal
phrases as AFTERNOON. Examples are:
sama’xa lap‘k‘ in-summer it-has-become 92.11
hayewa'xdada la*lé’ in-their-returning it-became (=it became
time for them to return)124.15habébini diha’-uda la*lit‘a® noon after-it when-it-became (= when
it was afternoon) 186.8§ 113pas]HANDBOOKOF INDIANLANGUAGES—TAKELMA271. Negative and affirmative adverbs:hat’ no 134.19, 21
ha’-w yes 24.13;64.1;170.12a/nié not (with aorist) 23.3, 6; 64.3; 78.1a/ndi not? 56.10; 90.26 (e. g., a’ndi k‘ai are there not any?) 56.8
ni‘ not? (with following subordinate): s--ni't naga’sbinda® didn’t
I tell you? 136.10
naga-di‘ do (you) not? 116.12
wede not (with inferential and potential) 25.13; 122.22, 23
. Modal adverbs:
,hono’® (rarely heard as honé‘n 74.8; this is very likely its original form, cf. -'n for -*ne, § 112, 3) again, too, also 22.4; 58.5;
134.1ganga only 54.4; 94.5; ganga’-hi anyhow 94.8; 142.13; ganga-s2’
just so, for fun
wana‘ even 47.10; 61.3; 71.8; 76.4; 186.2
yaxi/*wa however (cf. yaxa, § 114, 9; for -wa cf. gi/“wa, § 113, 1)72.11; 74.15ha’ga explanatory particle used with inferential 28.10; 45.11
(e. g., ga haga wa'la® yu‘k‘ so that one was really he 170.8)
nak!a* in every way, of all sorts (e. g., k‘adv’ nakla ‘a’nié igi’nan
what kind was not taken?, i. e., every kind was taken 60.11)yewé perhaps 136.23; 180.8; 196.18
so, s'6% perfectly, well 136.20; 166.1 (e. g., s'0’* detgwa’lt'gwitp'
take good care of yourself! 128.24)
amadi’ (si)wouldthat!","[276, 277]"
"§ 713]HANDBOOKOF INDIANLANGUAGES—TAKELMA199m of the demonstrative pronoun hé@’‘ga THAT ONE; it is used also:h persons other than the third:
yana’t'e haga‘ I should have gone in that event
§'72. USESOFPOTENTIALANDINFERENTIALThe potential and inferential modes differ from the aorist in the
zative particle with which they may be combined. An indicative
n-future statement, such as is expressed by the aorist, is negatived,
thout change of the verb-form, by means of the negative adverb
ve:
yant'e® I went; a’ni* yant‘e® I did not go
1 imperative or future form, however, can not be directly negatived,t must be expressed by the potential and inferential respectively,
e non-aoristic negative adverb wede being prefixed.
gative future:
yana''t' he will go
yanada’* you will goyana’t'e* I shall go
domxbinI shall kill you:
:Thus we have:wede yana‘k‘ he will not go
wede yana’k!ett' you will not go: wede yana’k‘a‘ I shall not go
: wede dimzbiga‘ I shall not kill178.15you (cf. 178.15)d6“ma‘nk‘ he will kill him:wede(1) nek’ (2) yapla (8)
gama’rdi (4) dé“mk‘ (5) no
(1) one(2) will slay (5) aperson (3) who is no shaman
(4) 146.16egative imperative:yana* go! (sing.):wede yana‘t' do not go!yana‘np* go! (pl.):wede yana‘t'p‘ do not go! (156.9)d6“m kill him!","[204, 205]"
"The particle wede is used with the inferential and potential, not
uy to form the negative future and imperative, but in all cases inhich these modes are negatived, e. g., wede d6“ma’/'n I SHOULD NOT
AVE KILLED HIM, I WOULD NOT KILL HIM. There is thus no morphogic distinction between a prohibitive Do Not Go! and asecond person
ibject negative apodosis of a contrary-to-fact condition, You WOULD
OT HAVE GONE.",[205]
"71.15; 86.14; 98.8As indefinites, they are often followed by the composite particle
-s'wa'k'di:|nek'-s'i*wa’k'di I don’t know who, somebody 22.8|k‘ai-s'i*wa’k‘di I don’t know what, something 96.10
|
As negative indefinites, nek’ and k‘ai are preceded by the negative
adverb ani‘ or wede, according to the tense-mode of the verb (see
§ 72):§ 105:.",[260]
"§ 59248]HANDBOOKOF INDIANLANGUAGES—TAKELMA159‘he inferential is also regularly employed in expressing the negative
iture.","[164, 165]"
"44.5; 70.6; 73.9; 190.10as indefinite, by -s‘i®wa’k‘di (cf. 190.4):
gwis’i*wa'k‘di in some way, somewhere54.7; 96.8; 120.21 (alsogui’hap‘ somewhere)
as negative indefinite, it is preceded by a’ni* or wede:
a’ni® gui‘ in no way, nowhere 23.6; 62.11;192.14we'de gui na‘t’ do not go anywhere!
As indefinite relative is used gwi’ha WHERESOEVER 140.9, 13, 15, 19.
IV. TheAdjective(§§ 106-109)§ 106.",[261]
"It is probably not a mere accident that the negativearticle wedeis phonetically identical with the verb-stem wede- TAKE
way. ‘This plausible etymology of wede suggests that the origin of§ 72|200BUREAUOF AMERICANETHNOLOGYrwthe negative future and imperative constructions lies in such per
phrastic sentences as:
|
Remove(all thought from your mind) that I (inferentially) e0(i. e., I shall not go)
Remove(all thoughtfrom your mind)that youmight, wouldgo (i. e., do not go!)
The inferential, as we have seen above (see § 59), is used primarilyto indicate that the action is not directly known through persona
experience. An excellent example of how such a shade of meaning
can be imparted even to a form of the first person singular was given
in § 70; s°*i!-k‘we'*xit ulum watk‘anda’ THEY WOKE ME UP WHILEI
WAS SLEEPING! 74.5 In the myth from which this sentence is taken,Coyote is represented as suffering death in the attempt to carry out
one of his foolish pranks.","[205, 206]"
"60 Temporal adverb in -n § 112, 3.
51 yap/a see note 1; “a deictic post-nominal element § 102 (people of long ago contrasted with those of
to-day).
62 wi/lté or wilt’t third personal pronominal form § 92 III of noun wi’ li HOUSE see note 2. PEOPLE THEIRHOUSE regular periphrasis for PEOPLE’S HOUSE.
Observe that predicate verb (third personal aorist ofTO BE) is not expressed in this sentence.
53 Temporal adverb in -za § 112, 2.
4 sama’za cf. note 53; -s-if § 114, 4.
6 Modal adverb compounded of demonstrative stem a- THIS § 104 and natne‘z see note 49.
68 Negative adverb of aorist § 113, 3.",[301]
"The uses of thepotential and inferential will be best illustrated by examples given
after the forms themselves have been tabulated. In a general way
the potential implies the ability to do a thing, or the possibility of
the occurrence of a certain action or condition (I CAN, COULD Go if Icare, cared to), and thus is appropriately used in the apodosis of an
unfulfilled or contrary-to-fact condition; it is also regularly employedin the expression of the negative imperative (prohibitive). The |
peculiar form of the potential (verb-stem with aorist pronoun endings)
seems in a measure to reflect its modal signification, the identity of
its stem with that of the future indicating apparently the lack of
fulfillment of the action, while the aoristic pronominal elements may
be interpreted as expressing the certainty of such fulfillment under
the expressed or implied circumstancesby the person referred to.",[164]
"Noun of uncertain etymology, perhaps from base lab- CARRY ON ONE’S BACK.tive suffix of no known definite signification.-s nominal deriva-.11 yimi’ri. Present imperative second person singular subject, first person singular object (-zi) of verb
yiimiya’*n Type 11 LEND IT TO HIM; aorist stem ytimit-, verb-stem yimi-. Non-aoristic formsshow instrumental -i- as in nak‘ik'; e. g., yimi’/hin 1 SHALL LEND IT TO HIM.
Whap'dek’. Seehap'da(1). -de‘k' first person singular possessive pronominal suffix according to Scheme II.
18 loho’idat. Subordinate form, with causal signification, of loho’#* HE DIED. Aorist stem lohof- —verbstem loho- + intransitive element -i- characteristic of aorist of Type 4;~, third personal aorist subject intransitive Class I, dissimilated because of catch in subordinating suffix -dat. Syntactically loho’ida‘ is subordinated to yimi’zi.
\4 naga’-ihit. =naga’i* HE SAID+ quotative enclitic -hit. naga’ third person sorist of irregular verb
nagait'et Type 491 SAY; aorist stem nagai-, verb-stem na-. Both transitive and intransitive formsof na(g)sayincorporate object of thing said; ga in gas-it (2) is incorporated as direct objectin nak'ik' (it would be
theoretically more correct to write ga [-s'if} nak'ik'); while quotation ‘‘laps . . . yimi’zi’’ is syntactically
direct object of naga’-ihit which, as such, it precedes. ga-ndk‘ik' anticipates ‘‘laps . . . yimi’zi’’ naga’ihi€. Observe use of aorist instead of inferential from naga’-ihi¢ on.
1sq’/nit. Negative particle with following sorist. True negative future would be wede yimi’hizbiga®.",[297]
"ParticlesBy particles are nere meant certain uninflected elements that have
little or no meaning of their own, but that serve either to connect
clauses or to color by some modalthey are attached.modification the wordto whichThey are never met with at the beginning of sclause or sentence, but occur only postpositively, generally as enclitics.
Some of the elements listed above as modal adverbs (§ 113, 4) might
also be considered as syntactic particles (e. g., wana, ha’ga, nakla',
which never stand at the beginning of a clause); these, however,show no tendency to be drawn into the verb-complex. Whenever
particles qualify the clause as a whole, rather than any particular
word in the clause, they tend to occupy the second place in the sentence, a tendency that, as we have seen (p. 65), causes them often
to be inserted, but not organically incorporated, into the verb
complex.
The most frequently occurring particles are those listed
below:
1. ya@’* sust.",[278]
"This elementimplies that the action which was done or attempted failed of
success:
mit hono® tlombk‘wa-his mal then also he-killed-him nearly spearshaft (personified), i. e., spear-shaft almost managed to kil
him, as he had killed others 28.11; (cf. 188.20)A frequent Takelma idiom ig the use of hi‘s with a form of the
verb of saYING na(g)- to imply a thought or intention on the
part of the subject of the na(g)- form that fails to be realized:
“ha-xiya’ mi*wa sga’*t'ap‘de®”’ naga’**-hi‘s ‘“‘in-the-water probablyI-shall-jump,”’ he thought(but he really fell among alderbushes and was killed) 94.17
Sometimes fis seems to have a usitative signification; prob
ably the main point implied is that an act once habitual has
ceased to be so:
dak-his-t' ekle’exade® T used to smoke (but no longer do)
8. wits, wis IT SEEMS, DOUBTLESS.a likely inference.
mi'-wis dap'a'la-uThis particle is used to indicateExamples are:
moyigwana’n now-it-seems youth he’s-to-bespoiled (seeing that he’s to wrestle with a hitherto invincible
one) 31.12mit wi''s Gk!a tlomoma’n now apparently he-for-his-part he-hes
been-killed (seeing that he does not return) 88.9,(6)9. YaxA CONTINUALLY, ONLY. The translation given for yazaisreally
somewhat too strong and definite, its force being often so wesk
as hardly to allow of an adequate rendering into English. It§ 114boas]HANDBOOK OF INDIAN LANGUAGES—TAKELMA277often does not seem to imply more than simple existence oraction unaccompanied and undisturbed. It is found often
with the scarcely translatable adverb ganga ONLY, in which
case the idea of unvaried continuance comes out rather
strongly, e. g.:
ga’-hi yaxa ganga naga’** that-indeed continually only he-said
(i. e., he always kept saying that) 24.15From ganga it differs in the fact that it is often attracted into
the verb-complex:
;
ganga ge’l-yaxa-hewe'haw only he-is-continually-thinking (i. ¢., he
is always thinking) (cf. 128.18; 146.15)
10. wata’'(sina‘) REALLY, COME TO FIND ovT 45.11; 170.8. As
indicated in the translation, wala’* indicates the more or lessunexpected resolution of a doubt or state of ignorance:
ga haga wala’? wilt wat%-t!a/nik* that-one so really house he-keptit (i. e., it was Spear-shaft himself who kept house, no one else)
28.10Certain usages of wala’*si(na‘), evidently an amplification of
wala’®, have been already discussed (§ 70).11. dé 1nTERROGATIVE. The interrogative enclitic is consistently
used in all cases where an interrogative shade of meaning is
present, whether as applying to a particular word, such as an
interrogative pronoun or adverb, or to the whole sentence.
Its use in indirect questions is frequent:
min t'v’+s mizal di‘ tlomomana’* he-counted gophers how-many
had-been-killed
The use of the interrogative is often merely rhetorical, implying an emphatic negative:
k‘a-di’ ma wilt wa'-1-tla’nidaé literally, what you house you-will-keep? (=you shall not keep house) 27.16; (cf. 33.1; 47.9)
Ordinarily di occupies the second place in the sentence, less frequently the third:yi'klalade® mi di‘ *a’ni* kat your-teeth now (inter.) not any
(i. e., have you no teeth?) 128.23Besides these syntactically and modally important enclitic particles, there are a few proclitics of lesser significance. Among these
are to be included mi‘ Now and gané THEN, AND THEN, which, thoughthey have been included amongthe temporaladverbsand may§ 114|
278BUREAUOF AMERICANETHNOLOGY[pout4indeed, at times, convey a definite temporal idea, are generally weak!
unaccented introducers of a clause, and have little determinable force:gané ya’* then he went 92.26; 118.19; 152.7
mi! loho’*« then he died 71.13; 98.19;122.13The proclitic ne* WELL! is used chiefly as introductory to a hortatory statement:ne® go“m-s'i'* dak‘-s-ini/‘da naba’“ha‘n let us-in-our-turn overhis-nose let-us-do (i. e., let us pass over him!) 144.11
net tlomoma’‘n let me kill him, (cf. 96.4)
§ 115.","[282, 283, 284]"
"It ishus evident that no true ordinal exists for even the first numeral.
VI. Adverbs and Particles (§§ 112-114)A very large number of adverbs and particles (some of them simple
tems, others transparent derivatives, while a great many others still
re quite impervious to analysis) are found in Takelma, and, particuarly the particles, seem to be of considerable importance in an idioaatically constructed sentence. A few specifically adverbial suffixesre discernible, but a large number of unanalyzable though clearly
\on-primitive adverbs remain; it is probable that many of these are
rystallized noun or verb forms now used in a specialized adverbial
ense.",[273]
"§ 93us]HANDBOOKOF INDIAN5. LocalLANGUAGES—TAKELMA241Phrases (§§ 94-96)§ 94. GENERAL REMARKSLocal phrases without possessive pronouns (i. e., of the type IN THE
OUSE, AOROSS THE RIVER) may be constructed in three ways.
A local element with third personal possessive suffix may be used
) define the position, the noun itself appearing in its absolute form
3an appositive of the incorporated pronominal suffix:
da’n gwelda* rock under-it (i. e., under the rock)da’n handa through the rock
dan ha’“ya*da around the rock
dan da‘oldi’‘da near the rock
dan ge'lda in front of the rock
dan di’nda behind, the rockhere is observable here, as also in the method nearly always employed
) express the objective and genitive relations, the strong tendency
haracteristic of Takelma and other American languages to make the
ersonal pronominal affixes serve a purely formal purpose as substiutes for syntactic and local cases.
The second and perhaps somewhat more common method used to
uild up a local phrase is to prefix to the noun a pre-positive, the
oun itself appearing in the form it assumes before the addition of
he normal pronominal suffixes (Schemes II and III). Thus some of
he preceding local phrases might have been expressed as:
gwel-dana‘ under the rockhan-dana‘ through the rock
ha’“*ya-dana* around the rock
.gel-dana* in front of the rockdi'-dana*‘ behind the rock
‘hese forms have at first blush the appearance of prepositions folwed by a local case of the noun, but we have already seen this
xplanation to be inadmissible.","[246, 247]"
"Verb proper.yaza- continuousltlozo’zitn I
gather (them) (=I
gather sticks
together)
wasgiwi’n she is bought (sh
is brought with it) 176.17
tlilitiga’*n I follow (it) (=I
keep following the trail)
sgetle’sgiditn I lifted (them) (=I
lifted up the rocks)
¢
swilswa’lhi he tore him («he
tore himopen with a knife)73.3| 4- handodwa- with itha-in
bda- uw4- hand7
han- acrosswaya- knifedak‘- aboveda- mouthwala’tsina- trulyhandmi’ twa- probablyza- between, |
in two;yhdali’nda* T answering him (=I
did answer him)
sgt’ tbitn I cut him (=T’ll Brobably cut him through)31If two adverbial (local) elements are used, the body-part prefix
follows that which is primarily adverbial in character; thus:
ba-ide'‘didi’niklat‘ did you stretch it out? (=ba--out +de-lip,
in front + di interrogative particle + di’ntk!at‘ you stretched it)
In general it may be said that instances of a body-part prefix preceding a primarily adverbial element (like ba-i-, ba°-, he*‘-, and others)
are rare or entirely lacking.
From what has been said it might seem 1 that the connective and
modal elements (like yaza,mi’“wa, and di) are more closely associated
with the verb form than are the other elements, yet this is only
apparently the case. Properly speaking all these modal elements are
post-positives that normally attach themselves to the first word of3045°—Bull. 40, pt 2—12—5§ 3466BUREAUOF AMERICANETHNOLOGY[BULL.40the sentence, no matter what part the word plays in the sentence.
Thus in a form like me’*-di-giniga‘t‘ DID YoU COME? (= me‘- HITHER +
di- interrogative particle + giniga‘t’ You WENT TO), the modal (inter-rogative) element di regularly stands nearest the verb; but as soon as
another word is introduced before the verb, the interrogative particle
shoves back a step, and we have a form of sentence like, e. g., hoida’'s
di me’‘giniga‘t’ DID YOU COME AS SINGER, i. e., TO sinc? From thisit becomes fairly evident that the di in the first example is not properly a verbal prefix at all, but merely a post-positive particle depending upon the preceding me’‘, in the same way that, in the second
example, it depends upon the noun hoida’‘s stncER. This inference
is clinched by a form like giniga’t‘tdi pi» you ao (SOMEWHERE)!
for here the di is evidently an enclitic element, not a prefix.
In sharp contradistinction to such movability, the body-part and
adverbial prefixes occupy rigidly fixed positions before the verb;
they therefore belong to a class quite distinct from the modal particles. These latter are verbal prefixes only in so far as their postpositivetendencymayforcethemtobecomeembeddedin the.verb-complex, in which case they seem to cut loose the incorporated
object, adverbial prefix, and instrumental element from the verb.
Diagrammatically the last form tabulated may be represented by
za-i- [mi’*wa] -sgi’*bi'n.","[71, 72]"
"§ 71. CONDITIONALSConditionals differ from other subordinate forms in that they are
derived, not from the full verb-form with its subject-affix, but,if
intransitive, directly from the verb-stem; if transitive, from the verbstem with incorporated pronominal object. In other words, the conditional suffix -k‘i* gi‘) is added to the same phonetic verbal units
as appear in the inferential before the characteristic -k‘, and in the
periphrastic future before the second element -gulug’-. The phonetic
and to some extent psychologic similarity between the inferential
(e. g., dimaik’ HE EVIDENTLY STRUCK ME) and the conditional (e. g,dimazigi® Ir HE STRIKES, HAD STRUCK ME) makes it not improbable
that the latter is a derivative in -2* of the third personal subjective
form in -k‘ of the latter. The conditional, differing again from other
subordinates in this respect, shows no variation for pronominal sub
jects, the first and second personal subjective forms being periphrastically expressed by the addition to the conditional of the third per
sonal subjective of the appropriate forms of e- BE. From verb-sten
yana- Go, for example, are derived:
Singular:First person, yana’k’ié ett‘e®|Second person, yana’k‘v ett§ 71Third person, yana’k‘s®|oas]HANDBOOKOFINDIANLANGUAGES—TAKELMA197Plural:
First person, yana’k'ié e¢bi‘k‘
Second person, yana’k'v' ett‘p‘Impersonal: yanayaak's
The conditional is used not merely, as its name implies, to expresshe protasis of a condition, but as the general subordinate form of
realized activity; as such it may often be translated as a temporalrrelative clause, an introductory adverb or relative pronoun serving
0 give it the desired shade of meaning. Examples of its use other
han as a conditional, in the strict sense of the word, are:
yok loya’'n (1) nek’ (2) léxbigi® (3) I know (1) who (2) will give
you to eat (3)
dewe’nxa (1) al-ai’k lin (2) gui*ne (3) yana’k'i® (4) I shall see him (2)
to-morrow (1), when (3) he goes (4)
al-xi’*xink* (1) gwitne
when (2) I go (8)(2) yana’k'vé ett‘e® (3) he will seeme(1)gwen-t' ga*-bo'k‘danda (1) ts*!0'*tligi® (2) ya’* (3) he'ne (4) ya’? (5)ze*bagwa’n (6) just (3) ‘when they touch (2) the eastern
extremity of the earth (1), just (5) then (4) I shall destroy
them (6) 144.15
It has a comparative signification (as rHovGH) iin:
plit (1) de-gi’klalzgi* (2) na‘naga’* (3) it was (3) as though fire
(1) were glowing (2) 142.1Conditional sentences are of two types:
(1) Simple, referring to action of which, though unfulfilled, thereyet remains the possibility of fulfillment.
(2) Contrary to fact, the hypothetical activity being beyond the
possibility of fulfillment.
Both types of condition require the conditional form in the protasis,
but differ in the apodosis. The apodosis of a simple conditional sentence contains always a future form (or inferential, if the apodosis is
negative), that of a contrary-to-fact condition, a potential. Examples
of simple conditions are:
ga (1) na‘nak‘ié ett’ (2) hazada’ (3) if you do (2) that (1), you'llget burnt (3)
ak‘ (1) yana’k‘ié (2) gi* (3) hono® (4) yana’t'e* (5) if he (1) goes (2),I (3) go (5) too (4)
wede (1) yana’k'i® (2) git (3) hono® (4) wede (5) yana’k‘a® (6) if hedoes not (1) go (2), I (3) won’t (5) go (6) either (4)gwalt’ (1) mahai (2) wo’k'i® (3) ga (4) na%gi’*k‘ (5) if a great (2)
wind (1) arrives (3), say (5) that! (4) 196.19
1Just when = AS SOON AS.","[202, 203]"
"On the otherhand, the term “incorporation,” though generally of more value as 8
classificatory label than “‘ polysynthesis,” conveys information ratheras to the treatment of a special, if important, set of concepts, than
as to the general character of the process of form-building.
If we study the manner in which the stein unites in Takelma with
derivative and grammatical elements to form the word, and the vocalic
and consonantic changes that the stem itself undergoes for gram-matical purposes, we shall hardly be able to find a tangible difference§ 25Boas]HANDBOOKOFINDIANLANGUAGES—TAKELMA58in general method, however much the details may vary, between
‘Takelma and languages that have been dignified by the name “ inflectional.’”’ It is generally said, in defining inflection, that languages
of the inflectional as contrasted with those of the agglutinative typemake use of words of indivisible psychic value, in which the stem and
the various grammatical elements have entirely lost their single individualities, but have “chemically”(!) coalesced into a single form-unit; in other words, the word is not a mere mosaic of phonetic
materials, of which each is the necessary symbol of some special
concept(stem) or logical category (grammatical element).","[58, 59]"
