Paragraph,Page number
"In support of the actual existence of this admired lack of a oneto-one correspondence between a grammatical category and its phonetic expression is often quoted the multiplicity of elements that
serve to symbolize the same concept; e. g., Lat. -i, -ae, -a, -és, -iis, all
indicate that the idea of a plurality of subjects is to be associated
with the concrete idea given by the main body of the words towhich they are attached. Furthermore, variability of the stem or
base itself is frequently adduced as a proof of its lack of even a
relative degree of individuality apart from the forms from which
by analysis it has been abstracted; e. g., German bind-, band-, bund-,bdnd-, biind-. These two characteristics are very far indeed from
constituting anything like a definition of inflection, but they are
often referred to as peculiar to it, and hence may well serve us as
approximate tests.
.
As regards the first test, we find that just such a multiplicity of
phonetic symbols for the same, or approximately the same, concept,
is characteristic of Takelma. The idea of possession of an object by
@ person or thing other than the speaker or person addressed is
expressed by -2a, -a, -da (-t‘a), +t’, or +, all of which are best rendered
by HIs, HER, ITS, THEIR (the ideas of gender and number do not
here enter as requiring grammatical expression).
Similarly, the ideaof the person speaking as subject of the action or state predicated
by the main body of the verb is expressed by the various elements
te’ (de®), -t'e* (-de*), -'n, -n, -k‘a® (-ga*), all of which are best ren-dered in English by “I.”-¢'ef is confined to the aorist of intransi-tive verbs; -t‘e* is future intransitive; -'n is aorist transitive; -n is
future transitive; and -k‘a‘ is used in all inferential forms, whethertransitive or intransitive.",[59]
"Atendency is observable to end up a sentence with the raised pitch, so
that a syllable normally provided with a falling pitch-accent may
sometimes, though by no means always, assume a raised accent, if it is
the last syllable of the sentence. The most probable explanation of
this phenomenon is that the voice of a Takelma speaker secks its
rest in a rise, not, as is the habit in English as spoken in America, ina fall.
Vocalic Processes
§ 6. VOWEL(§§ 6-11)HIATUSThere is never in Takelma the slightest tendency to avoid the com-ing together of two vowels by elision of one of the vowels or contraction of the two.",[28]
"Inferential animperative -p‘- of Class II intransitives disappears before this ele
ment (e. g., se’nsant' WHOOPING), but not the non-aoristic -p‘-, whic
is characteristic (see § 42, 1) of some of the verbs of the same clase. g., sana‘p’ FicuT'NG (from *sana‘p‘t'). Participles in -é* neve
denote particular action, but regularly indicate that the action pred
§ 75-7618]HANDBOOKOF INDIANLANGUAGES—TAKELMA205ted of a person is one that in a way marks him off from others, and
at may serve as a characteristic attribute. Not infrequently, therere, a -t'- participle has the value of a noun of agency; the fact, how‘er, that it never appears with pronominal elements, but is always
eated as an adjective, demonstrates its attributive, non-substantival‘aracter. It is possible to use it with a preceding nominal object,
' that sentences may result that seem to predicate a single act
finitely placed in time; yet an attributive shade of meaning always
mains. For example, wihin démt' eit‘e® (literally, MY-MOTHER HAV(G-KILLED I-AM) and wihin tlomoma’'n both mean I KILLED MY
OTHER, but with a difference. The latter sentence simply states
ie fact, the emphasis being on the act itself; the former sentence,
1 the other hand, centers in the description of the subject as a matride,I AM ONE WHO HAS KILLED HIS MOTHER.","[210, 211]"
"Boas]HANDBOOKOF INDIANLANGUAGES—TAKELMA201e’me (1) daba’*z (2) di (3) *et’a (4) yu‘k' (5) are (5) canoes (4)
(to be found) only (2) here (1) ? (3) 114.7 Gi. e., why do youbother me about ferrying you across, when there are plenty of
canoes elsewhere ?)
ga (1) di’ (2) pla’*nt* (3) gatk‘a® (4) so that (1) was their
livers (3) that I ate (4) ? (2) 120.14 says Grizzly Bear, who
imagined she had eaten not her children’s, but Black Bear’s
children’s, livers, on discovering her mistake
A peculiar Takelma idiom is the interrogative use of gwi'ne WHEN,
HOW LONG followed by wede and the inferential, to denote a series of
repetitions or an unbroken continuity of action. Examples are:
gwitne (1) de’ (2) wede (3) watk’ (4) he kept on sleeping
(literally, when [1] did he not [3] sleep [4] #[2]) 142.11; 152.24
gwitne’ (1) di (2) wede (3) ho‘k‘ (4) he ran and ran (literally,
how long [1] did he not [3] run [4] ? [2]) 78.14.
gwitne (1) di’ (2) wede (3) dak‘am (4) he kept on being found,
they always stumbled upon him again (literally, when [1] was
he not [3] found [4] #[2]) 110.15Similar psychologically is the non-negative future in:
ge’me'di (1) hono® (2) al-da*gi‘nk’ (3) they never found him
again (lit., when [1] will they find him [3] again?[2]) 190.25
6. NominalandAdjectivalDerivatives(§§ 73-83)§ 73. INTRODUCTORYAlthough such derivatives from the verb-stem as infinitives and
nouns of agency should logically be treated under the denominating
rather than the predicative forms of speech, they age in Takelma, as
in most other languages, so closely connected as regards morphology
with the latter, that it is much more convenient to treat them imme-diately after the predicative verb-forms.
and adjectivalformsderivedfromThe number of nominalthe Takelmaverb-stemis notvery large, comprising infinitives or verbal nouns of action, active
and passive participles, nouns of agency, and a few other forms whosefunction is somewhat less transparent. The use made of them, however, is rather considerable, and they not infrequently play an
important part in the expression of subordinate verbal ideas.","[206, 207]"
"4 § 86, 1.
“Third personal possessive of noun yog- (?) § 86, 1 with noun-characteristic -c § 92 III. FIRE ITS-PLACE
is regular pariphrasis for FIRE’S PLACE.
Local phrase with pre-positive ha- IN; -s°d5u §86, 1 does not seem otherwise to occur
4 Connective compounded of demonstrative ga THAT and enclitic particle -e-i€ § 114,4
7 Subordinate form of alzali, note 42; § 70 (see transitive paradigm).
# Local phrase with pre-positive hdtya- ON BOTH SIDES OF and noun-characteristic -a § 95; -p/iy-a‘from
pft FIRE.
49 Modal adverb compounded of demonstrative ga THAT and nane‘z infinitive of verb ne*nagal-, verb
stem natna- §§ 69; 74,1; Appendix A.",[301]
"InterjectionsOf interjections and other words of an emotional character ther,
are quite a number in Takelma.
Some of them, while in no sens
of definite grammatical form, are based on noun or verb stems. Not
a few involve sounds otherwise foreign to the language (e. g., nasalized vowels [expressed by ""], d as in English Bat, @ as in saw, dj 3
in JUDGE, voiceless palatal J [written @], final fortis consonant); prolongation of vowels and consonants (expressed by +) and repetition!
of elements are frequently used.
The material obtained may be classified as follows:1. Partictes or ADDRESS:
ama’‘ come on! 96.24
hene’ away from here! get away!",[284]
"Not only morphologically, but also syntactically, are passives
‘losely related to transitive forms. It is the logical unexpressed subect of a passive sentence, not the grammatical subject (logical and
ormal object), that is referred to by the reflexive possessive in -gwa
‘see §§ 91,92).
Thus:
dik!olola’n t‘ga'*p'dagwan
wa‘ he-was-dug-up their-own-horns (not
his-own-horns) with (in other words, they dug him up with
their own horns) 48.5
[here is no real way of expressing the agent of a passive construc-ion. The commonest method is to use a periphrasis with xebe’*n
iE Dip so. Thus:
et salklomo’klimin pliyin xebe''n canoe it-was-kicked-to-pieces
deer they-did-so (in other words, the canoe was kicked to pieces
by the deer) 114.5
§ 67. VERBSOFMIXEDCLASS,CLASSIVA fairly considerable number of verbs are made up of forms that
delong partly to Class I or Class II intransitives, partly to the transitives. These may be conveniently grouped together as Class IV, but
are again to be subdivided into three groups. A few instransitive
verbs showing forms of both Class I and II have been already
spoken of (pp. 162-3, 166).",[187]
"§ 89oas}HANDBOOKOFINDIAN4, Possessive231LANGUAGES—TAKELMASuffixes§ 90. GENERAL(§§ 90-93)REMARKSThe possessive suffixes appended to the noun embrace elements
or the first and second persons singular and plural and for the third
rson; the form expressing the latter is capable of further ampli-ication by the addition of an element indicating the identity of the
rossessor with the subject of the clause (corresponding to Latin swus
is contrasted with éius). This element may be further extended to
xpress plurality. Altogether four distinct though genetically relatederies of possessive pronominal affixes are found, of which three are
ised to express simple ownership of the noun modified; the fourth is
ised only with nouns preceded by pre-positives and with local adver-vial stems.","[236, 237]"
"As in many Indian languages, the stress-accent of anyparticular word in Takelma is not so inseparably associated with any
particular syllable but that the same word, especially if consisting
of more than two syllables, may appear with the main stress-accent
now on one, now on the other syllable. In the uninterrupted flow of
the sentence it becomes often difficult to decide which syllable of a
word should be assigned the stress-accent. Often, if the word bears
no particular logical or rhythmic emphasis, one does best to regard
it as entirely without accent and as standing in a proclitic or enclitic
relation to a following or preceding word of greater emphasis. This
is naturally chiefly the case with adverbs (such as he‘ne THEN) andconjunctive particles (such as ganéhi® AND THEN; agas‘i§ AND SO, BUT
THEN); though it not infrequently happens that the major part of
a clause will thus be strung along without decided stress-accent until
some emphatic noun or verb-form is reached. Thus the following
passage occurs in one of the myths:
ganéhit dewenza 1a°lé hono® p‘ele’za‘, literally translated, And
then to-morrow (next day) it became, again they went out towar
All that precedes the main verb-form p‘ele’za' THEY WENT OUT TO
wk is relatively unimportant, and hence is hurried over without anywhere receiving marked stress.
Nevertheless a fully accented word is normally stressed on some
particular syllable; it may even happen that two forms differ
merely in the place of accent:
naga’~ida* when he said, but
naga-da’* when you said
_ The important point to observe, however, is that when a particular
syllable does receive the stress (and after all most words are normally
§ 516BUREAUOF AMERICANETHNOLOGY(BULL.40accented on some one syllable), it takes on one of two or three musicalinflections:
(1) A simple pitch distinctly higher than the normal,
pitch ofunstressed speech (=).","[21, 22]"
"12 Postposition with force of independent local adverb § 96.
13 See note 12; -s-if§ 114, 4.
14 mii#zda‘n numeral adverb ONCE § 111; -hi enclitic particle § 114, 2.
15 yd’a post-positive particle Just § 114, 1; -s'i* § 114, 4.
16 g-idib- (HOUSE) WALL § 86, 3; -i’¢ third personal possessive form of noun-characteristic -i- §§ %,3
92 III. HOUSE ITS-WALL is regular periphrasis for HOUSE’S WALL.
17 Third personal subject, third personal object aorist of verb mats/aga’*n Type 31 PUT IT; §§ 63; 40,218 Noun stem heel- with nominal suffix -am dissimilated from -an §§ 87, 6; 21.wilit heela‘m is compound noun § 88.
19 § 86, 1. Predicate appostive to heela‘m: THEY MAKE THOSE BOARDS OUT OF SUGAR-PINE.
% Demonstrative pronoun of indifferent number modifying heela‘m § 104.
31 Temporal or connective adverb compounded of demonstrative ga and element -ni (?=nee) of unknowl
meaning §§ 113, 2; 114 end.
2 Adverb in -daf' from local element dak‘- ABOVE § 112, 1.
23 da- § 36, 2 end; -t/aba‘k‘ third personal subject, third personal object aorist of verb -t/abaga*n Type!",[300]
"All the pronouns may be emphasized by the addition of -wi* (see
101), the deictic -*a‘ (see §102), or the post-positive particles ya’
und enclitic -hi and -s‘i§ (see § 114, 1, 2, 4):
maya’? just you 196.2
ma’hi you yourselfaihr* they themselves 104.13 (cf. 152.20)
gi‘s't’* I in my turn 47.14;188.8;(cf. 61.9)\ series of pronouns denoting the isolation of the person is formed
ry the addition of -da‘z or -da’‘xi (= -da‘x + -hi) to the forms given
ibove:gi‘da’*x(i) only I
ma*da’‘z(i) you alone
ak‘da‘z(i) all by himself 61.7; 90.1; 142.20;go*mda’*x(1) we alone
miép‘da‘x(i) you people-alone
Gida’‘z(i) they alone 138.11144.6§ 103252BUREAUOF AMERICANETHNOLOGY(Buu.40The third personal pronouns are not infrequently used with pre
ceding demonstratives:
ha’*ga(or w’daga)ak‘da‘xthatonebyhimself(@*used hereapparently as a peg for the suffixed element -da‘x by one’s self)ha‘a’it‘an and ida‘a’it‘an those people
ha§- and ida-, it should be noted, are demonstrative stems that occur
only when compounded with other elements.
The independent possessive pronouns (IT IS) MINE, THINE, HIS,
OURS, YOURS, are expressed by the possessive forms of the substantival stem ais*- HAVING, BELONGING, PROPERTY: a-is‘de‘k* IT 18 MINE
23.2; 154.18, 19, 20; a-isde’* yours; a/-is'da HIS 23.2, 3; (156.7)
and so on. These forms, though strictly nominal in morphology,
have really no greater concreteness of force than the English translations MINE, THINE, and so on.
§ 104.","[257, 258]"
"§ 698]HANDBOOKOF INDIAN LANGUAGES—TAKELMA187ment serving merely to give it grammaticalform.identical with thatin ChinookansofrequentlyemployedThis usage
dia-ts, where significant uninflected particles are joined into perirastic constructions with some form of the verb-stem -2- DO, MAKE,
COME (e. g., Wasco ?q/u’b itciuz HE CUT IT [literally, cur HE-IT-.DE]), except that in Takelma the particles are identical with the
ses of normally formed verbs.","[192, 193]"
"In some respects Takelma is typically American, in so far as it is
possible at all to speak of typical American linguistic characteristics.
Some of the more important of these typical or at any rate widespread American traits, that are found in Takelma, are: the incorporation of the pronominal (and nominal) object in the verb; the
incorporation of the possessive pronouns in the noun; the closerassociation with the verb-form of the object than the subject; dl
inclusion of a considerable number of instrumental and local m
cations in the verb-complex; the weak development of differences
tense in the verb and of number in the verb and noun; and t
impossibility of drawing a sharp line between mode and tense.
§ 116poss]HANDBOOKOFINDIANLANGUAGES—TAKELMA283Of the more special grammatical characteristics, some of which are
nearly unparalleled in those languages of North America that have
been adequately studied, are: a system of pitch-accent of fairly considerable, though probably etymologically secondary, formal significance; a strong tendency in the verb, noun, adjective, and adverb
toward the formation of dissyllabic stems with repeated vowel (e. g.,
aorist stem yowo- BE; verb-stem loho- DIE; noun mozo‘ BUZZARD;
adjective hos-d"" [plural] GzTTIna Bia; adverb olo‘m FORMERLY); &very considerable use of end reduplication, initial reduplication being
entirely absent; the employment of consonant and vowel changes as a
grammatical process; the use in verbs, nouns, and adjectives of pre-fixed elements, identical with body-part noun stems, that have reference now to parts of the body, now to purely local relations; the
complicated and often irregular modifications of a verbal base for
the formation of the most generalized tense, the aorist; the great
differentiation of pronominal schemes according to syntactic rela-tion, class of verb or noun, and tense-mode, despite the comparatively
small numberof persons(only five—two singular, two plural, andone indifferent); the entire lack in the noun and pronoun of cases
(the subjective and objective are made unnecessary by the pronominal
and nominal incorporation characteristic of the verb; the possessive,
by the formal use of possessive pronoun affixes; and the local cases,by the extended use of pre-positives and postpositions) ; the existence
in the noun of characteristic suffixes that appear only with prepositives and possessive affixes; the fair amount of distinctness that
the adjective possesses as contrasted with both verb and noun; the
use of a decimal system of numeration, tertiary or quinary in origin;and arather efficient though simple syntactic apparatus of subordinating elements and well-modulated enclitic particles. Altogether
Takelma has a great deal that is distinct and apparently even isolated
about it. Though typical in its most fundamental features, it may,
when more is known of American languages as a whole, have to
be considered a very specialized type.","[288, 289]"
"Properly speaking, then, a sentence like 1 SHALL GO, HE SAID (TO ME)
(=yana’t'e* [ga] naga’ [or nege’s't]) is rendered in Takelma by1
SHALL GO (THAT) HE DID (or HE DID TO ME), in which the quotationyana’t'e® 1 SHALL GO, or else its representative ga THAT, is incorporated as prefix in the general verb of action.
The most interesting point in connection with periphrastic phrases
in na(g)- is the use of a number of invariable, generally monosyllabic, verbal bases as incorporated prefixes. The main idea, logically speaking, of the phrase is expressed in the prefix, the na(g)1Most of its forms, as far as known, are listed, for convenience of reference, in Appendix A, pp. 286-90.
It will be seen to be irregular in several respects.
Examples of its forms are to be found in great numberin ‘Takelma Texts.”",[192]
"OF INDIAN LANGUAGES—TAKELMA
ThePronoun§ 103. Independent951(§§ 103-105)PersonalPronounsThe independent personal pronouns of Takelma, differing in this
spect from what is found to be true of most American languages,
how not the slightest etymological relationship to any of the various
ronominal series found incorporated in noun and verb, except in so
ar as the second person plural is formed from the second person sinular by the addition of the element -p‘ that we have found to be
haracteristic of every second person plural in the language.
The
orms, which may be used both as subjects and objects, are as
ollows:Singular: First person, gt 56.10; 122.8; second person, ma‘ (ma*)
6.7; 98.8;third6“m150.16;30.5;person,secondGk‘27.5;156.12.person, ma@p‘;Plural:thirdFirstperson,person Gi 49.11;ilamana‘ 27.10; 56.1
Of the two third personal plural pronouns, di is found most frejuently used with post-positive elements; e. g., dyd’* JusT THEY
= Gi ya’/*) 160.6; a@’*ya‘ THEY (= dGi-‘a‘) 49.11. When unaccomvanied by one of these, it is generally pluralized: @’it‘an (see § 99).
the second, zilamana‘, despite its four syllables, has not in thelightest yielded to analysis.",[257]
"The inferential implies that the action expressed by the verb is not
directly known or stated on the authority of the speaker, but is only
inferred from the circumstances of the case or rests on the authorityof one other than the speaker.",[164]
"No third personal idea is possible, e. g., in mazava/k‘v® ett'e’ I AM FATHERLESS.wak‘i§ is undoubtedly related to wawiTH; the -k‘i* may be identical with the conditional particle (see § 71).
On the border-line between loosely used preposition and inder»endent adverb are nogwa‘ BELOW, DOWN RIVER FROM (?=76"" DOWN
uIVER + demonstrative ga THAT) : nogwa wilt BELOW THE HOUSE
16.7; and hinwa*‘ ABOVE, UP RIVER FROM (cf. hina‘u UP RIVER) : hi’nwa
vilt ABOVE THE HOUSE 77.1.
1 Properly speaking, ha-bini‘is a pre-positive phrase from noun-stem bin- (cf. de-bin FIRST, LAST, and
?) bilgan-z- BREAST[ ? = middle part of body-front}]) with characteristic -i-. bee-bin- SUN’S MIDDLE isompounded like, e. g., t'gda- bok’dan- EARTH’S NECK above (§ 93).",[251]
"§ 93240BUREAUOF AMERICANETHNOLOGY[owe44ha-sa’lda (thinking) of her (iterally, in her footsteps) 142.13
di‘-dandé over my eardi‘-ts:/eleidé over my eyes
ha-dedé in my mouth (170.2; 182.17)
gwen-bok‘dandé at my nape
2G*-s inidé resting on my nose (like spectacles)gwel-‘wa°didé down from my body 198.4
Several such forms with apparently simple local signification contain
after the pre-positive a noun stem not otherwise found:
2a*-s‘ogwida’m between us
ha-‘winidé inside of me (73.1; 92.17)
di-bo""widé at my side
da‘oldidé close to me (124.9) (cf. adverb da‘o'l near by 102.6)Such a non-independent noun is probably also ha-u- in gwen-ha-r
and di-ha-u-, both of which were listed above as simple local elements,
Instances also occur, though far less frequently, of pre-positives
with two nouns or noun and adjective; the first noun generallystands in a genitive relation to the second (cf., § 88, the order m
juxtaposed nouns), while the second noun is followed by the third
personal possessive -da. Such are:
gwen-t'ga*-bo’k‘dan-da at nape of earth’s neck (= east) 79. fi
102.4di-t'ga%-yu'k!wma2-da at rear of earth’s tail (= west) 146.1; 1988
ha-t'ga*-yawa’*-da in earth’s rib (= north) (cf. 194.9)da*-zi-ts:!ek'ts'ligt’'-da alongside water’s backbone(= not fatfrom shore)2G°-xi-ts‘ !ek‘ts: ligt’*da in middle of water’ 8 backbone (= equally
distant from either shore)112.4Ha-ya*l-ba'ls-da’ in its long (i. e., tall) (bals) pines-(yaZ) (= placename)114.9Di-plol-ts!i‘l-da over (di‘)
(= Jump-off Joe creek)|itsred(és/il)bed(plolditch)Al-dan-k!olo'i-da! to its rock (da‘n) basket (k/olot) (= name of
mountain)Rather difficult of explanation is de-de-wilt’-da DOOR, AT DOOR OF
HOUSE 63.11; 77.15; 176.6, which is perhaps to be literally rendered
IN FRONT OF (first de-) HOUSE(wili) 1rs (-da) MouTH(i. e., IN FRONT OF DOORWAY).","[245, 246]"
"§ 70With a reguli8]HANDBOOKOFINDIANLANGUAGES—TAKELMA195erb of saying, such as na(g)-, it is nearly always necessary to report1e exact words of the speaker.
al-xi'*gitn (1) xebeyigi’/k'wanas (2) I saw him (1) hurt him (2)
yok!oya’'n (1) p'im (2) gatk‘na® (3) I know (1) that he has
been eating (3) salmon (2) (literally, I-know-him salmon hehaving-eaten)
al-xi'‘xi (1) tlomozanbanda‘ (2) he saw me (1) strike you (pl.) (2)al-xi'*gien (1) dal-yewe’ida® (2) I saw him (1) run away (2)
Not infrequently an adverb is to be considered the main predicate,
articularly when supported by the unanalyzable but probably
erbal form wala’‘si(na‘), while the main verb follows as a subordi-ate clause.","[200, 201]"
"The same stems are used for both inter-rogative and indefinite purposes, a distinction being made between
persons and things:
|
nek* who? some one 86.2, 23; 108.11
k‘ai what? something 86.5; 122.3; 128.8|
|As independent adverb also PERHAPS:|k‘ai tliimiizi perhaps he’ll strike me 23.3|As interrogatives, these stems are always followed by the interroga |
tive enclitic particle di, k‘ai always appearing as k‘a- when di imme
diately follows:
|
ne'k‘-di who? 46.15; 86.4;
142.9
k‘a’-di what?
47.9; 60.11; 86.8k‘a’i_. . . di occurs with post-positive ga‘a‘l:
k‘a’t ga‘al di‘ what for? why?",[260]
"DemonstrativePronounsandAdvertsFour demonstrative stems, used both attributively and substantively, are found: a-, ga, ida-, and ha*-.
Of these only ga THAT
occurs commonly as an independent word; the rest, as the first elements of composite forms.
are:The demonstratives as actually foundIndefinite. ga that 60.5; 61.2; 110.4; 194.4, 5
Near first. a’ga this 44.9; 186.4; alt this here 110.2; 188.20
Near second. 7’daga that 116.22; tdalt that there 55.16
Near third. ha’*ga that yonder 186.5; Aa‘lt that over there
a- has been found also as correlative to ga- with the forms of na()-DO, SAY:
ana‘ne‘xlikethis176.13122.20)(ga-na'ne‘xthatway, thus114.17;,ana‘na’‘t’ it will be as it is now cf. 152.8 (ga-na‘na’‘t’ it will be
that way)perhaps also in:
ada’t'‘wit everywhere ( = ada*‘t ‘ this way, hither [see § 112, 1] + -wi*
every) 30.12;74.2; 120.13ida- (independently 46.5; 47.5; 192.6) seems to be itself a compoundelement, its first syllable being perhaps identifiable with 7- HAND.
ida‘a’it‘an and haa@’it‘an, referred to above, are in effect the substantive plurals of i’/daga and ha’“ga.
ha*- as demonstrative pronoun is doubtless identical with the local ha@*- YONDER, BEYOND,found as a prefix in the verb.",[258]
"The linguistic material on which this account of the Takelma
language is based consists of a series of myth and other texts, published by the University ofPennsylvania(Sapir, TakelmaTexts,Anthropological Publications of the University Museum, vol. 1, no. 1,
Philadelphia, 1909), together with a massof grammatical material(forms and sentences) obtained in connection with the texts. A
series of eleven short medicine formulas or charms have been published with interlinear and free translation in the Journal of American Folk-Lore (xx, 35-40). A vocabulary of Takelma verb, noun,
and adjective stems, together with a certain number of derivatives,
will be found at the end of the “Takelma Texts.”
Some manuscript notes on Takelma, collected in the summer of 1904 by Mr.",[13]
