Paragraph,Page number
"244Another way of analyzing the structure of Tima verbal adjectives is by
comparing them with the Tima verbal nouns. Both end with the suffix 'Vl', but they differ in the shape of the marker which precedes the verbal
root. What happens is that the verbal noun prefix 'kV-' (nominalizer) is
replaced by the stative marker 'a-' in order to derive the verbal adjectives,
or the opposite is true, because the derivational direction is not clear. In
short, the verbal adjective is derived from the verbal noun by replacing
the nominalizer 'kV-' by the stative marker 'a-'. In this case the verbal
adjectives behave similar to Tima verbs by taking the stative marker 'a-'.
Consider the following examples:
(160)
a) c-ʊraŋa-tɘn-ɘlNC.sg-stickSTAT.sg-break-Adj SUF'the stick is broken'b) kilih
fatNC.sg-cloth'breaking')a-tɘlɘŋ-ɘl
STAT.sg-melt-Adj SUF'the fat is melted'c) c-ɪtɛ(cf. kɘ-tɘn-ɘl(cf. kɘ-tɘlɘŋ-ɘl'melting')a-kwaaɽ-ɛl
STAT.sg-dress on-Adj SUF'the (a piece of ) cloth is dressed'(cf. ø-kwaaɽ-ɛl 'dressing on')245d) ø-wɔrt̪ɘmaadɘha-kʊdʊw-ɛ-ɛlNC.sg-manSTAT.sg-marry-Tr-Adj SUF'the man is married'(cf. ø-kʊdʊw-ɛ-ɛle) iidi
water'marriage')i-tʌʌn-ɨl
STAT.pl-boil-Adj SUF
(cf. kɨ-tʌʌn-ɨl'the water is boiled'f) y-ana
NC.sg-cow'boiling')i-di-t̪-el
STAT.pl-tie-PLUR-Adj N'the cows are tied'(cf. ki-dit̪e-el'tying')In addition, the verbal adjectives are found in attributive positions. In this
case they function as noun modifiers, as in (161). They are structured by
the relativizer 'kV-', which is also attested with adjectives when they
function as attributive modifiers in the NP. In this case the verbal
adjectives behave like pure/content adjectives (Sasse, 1993) 28.
(161) c-ɪt̪ɪ
NC.sg-clothkɨ-bʌrh-ɨlam-bʌrhɨlREL-wash-Adj SUFSTAT-wash-Adj SUF'the washed cloth is torn'It has been found in the data that the verbal adjectives can be derived
from the verbal nouns or abstract nouns (see 5.1.3) which describe stative
situations (mainly deriving from stative verbs) which end in the stative
28The term 'pure/content adjectives is used by Sasse (1993) and Deutscher (2005) to refer to the
English adjectives like 'tall, short, big, small, etc'.","[265, 266, 267]"
"2.2.1.2 Stem modifications
A stem modification is another process which affects word structure; it
involves non-concatenation morphology 5 . Spencer (1991) stated that
stem modifications in many languages indicate grammatical categories by
a shift of vowel, consonant, stress and tone. English is an example where
the vowel alternation device marks tense in verbs such as 'drink/drank/
5The process of non-concatenative morphology indicates that the complex derived word form can not
be easily segmented into different morphemes; instead the morphological process can be described in
process terms (Haspelmath, 2002).",[41]
"313The Tima pronominal system played a great role in the formation of the
verbal word. That is, the pronominal person markers (subject and/or
object) were obligatory on the verb, and without them the meaning of the
verb is incomplete (i.e. according to the syntactic function of the
participants).
The pronominal person markers usually fuse with the markers that
distinguish tense, aspect and mood and they form together a
portemanteau morpheme. Therefore, a separate section has been added in
order to discuss this phenomenon in the language. Tima has a binary
tense system, i.e. it has a two-way distinction, between future and nonfuture. Tima relies heavily on the aspect distinction, i.e. on the
perfectivity and imperfectivity of an action or event. This aspect in Tima
is morphologically marked by different morphemes (e.g. progressive,
habitual, iterative, etc.). With regard to mood, Tima has a number of
different mood types such as imperative, hortative, subjunctive, indicative
and veridical mood. Most of them are marked morphologically.
The verb extensions, as one of the prominent features of Niger-Congo
languages, were discussed elaborately for Tima. The description focused
on the derivational processes that derive verbs out of other verbs. This is
done through a number of different affixes (suffixes) on the verb in
addition to pluractional marking which is marked by different strategies
in the language, including vertical (non-concatenative) morphology.
The chapter concluded by presenting the two different strategies of verbal
negation: (i) with the negative proclitic 'kV-' and the negative enclitic'Vŋ'
and (ii) with the negative expression 'amaŋ'. It is found that Tima has a314common strategy of negating declarative sentences, which is the first one
mentioned above. Moreover, the form of negated sentences depends on
the aspect distinction, e.g. whether it is perfective or imperfective. In the
latter, the negation-marking expression 'amaŋ' is used.
Chapter five covered all the different types of nominal derivation. It is
divided into two main parts. The first part showed how nouns are derived
mainly from verbs and adjectives, besides the diminutive, reduplicated
and ideophonic nouns which do not derive from verbs. It has covered,
first, the structure of verbal nouns and how they differ in their structure
from the common nouns found in Tima. They were classified into
different classes according to their endings. In addition, the different
functions of the verbal nouns were illustrated.
The agentive nouns were included, whereby different types have been
used in order to express the concept of someone who does an action. It
was found that they are formed in most cases by a combination of a
verbal noun and bound elements. In other cases, they are formed
independently from the bound elements.
Abstract nouns were also shown in this chapter. They divided into two
types. The first type included nouns which are derived from verb roots.
They are formed by the processes of prefixation and suffixation. The
second type was derived from adjectives by a process of prefixation. In
addition, other types of nominalized nouns were diminutive, reduplicated
and ideophonic nouns have been presented.
The second part of the chapter has covered the compounding of nouns as
another process of noun formation. Different types of compounds were315found in Tima, such as endocentric, exocentric and co-ordinate
compounds. Each one was dealt with in isolation in order to present its
common structure and the way it behaved in the language.
There are still several areas which have not been covered yet. Therefore,
the study demands further investigation, especially with regard to the
Tima verbal system.","[334, 335, 336, 337]"
"2.2.1.4 Compounding
Compounding is another morphological process shared in the formation
of word structure. Spencer (1991: 309) defined compounding as
""prototypically the concatenation of words to form other words"". A
compound form consists of two/more members of (potentially) open
lexical class. For instance, English allows several types of combinations
of different word-classes (N+N, A+N, V+N, N+V, N+A, A+A, etc.).
Usually, the two items that are brought together in a compound also24appear as independent words in a language on the one hand (e.g.
blackboard). On the other hand, one of the compound elements can
appear as an independent word (e.g. strawberry). Sometimes, both
members of compound are elements that only occur together (e.g.
mushroom) (Fabb, 1998).
According to the structure of compounding, there are various types of
compounding that are widespread across languages. The commonest
types of compounding are: endocentric, exocentric, and appositional/coordinate compounds (for definition see 5.2).
There is a difficulty encountered in various languages when trying to
distinguish between compounds and phrases (especially NP). Fabb (1998)
mentioned that compounds resemble phrasal combination in some ways 6 .
To avoid such resemblance between the two categories a number of
criteria are stated in order to distinguish between them. Firstly, the
phonological criteria sometimes help in that. The suprasegmental
processes, for instance the stress patterns, which are restricted to the
compounds, may differ from those restricted to the phrases (e.g. English,
'the white house').
Secondly, some languages may mark the compounds morphologically.
That is, a morpheme may be inserted between the two words, found only
in compounds, and it considered as a special empty suffix semantically
(e.g. the morpheme 's' in German, 'Volk-s-wagen', 'lit. people's car').","[45, 46]"
"256(177)
*a) Hamid
Hamidku-dudu-ii-dʌtamaad-umurikNEG-show-APPL-1sgspeechNC-Tima language'Hamid does not teach me Tima language'*b) Hamiddudu-ii-dʌtamaad-umurik-ʌŋHamid show-APPL-1sgspeechNC-Tima language-NEG'Hamid does not teach me Tima'The formula of negated intransitive and transitive clauses is as follows:
NEG + VP (includes V + NP (O)) + NEG
It is noticed that the negative particles usually harmonize with the verb
root. In example (174, 175 and 176) above the proclitic negative marker
'kV-' harmonizes with the verb root with regard to the feature of ± ATR
and to the other qualities of the vowel (in terms of frontness, height, or
backness), (Bashir forthcoming).
All tenses (future vs. non-future) of verbs are negated simply by adding
the two negative particles 'kV-' and '-Vŋ'. See the examples above.","[277, 278]"
"4.4.2.3 The perfective vs. imperfective aspect
Comrie (1976: 16) points out that ""perfectivity indicates the view of a
situation as a single whole, while imperfectivity pays essential attention
to the internal structure of the situation"". In Tima, the perfective and
imperfective aspects are closely related to the concept of telicity.
Consequently, verbs can be classified into a number of classes according
to the aspectual and semantic properties of the verb itself; i.e. verbs are
classified according to the concept of telicity. That is, the verb can
inherently be a telic or an atelic verb (see below). These verbs are
characterized as one of the semantic aspectual properties of the situation
or speech event.
Perfectivity indicates completed action with a beginning, middle and end.
In general the perfective aspect in Tima is marked morphologically by a181suffix '-ataŋ' on verbs 9. This suffix indicates both the perfectivity and
completion of an action, especially when it is clearly contrasted with an
imperfective form; see the examples below.
(64)
a) ɛɛ-k-ʌl-ʌk-ataŋ-nin
ASP.PAST.1plexcl-Epen-eat-AP-Comp-1plexcl
'we ate'b) ihinʌ
3plan-tɔma-ataŋ
ASP.PAST-kill-Comp'they killed themselves'c) pɨnʌ
3sga-mɔɔk-ataŋɪhɪASP.PAST-drink-Compmilk'he drank milk'The perfective suffix '-ataŋ' is often pronounced [ata]. The final nasal 'ŋ'
usually disappears in casual speech, see example (65).
(65) ɛn-tɘn-[ata]-dʌ
PAST-break-Comp-1sgc-ʊraŋkulʌʌNC.sg-stickAdv: yesterday'I broke the stick yesterday'9The suffix 'ataŋ' has a number of different functions in Tima language (see the suffix 'ataŋ' on averb). The suffix 'ataŋ' also appears in the imperative forms. In this case it means that an addressee
should complete doing an action/command.
mɔɔk-ataŋ
ɪhɪ
'drink the milk (completely)'/'drink up the milk'1824.4.2.4 Telic/atelic verbs
The word telic originates from the Greek word 'telos' which means 'end'.
Telic verbs refer to situations which have a terminal point; i.e. the
situation has a definite end. The term telic situation corresponds to the
term 'accomplishment'; atelic verbs refer to the situations that can be
protracted indefinitely or be broken off (Lehmann, 1991).
In his book on aspect, Comrie (1976) mentioned that the distinction
between telic and atelic verbs does not involve the verb only but it also
refers to the verb together with its arguments (subject and object). This
situation also holds true for Tima, where the telicity of verbs depends
heavily on the number of arguments as well as semantic and pragmatic
properties associated with the object of a sentence. The verb in Tima can
be described as a telic verb if the object is singular, whereas the same
verb can be described as atelic and has a different form if the object is
plural; i.e. it refers to more than one entity. This usually invovles the
concept of pluractionality in Tima.
(66)
a) kʊt-ɪ
take-Trk-ataw
NC.sg-book'take a book'b) taa
take.PLURy-ataw
NC.pl-book'take the books'183Tima has a number of different verb classes that refer to telic and atelic
verbs. The following paragraphs will present and describe these classes of
verbs.","[202, 203, 204, 205]"
"The following are examples of verbs that contain the suffix '-ʊk/–uk'.
This means that the vowel of the separative suffix harmonizes with the
vowel of the verb root. The suffix '-ʊk/-uk' is a derivational marker which
indicates separative meaning. The examples are:
(157)
StemglossSimple forma) am-bul-uk'he died'biliyʌ'die'b) at̪am-ʊk'exit some one/go out'at̪am'exit'c) ah-ʊk'pour'kuhuuɽul'pouring'd) tar-ʊk'cut down cane'--d) dumdum-uk'keep someone here'dumdume) amʊ-ʊk'wash/have a bath'amaak'detain'
'washyourself'
f) duk-uk'filter the water'duk-ukg) mul-uk'hide oneself'mul-uk'filter'
'hideyourself'
e) pu-uk'blow'/blow out'- puul 'blow out once
(e.g. candle)h) tiy-uk'hit solid things in order to -separates the parts (e.g.
groundnuts)'i) lelum-uk'shout'--242The suffix '-uk' shows that there is a change in a situation which is also
conveying the meaning of separation. The examples in (158) have no
simple forms.
(158)
a) hɛb-ʊk'become happy'b) hɔlɔm-ʊk'become jealous'c) puɽu-w-uk'become warm'd) dahʊ-w-ʊk'become suspicious'e) dɔdʊ-w-ʊk'become homeless'4.5.2.6 Reversive suffix '-Vl'Tima has another kind of verb that conveys the reversive meaning. These
verbs use the suffix '-Vl' to express that meaning. The reversive suffix 'Vl' is considered as a part of the verb stem which derives the reversive
meaning but it does not affect the number of argument. Moreover, the
meaning of the verb can not stand by itself unless the 'Vl' suffix is
attached to it. This suffix is not productive in Tima. It occurs in P2 in
Table (4.5) with its canonical shape of 'VC'. The suffix vowel is
determined by the root weather it should be front/back vowel or ± ATR.
Consider the following examples:243(159)
a) tʊn-ɛl'return'b) raŋk-al'crawl'c) kɔdɔnd-ɔl'role'd) na-tɔlɔl'make peace'e) ʈup-ul'bow'4.5.2.7 Verbal adjective
Having finished discussing the derivational processes with the various
suffixes or markers used in deriving verbs out of verbs (verb-to-verb
derivations in section 4.5), another grammatical mechanism related to
verbs (nominalizing of verbs into a noun as in 5.1.1 or to an adjective).
This alternative process is expressed by deriving a new category called
'verbal adjectives' (Deutscher, 2005). In this case the verb is turning into
an adjective (verb-to-adjective). This term is referred to in Indo-European
languages, for example English, as 'a participle' 27. The participle/ verbal
adjective is a verb that is used to modify a noun, for instance, as in 'the
crying girl' (Deutscher, 2005: 346).
The verbal adjective in Tima is derived from a verb root by adding two
elements to it: the stative marker 'a- (sg)/i- (pl)', which precedes the verb
root and the suffix '-Vl', which follows it (compare the Tima verbal nouns
in 5.1.1). In most cases, the verbal adjectives function as predicates, as in
(160).
27This feature of verbal adjective has been attested in a number of Semitic languages (e.g Arabic and
Hebrew) (Deutscher, 2005).","[263, 264, 265]"
"102(75) ibʌ wajɛnkɔ-kwɔlɔŋ'father's brother's childern'Having finished presenting and analyzing all the Tima noun classes and
kinship terms, we now turn to a presentation of nominal modifiers that
associate with the noun in order to form noun phrases (NPs).
3.2 Nominal modifiers
Tima has different types of nominal modifiers, such as adjectives (3.2.1),
numerals (3.2.2), non-numerals quantifiers (3.2.3), demonstratives
(3.2.4), pronominal and nominal possessive construction (3.2.5). All of
these modifiers follow the head noun which they modify. Therefore,
Tima can be classified as a head-initial language. The following sections
will describe the structure and function of each category and their relation
to the head noun in the NP.
3.2.1 Adjectives
The traditional definition of adjectives identifies them as the class of
words denoting qualities or attributes. Some languages have an open class
of adjectives as the case in English and German, whereas others have a
close class of adjectives as the case in Igbo (Kwa, Niger-Congo, Nigeria)
which has only eight. Other languages lack a distinct class of adjectives
altogether (Schachter, 1985).
In his survey of 17 languages, Dixon (1982) observed that the semantic
types which are mostly associated with adjectives are: dimension, age,103value, and human prosperity. Accordingly, Tima has an open class of
adjectives. The Tima adjectives are not obviously derived from a word of
any other category, see the examples throughout this section.
3.2.1.1 Canonical shape of adjectives
The majority of Tima adjectival roots have initial consonants. The
adjective roots are considered as bound roots. They can not stand alone in
order to give a full meaning. They must be preceded by one of the
prefixes which are determined according to the function of adjectives
(3.2.1.2).","[123, 124, 125]"
"305'the head is(63)
Comp N.sg
a) cidʌ kwɔɔComp N.pl
idʌ kwɔɔgloss
'person/s (lit. body and family)'b) cidʌ kuhidʌ kuh'skeleton/s (lit. body and bone)'c) kabʊh kalʊkyabʊh kalʊk'biceps (lit. meat and the arm)'d) kah cɪɪyah cɪɪ'rib/s (lit. head and eye)'e) cɪlɛyɪ kuuɪlɛyɪ kuu'fang/s (lit. tooth of dog)'f) kuh kidiiyuh kidii'spine/s (lit. bone and back)'5.2.4 Appositional compounds
An appositional compound is defined as ""a type of non-headed/headless
compound"" (Haspelmath, 2002: 89). Tima has a number of such
compounds, which can be translated as 'one who is perfect in doing
something'. In this case the expression 'ʌkʌrʌŋ' which means 'it is perfect'
plus a verb 9 . It always carries a positive connotation. The examples are:
(64)
a) ʌkʌrʌŋ cɔɔ/ikʌrʌŋ cɔɔ'dancer/s (lit. it is perfect who dances)'b) ʌkʌrʌŋ tʊnak'singer (lit. it is perfect who sings)'c) ʌkʌrʌŋ diik'proudly walking (lit. it is perfect who walks)'9The expression 'ʌkʌrʌŋ' can be found independently in the language. It has an adjective root '-kʌrʌŋ' which means 'handsome/ beautiful'. It is used in the predicate function 'a-kʌrʌŋ/ i-kʌrʌŋ', 'it is
beautiful/ they are beautiful'. An abstract noun (adjectival noun) can be formed out of it; 'bɨkʌrʌŋ',
'beauty'.","[326, 327]"
"260Imperfective negation
(182)
a) a-maŋi-k-ʌlʌʌk-ataŋ-nin-ʌŋSTAT-nothing1plexcl-Epen-eat-COMP-1plexcl-NEG'we have not finished eating yet'b) pɨnʌ
3sga-maŋu-mɔɔk-ataŋɪhɪ-y-ʌŋSTAT-nothing3sg-drink-COMPmilk-Epen-NEG'he has not finished drinking milk yet'Moreover, it is found that with certain verbs (both telic and atelic verbs)
the negation of perfective and imperfective differs with regard to the verb
forms. Both perfective and imperfective aspects are negated by the
negative proclitic 'kV-' and the negative enclitic '-Vŋ'. Therefore, in the
case of perfective aspect the negated verb takes the form of telic verbs as
in (183a) below, while in the case of imperfective aspect the negated
form takes the form of atelic verb as in (183b) (see 4.4.2.4).
(183)
a) kʊŋ-kʊt-ɪ-dʌ
NEG.1sg-take-Tr-1sgkataw-ʊŋ
book-NEG'I did not take the book'b) kʊŋ-kʊt-a-dʌ
NEG.1sg-take-IPRF-1sgkataw-ʊŋ
book-NEG'I do not take the book/I won't take the book'261Having finished discussing the Tima verb morphology, the following
chapter will focus on the the processes of nominalizing the nouns and the
major categories from which they are derived from. In addition, the
compound nouns will be described in detail.","[281, 282, 283]"
"15Punctual verbs always contrast with durative/progressive term which usually involves an extended
period of time (Lyons, 1968).",[221]
"200(104)
a) ɛŋ-k-ʌʌ-dʌ
ASP.1sg-Epen-belch-1sg
'I belched'b)*cɛŋ-kʌʌ-dʌ
ASP.1sg-Epen-1sg
'I am belching'(105)
a) ɛŋ-k-umun-nʌ
ASP.1sg-Epen-find-1sg
'I found'
b)* cɛŋ-k-umun-nʌ
ASP.1sg-Epen-find-1sg
'I am finding'Class 8: Stative verbs
According to Comrie (1976), stative situations involve no change. The
stative verbs in Tima are formed by the stative aspect marker '-a', which
is suffixed to the verbs, for instance:
(106)
a) duw-a'stand'b) tuw-ʌ'have a rest'201The stative suffix '-a' usually occurs closer to the verb root; that is why it
is inherent also on the verbal nouns which describe states. For example:
(107)
a) kʊdʊw-a'standing'b) ku-tuw-ʌ'rest'According to the literature on TAM systems, most languages divide up
their predicate phrases into two types of constructions: dynamic vs.
stative constructions. ""The dynamic construction type typically has a full
verb as its head, whereas the 'stative' construction tends to involve nouns
or adjectives in predicative function, with or without a copula functioning
as the dummy head of the predicate phrase"" (Dahl, 1985:28).
In Tima, the nouns in predicate function are not marked by any overt
marker, as in (108a and b) (i.e. in non-verbal predicates). They are
formed without the stative marker '-a'.(108)
a) Kɨdʌ-wʌkabandi1sgteacher'I am a teacher'b) kɨdʌ-wʌ
1sg-FOCku-murik
NC.sg-Tima person'I am Tima person'202The Tima stative marker '-a/-ɪ' is usually employed before adjectives in a
predicate position. Similarly, it has been found in the data that the verbal
nouns are preceded by the stative marker 'a-' in the singular/'i-' in the
plural. In this case, the nouns occur in predicate position, i.e. in the verb
slot (see 4.5.2.7). They function as verbal adjectives in order to express
stative situations in a predicate position. This shows that Tima uses nouns
in a verb slot, and in this case the noun functions as a verb (see 4.5.2.7 on
verbal adjectives). The examples are in (109), (110) and (111).
(109)
a) Kɨdʌ
1sga-t̪əlawʊ
STAT.sg-hunger'I am hungery'b) ɪnɛɛy
1pl(incl)ɪ- t̪əlawʊ
STAT.pl-hunger'We are hungery'(110)
a) Kɨdʌ
1sga-y-iidi
STAT.sg-Epen-thurst'I am thursty'b) inɛɛyi-iidi1pl(incl) STAT.pl-thurst
'we are thursty'203(111)
a) kɨdʌa- cɪlawɛɛl1sgSTAT.sg-tiredness'I am tiredb) ɪnɛɛy
1pl(incl)ɪ- cɪlawɛɛl
STAT.pl-tiredness'we are tired'The examples above can take the full form of stative verbs. That is, the
expression of stative situations consists of the stative marker 'a-' plus a
noun/verbal noun. In addition, Tima nouns can function as a verb
followed by one of the subject pronominal markers, as in (112a and b).
(112)
a) a-ɪbɛʔ-dʌ
STAT.sg-sadness-1sg
'I feel sadness'b) a-t̪əlawʊ-dʌ
STAT.sg-hunger-1sg
'I am hungery'Parallel to nouns, the adjectives in predicate position are also preceded by
the stative marker 'a-/i-', as in (113). They express stative situations (see
3.2.1).","[221, 222, 223, 224, 225]"
"The examples of negative perfective aspect in (181) below indicate that
the situation or the event which is negated is finished completely.
Perfective negation
(181)
a) ki-i-k-ʌlʌʌk-nin-ʌŋ
NEG-1pexcl-Epen-eat-1plexcl-NEG
'we did not eat'b) pɨnʌku-mɔɔkɪhɪ-y-ʌŋ3sgNEG-drinkmilk-Epen-NEG'he did not drink milk'On the other hand, the examples of negative imperfective in (182) below
indicate that the situation or action which is negated has not finished yet.",[281]
"2.2.1.5. Suppletion
By definition, suppletion is the complete (or partial) replacement of one
form by another, as in the English example of 'goes' and went' (Finegan,
2004). This type of suppletive forms is quite common in Greek verbs,
while in North American languages, the suppletive forms are common
among numbers (Matthews, 1991).
Tima has a few suppletive nouns (see 3.1.8), and a considerable number
of suppletive verbs (especially in forming the imperative forms (1sg and
2sg/pl) and with pluractional marking (see 4.4.3.1 and 4.5.1.2,
respectively).
262.3 The noun
This section will be devoted to a presentation of the most important
grammatical categories that are usually associated with nouns: the
number marking system and the noun-class system. These two categories
will be presented and explained with reference to their existence in
African languages.","[47, 48]"
