Paragraph,Page number
"(8.95)ɨwátiyokánaa.... ʂɨnígra_moYoca=VOCDEM1...hawɨ́mia(k)=yamɨ́t=(ʔ)áwhat2SGdo=DISTP=INTER:Pka=yamɨt=(ʔ)á=kato= ́season go=DISTP=NMLZ:P=REL=SPAT‘Grandmother Yoca, this season that went, what did you do?’
664TXT 105:087The verb ak ‘do’ in combination with the negative morpheme yáma ‘not’ is used as
a negative response to a polar question, as illustrated in (8.96). In the affirmative, the
expletive haa ‘yes’ is used, however (Section 4.2.2 on interrogatives).","[707, 708]"
"2334.2.2.3. Other functions of the interrogativeIn Chácobo, interrogative clause-types have a number of related functions apart from
asking for information. As noted in Erikson (2010), questions are used as a form of greeting
and for other social conventions in Chácobo (and Matis). Such expressions diverge from
the prototypical use of an interrogative as inquiring about information because the answer
to the question is always obvious from context. For instance, (4.101) is typically uttered
when someone is done eating and it is obvious. The sentence in (4.102) is always uttered
as a greeting at the beginning of the day. The sentence in (4.103) is uttered when the
speaker can clearly see that her interlocutor has arrived.","[276, 277]"
"...ka=yamɨt=á=kaPAVʃiʃanoatʃ-a=yamɨ́t=kɨ[laughing] go=DISTP=PAS:P=REL badger 1PLCcatch-TR=DISTP=DEC:P‘(Laughs) well we did (once) kill a badger a few months back.’ TXT
095:101-103Another frequent case where experiential readings are found are in responses to
some of the the interviews that were conducted with Chácobo speakers to try to elicit
personal narratives (see Section 1.8.4 on dynamic interviews). One of the questions is
“Have you ever seen an anaconda?”; an example of this question and its corresponding
answer are provided in (9.26) below. Paë Yaquë is conducting an interview with Bosi
Peralta in Cachuelita. I ask Paë to ask Bosi whether she has ever seen an anaconda. Paë
747relays the experiential perfect question to Bosi producing a {A,S}-C construction. Bosi
correspondingly responds with an {A,S}-C construction. Both of these sentences illustrate
that {A,S}-constructions are used for experiential perfects.","[790, 791]"
"4.2.2 Interrogatives
4.2.2.1. Interrogatives - IntroductionAn interrogative refers to a grammatical structure which encodes typically that a speaker
is requesting information from a hearer (Sadock & Zwicky 1985: 178). In Chácobo, the
interrogative clause-type has a number of other functions apart from requesting
information, such as exhortation, greetings and expressions of regret. Typologically, two
types of interrogative constructions are typically recognized; polar and constituent
interrogatives. Polar interrogatives elicit a yes or no answer and constituent interrogatives
question some particular part of a sentence (König & Siemund 2007: 291). There is a
structural distinction between polar and constituent interrogatives in Chácobo. Crossclassifying the distinction between polar and constituent interrogatives is the distinction
223between interrogative verbal predicate and interrogative non-verbal predicate
constructions.
First, I illustrate the distinction between interrogative marking in verbal and nonverbal predicate constructions with the examples in (4.81) and (4.82). As stated above, in
non-verbal predicate constructions, interrogative clauses are marked with the morpheme ní
which occurs between the predicate phrase and the subject as in (4.81). In verbal-predicate
constructions, interrogativity is coded in the clause-type/rank morpheme. This is illustrated
in (4.82). Interrogative clauses are never marked through intonation to my knowledge.","[266, 267]"
"(13.67)paʂakará=kaɨpí=narawEPIS1=REL1SGeat=EPEN‘I am going to eat something raw (lit. that which is unknown and raw).’
TXT 058:202
1045The most typical function of the epistemic kará in the context of noun phrases is to
indicate that the referent has some property associated with it unknown to the speaker
(“some type of X…”). It is difficult to render such sentences with a “literal” translation in
Spanish or English. The Chácobo typically translate them as questions in Spanish (que
clase de, que será …), although they are not structurally interrogatives and they do not have
the illocutionary function of a question. Examples of this function is provided in (13.68),
(13.69), (13.70), and (13.71).","[1088, 1089]"
"839(10.62) a.ánomamátsikai= ́too_muchcoldmother=VOC‘“It's so cold, mother.” (the man said)’
b.ka=tsi=kí=ahóogo=IMM:ITR=DEC:NONP-1SG yesikiáha =ní=kɨsayREP3=REMP=DEC:P‘“I'm going now!” (he said) “okay!” she responded.’ TXT 083:044-045The expression is also very frequently used in a question and answer pair as in the
following example in (10.63) from the story of Nahuapaxahua.(10.63) a.hatsika=tsi=ʔaínawapaʂawa= ́thengo=IMM:ITR=INTER:NONP:2SGNahuapaxahua=VOC‘“Are you going now Nahuapaxahua?” (the barbocuro partridge asked).’
b.ka=tsi=kí=anoʔótʃaʔítago=IMM:ITR=DEC:NONP=1SG1SG:GENuncle‘“I’m going right now uncle.” (Nahuapaxahua responded)’ TXT 061:482The immediate initiation enclitic displays no clear evidence of disourse perseverance.","[882, 883]"
"114(3.3) a.hóni‘man, male’b.yóʂa‘woman, female’c.ʂobo‘house, home’d.bári‘day, sun’e.pístia ‘small, a little’For instance, (3.3a-d) could be felicitously used in response to question such as
hawɨ tsayaʔá ‘what did you see?’. (3.3e) could be used in response to to the question hawɨ
tíʔi piʔá ‘how much did you eat’ or hawɨ ní hawɨ tána ‘what is its size?’.11
The morphemes listed in (3.4) fail the minimum free form test. There is no
discourse context where the elements could be used as a complete (elliptical) utterance. An
example of a grammatical sentence where all of these morphemes occur appears in (3.5).","[157, 158]"
"1.8.4 Dynamic interviews
Dynamic interviews involve two or more participants where one participant asks questions
related to common Chácobo cultural activities (when was the last time you went fishing?
what did you catch?), questions that are meant to elicit narratives at different temporal
distances from the speech time (what were you doing about a month ago? What were you
25doing two weeks ago? What do you plan to do tomorrow/in a week?), and questions that
are meant to elicit speaker perspectives (recount a story that you heard that you don't
believe is true and explain why? Have you ever seen a ghost? How did you know it was a
ghost?). Some of the questions were about stories that had already been relayed to my
interviewing consultants earlier. The interviewing consultants were instructed to attempt
to maintain a dialogue with the other speakers in order to record more conversational
speech. Ostensibly the purpose of recording discourse at distinct temporal distances was to
better understand how tense, aspect, temporal adverbials, and temporal distance
morphemes (or “graded tense” morphemes) were encoded, and their relationship to
perspectival meanings such as reported evidentials and assertive modals. This was
important because the corpus developed from the first year of fieldwork was biased towards
traditional folk stories, which are always in the remote past. The aforementioned interviews
were designed to gather more data about the use of temporal distance morphemes in the
distant and recent past times, and the crasternal (“tomorrow”) and remote future times.
While such interviews were meant to capture more interactional speech, it should be noted
that it is difficult to separate interactional speech registers and monologues at all in my
corpus. The reason is that even in oral histories and folk stories, where one might expect
longer uninterrupted monologues, the Chácobo consistently engage in conversation
throughout, asking clarifying questions to the main speaker, and sometimes stopping to
discuss interpretation of a story in the case of folk stories.","[68, 69]"
"(10.37)nɨamakiánoʔiriahabo=kan=pao=ní=kɨhere-NEGREPpeople3go:TR/PL=3PL=HAB=REMP=DEC:Pnoʔiria tsaka=ʂɨ́ =naha-mɨ́tsinoʔiriapeople3-RFLXP5peopleshoot_with_arrow=REMF=EPENyosi=kan=ikiá
bother=3PL=REP817‘The people of the jungle typically travelled far in order to shoot other
people of the jungle; they bothered each other.’TXT 061:180In contrast to the analysis of =ní where I understood the lack of nominalizer
occuring beside this morpheme to provide evidence that =ní wa sa nominalizer itself, I do
not apply this analysis to the remote future =ʂɨ́ because clauses marked with =ʂɨ́ cannot
function as arguments of verbs and cannot be referential without another nominalizer.
However, the topic requires more research.
Recall that the remote past =ní also disallows clause-type rank morphemes
(position 14 in the sentence) in interrogatives. This is not true of =ʂɨ́, which occurs with
interrogative clause-type/rank enclitics in interrogative constructions. An example of =ʂɨ́
occuring in a question comes from one of Miguel Chavez's explanations of his interview
question to a speaker of Siete Almendros (Benicito River). The remote future =ʂɨ́ is used
in a rhetorical question that Miguel asks to himself while trying to induce the other speakers
to discuss their future plans, dreams and desires in (10.38).","[860, 861]"
"(10.7)hisaadanmipaʔɨ=nílookAdam2SGget_drunk=INTER:REMP‘Hey Adam, did you get drunk (a while back)?’OBSVIt is possible that in questions, however, lack of knowledge is more important than
temporal remoteness is per se and thus the speakers question could be reflective of the fact
that he did not want to communicate that the knew specifically about the time of the specific
event of me getting drunk that he was asking about (see Cable [2013] on the relationship
between remoteness and lack of knowledge).
Some evidence for this comes from a personal narrative of a speaker who reflects
on her thought process as she was taking care of one of her babies. She reflects that she
doesn't know whether the baby had been fed or not. Interestingly, in this case the remote
past is used in (10.8). Given that the speaker presumably knows that it would be impossible
for her baby to be alive if she hadn't eaten for a year or more, =ní cannot possible have the
774interpretation that some Chácobo speakers normally insist on in elicitation. In this case =ní
seems to encode that the speaker simply lacks knowledge concerning when the event might
have taken place.","[817, 818]"
"(4.104)hawɨ́tió-rianípáitʃetʃaʔítawhatbig-AUGINTERpaichebig‘How big the paiche is!’TXT 109:051Conjectural questions are also a way in which interrogative constructions can
diverge from their prototypical function. The Chácobo frequently use interrogative clausetype for rhetorical effect as is illustrated in (4.105).",[278]
"(8.94)hatsikiááwara= ́ha=kíhawɨ́ʂanithenREPtapir=ERG3=DAT3SG:GENpubic_haira(k)=ní=kɨ
kill=REMP=DEC:P
‘Then the tapir gave her his pubic hair.’ TXT 052:712The verb ak ‘do’ will also be used in interrogatives where the action is under
question. In this case the verb ak ‘do’ combines with the constituent interrogative hawɨ
‘what’. An example is provided in (8.95) below.",[707]
"229Table 4.1. Constituent interrogative expressions in Chácobo
FormsimplexTranslation/Part-of-speechSemanticGlosscategorycategoryhawɨ‘what, who’nouninanimatetsowɨ‘who’nounanimatehɨni‘how, what’adjective/adverb property/mannerhɨnawa‘do how’verbmannerhawɨnia‘where, topostpositionallocation, goalquantifierdistancequantifieramountpostpositionalcomitative,where’
complexhawɨ tana‘how far,
how long’hawɨ tiʔi‘how much,
how many’hawɨ ʂobá‘with what,
with who’hawɨ́(no)‘throughinstrumental
postpositionalwhere’spatial
(‘through’)hawɨ kí‘to where’postpositionaldative, goalhawɨniá ka‘from where’postpositionalablative (‘from’)hawɨnia ʔaʂ/ʂo‘from where’postpositionalablative (‘from’)
relates to S/A230The verbal interrogative expression hɨnawa ‘do how’ is illustrated in (4.94) and
(4.95). This expression is morphosyntactically a verb; semantically it questions the manner
in which some event was performed.","[272, 273, 274]"
"30 Prost (1962: 111) states “Transitive object and intransitive subject are both marked by subtraction of final
CV”. The analysis is repeated in Córdoba, Valenzuela and Villar (2012: 47) ‘The absolutive presents two
variants; one form which is trisyllabic and another which is disyllabic with the cut off” (my translation); “El
absolutivo presenta dos variantes: la forma trisilábica y otra disilábisa recortada en la última sílaba.”. Note
that Loos (1973, 1999) questioned this analysis, but did not provide a detailed account of the distribution of
apocope.",[530]
"(15.54)hatsikiátoanoʔíriatsikiá...thenREPDEM2personP5REP...wɨstikákoha=kítʃani=ní=kɨonceCaco3=DATspoken_to=REMP=DEC:P‘And from there, there was one person, and Caco spoke once to him.’ TXT
026:281
(15.55)ɨnika=ní=kɨ=wɨstí=roʔáhakɨbɨ=ní=kɨ1SGlisten=REMP=DEC:P=once=LIMIT3bark=REMP=DEC:P‘I listened to them, they (dogs) barked once.‘65TXT 099:212In this function these morphemes are “clitics” in the sense that they can incorporate intomorphophonological domains (see Chapter 6). They do not obviously display such morphophonological
properties when they modify nouns, but this question requires future research.",[1247]
"(8.160)araha=ʔá=kaha-towɨtsa=kítsikiácry3=NMLZ:P=REL3-PLother=DATP5REPhakɨso=ka(n)=ní=kɨ3criticize=3PL=REMP=DEC:P‘When she (the girl) was crying, they (the community) started criticizing
each other.’ TXT 078:0068.9.4 Comitative or dative obliquesWhen a mutually involved participant is expressed it is either expressed in a dative
postpositional phrase or a comitative postpositional phrase. The distinction appears to be
lexically conditioned. For instance the verb complex rani-na ‘caress’ requires a dative708postpositional phrase, but the verb complex ʂɨko-na ‘embrace (mutually)’ requires a
comitative phrase as illustrated in (8.161).(8.161) a.hatowɨtsa=ki/*=yarani-na=bɨki=ʔái=na3-PLother=DAT/*=COMcaress-ITRCT=ITRCT=NMLZ:IPV=EPEN‘They caressed each other.’
b.hatowɨtsa*=ki=/yaʂɨko-na=bɨki=ʔái=na3-PLother*=DAT/=COM embrace-ITRCT=ITRCT=NMLZ:IPV=EPEN‘They embraced each other.’ELICThat verb-na combinations select for specific postpositional phrases, headed by
either =yá ‘comitative’ or =kí ‘dative’, suggests that it is a simplification to regard the latter
as obliques. The question of what precisely the distinction is between arguments and
obliques in Chácobo still requires future research (see Zariquiey [2017] for a new approach
to this question in Kakataibo).","[751, 752]"
"Interrogative scope testIIIInterraction with negationIII“No one said this”
Cancellation: stronger evidence
“I saw it”1101As stated in the introductory paragraphs, the semantic tests were only conducted
with two Chácobo speakers and thus should be regarded as tentative. Future research on
Chácobo might reveal that some of the results of the tests should be reconsidered. Future
research on the semantics of reportatives might reveal that some of the tests are less reliable
than others or should be tossed out completely.
These considerations aside, if we take the results at face value, they challenge a
common assumption in the literature that reportatives are either modal or illocutionary
operators. The results of the tests applied to Chácobo might suggest that the reportative in
Chácobo is intermediary. In a sense the results lend support to Bruil’s (2014), since they
suggest a correlation between morphosyntactic position and semantics.
Another interesting question is whether the reportatives should in fact be regarded
as one morpheme across all of the reportative constructions described above. It is possible
that the meaning differences can be associated with different positions in constructions and
that there is no need to posit distinct reportative morphemes (one a clause-type morpheme
and the other a modal operator). This question requires future research.","[1144, 1145]"
"16 I cannot confidently say at this point which pattern of combination with respect to position 3 suffixes isthe most common, because I have not conducted a statistical analysis of the lexicon. It is my impression that
the most common pattern is that roots do not combine these suffixes. The roots that require transitivity
suffixes appear to be the oldest in the sense that my experience suggests one is more likely to find cognates
between these roots another verb roots of other Pano languages. This question requires future research.",[311]
"(6.19)[ jó.sì.ʔì. kà.kí.à ]
yósi=ʔika=kí-abother=CONCUR:S go=DEC:NONP-1SG
‘I am going to bother (some people).’The rules of glottal stop deletion stated above display a high degree of speaker
variation in the sense that some speakers are more prone to delete glottal stops than others.
The Chácobo write the glottal stop with an <h> and frequently disagree concerning whether
the <h> should be written in certain examples or not.
Furthermore, it is not even clear to me that the cases of glottal stop deletion
described above with =(ʔ)i should really be considered glottal stop deletion. It seems
plausible that the underlying form might be without a glottal stop, and that a glottal stop is
inserted in certain cases above. This question requires more research.",[435]
"DEM2‘When she moved away she moved like this and he jumped on the moon
woman (he missed her) but then quickly grabbed that one (the moon
woman).’ TXT 046:039 -041In order to achieve a more precise understanding of the semantics of nominal
demonstratives in Chácobo Wilkins (1999) demonstrative questionnaire was applied with
two speakers in the field. Below I present some of the results of the application of the
demonstrative questionnaire with brief descriptions of the relevant scenes from the
questionnaires above each example question.
As stated above the demonstrative náa is a speaker-oriented. When the referent is
close to the speaker naa is used. Evidence for this is provided in (15.106) where naa is
used to refer to the speaker’s own body-part.",[1274]
"(13.93)CACO:
a.hamaha-kíhabi=ʔái=kaawíbut3-ACClearn=NMLZ:IPV=RELwomansihsihpasIDEOIDEOIDEO‘…But the agouti woman was accustomed to shooting her snot into it (the
chicha) with the sounds “sih sih pas”.’
b.tsakaka= ́rɨʃoɨa(k)=ita=ʔa=ráagouti=GENmucus1SGdo=RECP=NMLZ:P=ASSi=ikiánaahonisay=REPDEM1man‘“Dammit! I drank the mucus of the agouti!” Nahuapaxahua said’53 In Chácobo stories there is near obligatory interaction between the story teller and the listener. Paë doesnot necessarily utter his question in (13.93c) because he does not know that Nahuapaxahua saw the agoutis
(in fact all Chácobo familiar with the story know this), but rather to index his continued involvement in the
discourse.",[1102]
"(13.64)tɨa=kan=(ʔ)á=kahamakará=kamabokoríwago_around=PL=NMLZ:P=RELbutEPIS1=RELMabocorihua‘(The vulture) was circling around him, but (he only suspected) it might be
Mabocorihua.’ TXT 063:158
1044(13.65)tsowɨ kará=ka
whotoʔikará=kabo=kas=ki=a=rɨEPIS1=REL TohiEPIS=RELbring=DES=DEC:NONP=1SG=REGi=konahasay=CNTDIR:ITR:SG 3=ní=kɨ
=REMP=DEC:P‘“Who could it be, I think its Tohi, I regret not being able to bring her”’ he
came (to the village) said (this) and left.’ TXT 115:244The epistemic kará=ka has an indefinite pronoun-like function in combination with
the question word hawɨ ‘what’ as shown in (13.66).","[1087, 1088]"
"P]VCA#bakiʃmarínaakɨkɨtíkɨkɨ́ =kɨrámimorningDEM1songsing=DEC:PRami‘Rami had been singing this song since this morning.’b.bakiʃmaríA[rami= ́naa
750P]
kɨkɨtíVCkɨkɨ=kɨmorningRami=ERGDEM1songsing=DEC:P‘Rami had been singing this song since this morning.’ELICAnother universal perfect context is prompted by the question in (9.29) below.
Changing the constituent order such that the {A,S} argument follows the clause-type/rank
morpheme as in (9.29b) results in a past perfect interpretation, and is infelicitous in the
context because the sentence does not imply that Caco was continuously sick from Monday
until the speech time. The (9.29a) construction is considered appropriate in this context,
showing that only this construction is compatible with universal perfect interpretations.","[793, 794]"
"876(11.29) a.i-ʔ-i=baʔinaɨ=ʔá=katresbari = ́do~EPEN~do=ALL/EACH_DAY 1SG =NMLZ:P=RELthree day=SPATtsi ɨnoʔononoma = ́panɨkɨyo=ʔiP51SG:GENduck=SPATbeside 1SG finish=CONCUR:S1SGɨyamɨ(t)=kɨ
DISTP=DEC:P‘Every day for three days, I was finishing beside my ducks.’
b.i-ʔ-i=baʔinaɨ=ʔa=kahiwido~EPEN~do=ALL/EACH_DAY1SG=NMLZ:P=REL logkatia~ katia=baʔinaɨwa=yamɨ(t)=kɨcarry~ carry=ALL/EACH_DAY1SGTR=DISTP=DEC:P‘When I was doing this every day, I was carrying lumber every day.’
TXT 095:58-59One might conclude that because =baʔiná displays discourse perseverance and
because it occurs mostly in subordinated clauses, that it necessarily encodes given or old
information, for example, in cases where it is already established in prior discourse that the
events in question are taking place throughout the day. While the expression of old
information appears to be a strong tendency of this morpheme, the enclitic can express new
information. In the sentence in (11.30), the main verb expresses given information and the877new information is found in the enclitic =baina. The main verb repeats information from
the previous clause, while =baʔiná adds new information.(11.30) a.b.a(k)=bɨriátsibɨ=tɨkɨ(n)=kán=(ʔ)ikiákill=DO&COME:TR/PLP5come:PL/TR=AGAIN=PL=REPho~hó=baʔina=kan=(ʔ)áikiácome~come=ALLDAY=3PL=NMLZ:IPVREP‘When they killed them (the Siriono), they returned [home]. It is said that
they returned taking the whole day.’ TXT11.3.2 All day vs. every dayIt appears that the two interpretations of =bainá, “all day, next day” versus “every day”,
are conditioned by discourse context, although more research on this question is needed.
In elicitation contexts, speakers state that either or both interpretations are permissible.","[919, 920, 921]"
"(4.71)tʃanisiriyoa=ʔai=kastoryoldtell=NMLZ:IMPFV=RELɨnika=ʔii=pao=ní=kɨ1SGlisten=SSAUX=HAB=REMP=DEC:P‘I was always listening to the the old story that she (my grand mother) was
telling’ TXT 022:027215The next auxiliary verb construction is the regretative i-auxiliary verb
construction. In this construction the auxiliary is i ‘intransitive’, the negative/antonymic
=ma combines with the main lexical verb, and the modal enclitic =rɨ́ ‘regretative’ occurs
directly after the clause type/rank morpheme =kɨ ‘declarative, past time’ (see Section
13.14). This construction type refers to a counterfactual event that the speaker regrets or
laments not performing. In Spanish, it is often translated as a question that a speaker poses
to oneself. An example of this auxiliary construction is provided in (4.72a) with some of
the discourse contact in (4.72a).","[258, 259]"
"(13.72)aʃi=ma=títóahawɨkará=kaororótsobathe=CAUS=NMLZ:PURPDEM2whatEPIS1=RELtype_of_plant‘That bathe (is for), … what is it called? …. the ororotso plant.’
TXT 115:083104713.9. EPISTEMIC 2 tiáThe morpheme tia has epistemic functions related to uncertainty and non-epistemic
functions related to lack of commitment, interest or volition. It is very common for the
morpheme tia to combine with the epistemic kará described in the previous section. In
such cases the function of tiá is strictly epistemic. The combination of kará and tiá seems
to express that a proposition is true out of necessity even in the absence of information
concerning how it came about.
The combination of kará and tiá typically occurs with a constituent interrogative.
The sentences are not structurally interrogative in the sense that they do not contain an
interrogative clause-type morpheme. They also do not have the illocutionary force of a
question. Examples are provided in (13.73) and (13.74).","[1090, 1091]"
"(10.64)MIGUEL CHAVEZ:
a.naaho=ʔái=kasemana= ́tsiwaitsiDEM1come=NMLZ:IPV=REL week=LOCP5farmplotP5a(k)=ika=ʔaíalegré=nodo=CONCUR:S go=INTER:NONP:2SGAlegre=SPAT‘Next week are you going to make your chaco in Alegre.’841IBA TOLEDO:
b.haanaasemana= ́tsia=ika=kí=ayesDEM1week=SPATP5do=SSgo=DEC:NONP=1SG‘Yes in this week I will go.’
c.a(k)=bɨriáha-tóɨpaísahawɨdo=DO&COME:TR/PL P53-ACC:PLuncle3SG:GEN accountkopi=bɨriátoapay=DO&COME:TR/PLtsiDEM2waikuenta…chacoa(k)=bɨriátsihaʔarí ho=tɨkɨ(n)=kido=DO&COME:TR/PLP5stillno-acome=AGAIN=DEC:NONP 1PL-EPENnɨa= ́no
here=SPAT
‘After doing this and after paying the account of his uncle we are going to
return again to that chaco here.’TXT 101:108-110Similarly in (10.65), Miguel Chavez uses =ki throughout his question to refers to
events which will occur on consecutively ordered days. No TDMs are used for any of the
sentences below in (10.65).","[884, 885]"
